title,company,location,date,url,department,workplace_type,source,description,position_type
מיישב/ת תביעות סיעוד,הראל,רמת גן,2026-07-01,https://career.adamtotal.co.il/Jobs/JobDetails?token=NWk1WHJWZkVhOEFXdFROZnNleGR5a21kZllIaGd2WU5MUVJoaDROTFdOTnY3MTBKMVRPM2p0TGVQVHEyTUNzbWtIdHZUOFVWZXR5TDYrQVllbWdhdnc9PQ==&shr=&eid=,צוות תביעות סיעוד 1,onsite,harel,"איך יראה היומיום שלך? טיפול מקיף בתביעות ביטוחי סיעוד , משלב הפנייה ועד לקבלת ההחלטה הסופית בדיקת זכאות על פי תנאי הפוליסה והבטחת מיצוי זכויות המבוטח קריאה והבנה של מסמכים רפואיים בעברית ובאנגלית עבודה שוטפת מול מחלקות פנימיות וגורמים חיצוניים מה אנחנו מחפשים ? ניסיון קודם בתחום השירות \ תפעול- חובה היכרות עם עולם הביטוח – יתרון ניסיון קודם כמיישב\ת תביעות- יתרון יכולת ניסוח גבוהה בכתב ובעל פה , הקפדה על דיוק ותשומת לב לפרטים היקף משרה: משרה מלאה, ימים א'-ד' 8.5 שעות, יום ה' - 6 שעות + נכונות לשעות נוספות במידת הצורך יום עבודה מהבית אנחנו על המפה: רמת גן, מתחם הבורסה, צמוד לרכבת סבידור מרכז",
נציג/ת שירות במוקד המשפחתי בתחום הסיעוד!,הראל,בית מ.א.ה,2026-07-01,https://career.adamtotal.co.il/Jobs/JobDetails?token=NWk1WHJWZkVhOEFXdFROZnNleGR5a21kZllIaGd2WU5MUVJoaDROTFdOTXNFTXljM2ZlTVBpRjVTc1NJd0VqOTltY2ZSRFQzYnA0SlJIRU00ZHQyNkE9PQ==&shr=&eid=,מוקד שירות - דקלה,onsite,harel,"איך יראה היום יום שלך? מענה ללקוחות החברה בשיחות נכנסות בתחום סיעוד, מתן הסבר על פרוצדורות, כיסוי ביטוחי ועוד :) לא נדרש ניסיון קודם - הכשרה על חשבוננו! אנחנו מחפשים אנשים בעלי זיקה שירותית, עם אנרגיה מעולה ובעלי רצון ללמוד ולהתפתח עובדי חברת הראל החל מהיום הראשון קרן השתלמות מהיום הראשון תשלום יום מחלה מהיום הראשון ביטוח בריאות רחב לאחר חצי שנה מסלולי קריירה וקידום מקצועי היקף משרה : משרה מלאה, א'-ה' (יש גמישות להורים ולמשרת סטודנט 4 פעמים בשבוע) אנחנו על המפה: רמת גן, מתחם הבורסה, צמוד לרכבת סבידור מרכז והרכבת הקלה",
נציג/ת מכירות [4000],הראל,רמת גן,2026-07-01,https://career.adamtotal.co.il/Jobs/JobDetails?token=NWk1WHJWZkVhOEFXdFROZnNleGR5a21kZllIaGd2WU5MUVJoaDROTFdOTlBTT3Jid3lxanVKVmhwcGZIUm12Qi9leFRGZVlzcVdLeEdJOEhlL2o4aWc9PQ==&shr=&eid=,הדרכה90009754,onsite,harel,"איך יראה היומיום שלך? שיחות יוצאות ללקוחות 5 משמרות בשבוע כולל ימי שישי פעם בחודש שכר בסיס + הגנת שכר + בונוסים גבוהים הכשרה ע""ח החברה ובנוסף ליווי מלא בחודשים הראשונים לתפקיד . זכאות לביטוח בריאות פרטי תחרויות ופרסים באווירה כיפית אופציות קידום והתפתחות נרחבות! מענקים נוספים על פי ותק עובד במהלך השנה מה אנחנו מחפשים? ניסיון במכירות/במוקד מכירות טלפוני - יתרון משרה מלאה מיקום רמת גן, מתחם הבורסה בצמוד לרכבת סבידור מרכז ולרכבת הקלה",
מיישב/ת תביעות רכב חובה- זמני,הראל,בית מ.א.ה,2026-07-01,https://career.adamtotal.co.il/Jobs/JobDetails?token=NWk1WHJWZkVhOEFXdFROZnNleGR5a21kZllIaGd2WU5MUVJoaDROTFdOTURRSExqWjQ5eDZ3UnI3SVpLR25nS3FOenBQR2JJTVpzTVZTWmhNVEhDZEE9PQ==&shr=&eid=,צוות מור - תביעות רכב חובה,onsite,harel,"מסלק לצוות נפגעים ישירים איך ייראה היומיום שלך? טיפול וסילוק תביעות גוף שנגרמו עקב תאונת דרכים קבלת מסמכים ממבוטחים לגבי הנזק מהתאונה ייזום שיחות למבוטחים לצורך טיפול בתביעות בדיקת הכיסויים הביטוחיים ניהול מו""מ מול נפגעי/ות ישירים, אישור/ דחיה וביצוע התשלום מה אנחנו מחפשים? תעודת בגרות מלאה- חובה יכולת ניהול מו""מ ברמה גבוהה - חובה אוריינטציה מכירתית ושירותית תואר ראשון- יתרון הכרות של נושא שיבובים והשתתפויות בין חברות הביטוח- יתרון היקף משרה: משרה מלאה, ימים א'-ד' 8 וחצי שעות עבודה, יום ה' 6 שעות עבודה ( חמישי קצר) אנחנו על המפה: מתחם הבורסה ברמת גן, בסמוך לרכבת סבידור מרכז ולרכבת הקלה",maternity_cover
מנהל/ת תיקי לקוחות,הראל,גוש דן,2026-07-01,https://career.adamtotal.co.il/Jobs/JobDetails?token=NWk1WHJWZkVhOEFXdFROZnNleGR5a21kZllIaGd2WU5MUVJoaDROTFdOTlkzMWRXTVhPeTQ4c3dhb3d4K0JWalpVeXRIQkJpS0thZDVCdTRucXVTT2c9PQ==&shr=&eid=,מחלקת שימור ניוד,onsite,harel,"איך ייראה היומיום שלך ? שיחות יוצאות למבוטחים אשר העבירו בקשה להעברת כספים/ביטול הפוליסה הקיימת בכל מוצרי חא""ט זיהוי צרכי הלקוח והתאמת המוצרים הפנסיונים אחריות לתפעול השוטף וסגירת מעגל טיפול מתן מענה מקצועי למבוטחים עמידה ביעדי מכירות יומיים וחודשיים תגמול גבוה במיוחד למתאימים! מה אנחנו מחפשים? בעל/ת רישיון בביטוח פנסיוני – חובה רקע בתחום החיסכון ארוך טווח – יתרון משמעותי רקע וניסיון בתפקידי שירות ומכירה ללקוחות – יתרון היקף משרה: משרה מלאה, גמישות בשעות ימים א'-ה', 8.5 שעות ביום אנחנו על המפה: רמת גן, מתחם הבורסה, צמוד לרכבת סבידור מרכז",
מבקר/ת פנים,הראל,גוש דן,2026-07-01,https://career.adamtotal.co.il/Jobs/JobDetails?token=NWk1WHJWZkVhOEFXdFROZnNleGR5a21kZllIaGd2WU5MUVJoaDROTFdOTlo2YllWMWl6MkFqQWpBRURqQjc4d05kdTNmOFZDUGZwb1Z6cy9OdWxtbXc9PQ==&shr=&eid=,מחלקת ביקורת פנים 2,onsite,harel,"איך ייראה היומיום שלך ? ביצוע ביקורות חוצות ארגון , לרבות ניתוח תהליכי עבודה ונתונים תוך זיהוי חשיפות. קיום פגישות עם בעלי תפקידים בדרגים שונים. כתיבת דוחות ביקורת והצגת הממצאים בכתב. מה אנחנו מחפשים? אנו מחפשים מבקר/ת פנים למחלקת ביקורות פנים בעל/ת ניסיון של 1-2 שנים לפחות בביקורת פנים במשרד רו""ח גדול/ חברות ביטוח/ שוק ההון/ בנקים. רואה/ת חשבון לאחר סיום התמחות (יתרון). שליטה מלאה בישומי e Offic היקף משרה: משרה מלאה, ימים א'-ה', 8.5 שעות ביום אנחנו על המפה: רמת גן, מתחם הבורסה, צמוד לרכבת סבידור מרכז",
בקרה איכות מכר,הראל,רמת גן,2026-07-01,https://career.adamtotal.co.il/Jobs/JobDetails?token=NWk1WHJWZkVhOEFXdFROZnNleGR5a21kZllIaGd2WU5MUVJoaDROTFdOTnIwNzJaUUV1M3Ftb2xqQkdxaDRma3NNbzZOZ2k3ZW1EVERONFZVekh2UGc9PQ==&shr=&eid=,תהליכי איכות מכר ופניות הציבור -  סטנדרד,onsite,harel,"אנחנו מחפשים נציג/ת בקרת איכות! חמישי מקוצר! במסגרת התפקיד: • ביצוע בקרה והאזנה על הצעות ופוליסות סיכונים מקצה לקצה – משלב הקליטה ועד להפקה • בדיקת תקינות נתונים ומסמכים בהתאם לנהלי החברה והרגולציה • זיהוי חריגות, פערים ותקלות בתהליך ומתן פתרונות בזמן אמת • תיעוד פעולות ובקרות במערכות החברה מה אנחנו מחפשים? • ניסיון קודם בתפעול/בק אופיס/בקרה – יתרון משמעותי • היכרות עם תחום הסיכונים/המשכנתאות ו/או הביטוח – יתרון היקף המשרה: משרה מלאה, א'-ד' – 8.5 שעות יום ה' מקוצר – 6 שעות בלבד! מיקום המשרה: פתח תקווה - על ציר ראשי של ז'בוטינסקי, בצמוד לרכבת הקלה",
מנהל/ת השקעות - מימון פרוויקטים תשתיות,הראל,רמת גן,2026-07-01,https://career.adamtotal.co.il/Jobs/JobDetails?token=NWk1WHJWZkVhOEFXdFROZnNleGR5a21kZllIaGd2WU5MUVJoaDROTFdOUEdNRXNOOWh0WXRrNXRDYzF5ZkdHd2pTU28wY3BPb1NmMGhUVEJsQ0huT2c9PQ==&shr=&eid=,מחלקת אשראי פרויקטים ותשתיות,onsite,harel,"איך ייראה היומיום שלך ? ניתוח כדאיות מתן הלוואות ועסקאות אשראי בליווי פרויקטים בתשתיות. ייזום עסקאות ניהול מו""מ וקשר שוטף מול לקוחות, בנקים ויועצים. אינטגרציה מול יועצים חיצוניים. מעקב ובקרה אחר עסקאות אשראי שבוצעו, ניהול וטיפול שוטף בהלוואות. הצגת עסקאות לוועדות ההשקעה. מה אנחנו מחפשים? תואר ראשון בכלכלה / מנהל עסקים / חשבונאות ניסיון בתפקיד דומה של מימון או ייזום פרויקטים בתשתיות – מינימום שנתיים. הכרות עם שוק ההון ושוק המימון הכרת מודלים למימון פרויקטאלי אקסל ברמה גבוהה מאוד היקף משרה: משרה מלאה, ימים א'-ד, 8.5 שעות ביום, יום ה'- 6 שעות אנחנו על המפה: רמת גן, מתחם הבורסה, צמוד לרכבת סבידור מרכז ולרכבת הקלה",
רכז/ת דסק מעסיקים,הראל,בית הראל רמת גן,2026-07-01,https://career.adamtotal.co.il/Jobs/JobDetails?token=NWk1WHJWZkVhOEFXdFROZnNleGR5a21kZllIaGd2WU5MUVJoaDROTFdOTjZ3d24yU1MzZEhlTTFXR2V2d3JXNlAzbkNaOUp6aGpSUkxSZE5oNytoSEE9PQ==&shr=&eid=,דסק מעסיקים,onsite,harel,"איך ייראה היומיום שלך ? מתן מענה לפניות במייל למעסיקים מתן מענה טלפוני למעסיקים (3 שעות בלבד של מענה טלפוני ביום) ניתוב פניות לגורמים הרלוונטיים הפקת דו""חות במערכות התפעול מה אנחנו מחפשים? ידע מקצועי בתחום הביטוח והחיסכון – יתרון משמעותי ניסיון בעבודה במוקדים – יתרון משמעותי תודעת שירות גבוהה ואדיבות מוסר עבודה גבוה וחריצות יסודיות וירידה לפרטים הקטנים היקף משרה: משרה מלאה, ימים א'-ד' - 8.5 שעות ביום, יום חמישי - 6 שעות אנחנו על המפה: רמת גן, מתחם הבורסה, צמוד לרכבת סבידור מרכז ולרכבת הקלה",
בקר\ית חקירות,הראל,גוש דן,2026-07-01,https://career.adamtotal.co.il/Jobs/JobDetails?token=NWk1WHJWZkVhOEFXdFROZnNleGR5a21kZllIaGd2WU5MUVJoaDROTFdOT0xuc3c2MFhiZWRpOHhudzJ6TzhKcHZzdHowUTRPdW84VVFHMG14Y0RYMkE9PQ==&shr=&eid=,צוות אימות נתונים90009604,onsite,harel,"איך ייראה היומיום שלך ? קבלת הפניות חקירה ממיישבי התביעות ובאי כוח חיצוניים ביצוע פעולות חקירתיות הפניית חקירות למשרדים חיצוניים ביצוע בקרה שוטפת על תוצרי חקירות/זמני טיפול/שכ""ט מתן שירות שוטף ללקוחות המחלקה מה אנחנו מחפשים? רישיון חוקר ממשרד המשפטים - חובה ניסיון בעבודה בתחום חקירות ביטוח (רכב, רכוש וחבויות) מינימום 3 שנים – חובה ניסיון מחברות ביטוח – יתרון משמעותי שליטה באופיס, מאגרי מידע/מידענות – חובה תואר אקדמאי -יתרון היקף משרה: משרה מלאה, ימים א-ה' 8.5 שעות ביום, שעות נוספות לפי דרישה. אנחנו על המפה: רמת גן, מתחם הבורסה, צמוד לרכבת סבידור מרכז",
סוחר חדר מסחר,הראל,גוש דן,2026-07-01,https://career.adamtotal.co.il/Jobs/JobDetails?token=NWk1WHJWZkVhOEFXdFROZnNleGR5a21kZllIaGd2WU5MUVJoaDROTFdOTVEyODhLTW13Ni9KT0hnV29aZ005OUtSMHd2cUt2L2NaZDVtT3g2S3BucWc9PQ==&shr=&eid=,מערך השקעות ומסחר ניהול תיקים,onsite,harel,"איך ייראה היומיום שלך ? מסחר במוצרים עוקבי מדדים בבורסה מקומית ובשווקים בינ""ל. מסחר בניירות ערך ישראלים וזרים. תפעול ותחזוקה של מערכות מחשוב ייעודיות. תכנון והקצאה של תיקי השקעות. מה אנחנו מחפשים? תואר ראשון רלוונטי – חובה (כלכלה, מנהל עסקים, תעשייה וניהול, חשבונאות ללא התמחות) היכרות עם שוק ההון, מניות, אג""ח וכו'– חובה ניסיון תעסוקתי (למשל כסוחר בבית השקעות) - יתרון אקסל ברמה גבוהה – חובה היקף משרה: משרה מלאה, ימים ב'-ה', 8.5 שעות ביום, יום ו',6 שעות. אנחנו על המפה: רמת גן, מתחם הבורסה, צמוד לרכבת סבידור מרכז לרכבת הקלה",
רפרנט/ית מיכון הסכמים ודמי ניהול,הראל,בית הראל רמת גן,2026-07-01,https://career.adamtotal.co.il/Jobs/JobDetails?token=NWk1WHJWZkVhOEFXdFROZnNleGR5a21kZllIaGd2WU5MUVJoaDROTFdOTVRQR2xhRkJzZVJQY0ZRVmljblJCZnk4SGwrY2xnb1NORFdCekQwd1FOZnc9PQ==&shr=&eid=,צוות מיכון הסכמים,onsite,harel,"איך ייראה היומיום שלך ? אחריות על מיכון הנחות והסכמים, ומיכון עמלות סוכנים במערכת מעקב ומתן מענה מקצועי בנושא הנחות ועמלות מול גורמי ההפצה השונים של הקרן ועדכון הסכמי מעסיק במערכת מתן שירות במייל למוקדי/רפרנט סוכנים, מפקחים ושירות לקוחות מה אנחנו מחפשים? רקע בתחום הפנסיה והגמל ועולמות הביטוח - יתרון משמעותי ניסיון בתפקיד תפעולי - יתרון משמעותי היכרות מערכת הבוסנובה - יתרון היקף משרה: משרה מלאה, ימים א'-ד' 8.5 שעות עבודה, יום ה' – 6 שעות עבודה בלבד! לאחר חפיפה – יום עבודה מהבית. נדרשת נכונות לביצוע שעות נוספות לפי הצורך אנחנו על המפה: מתחם הבורסה ברמת גן, צמוד לרכבת סבידור מרכז",
מזכיר/ה אגפי/ת,הראל,בית הראל רמת גן,2026-07-01,https://career.adamtotal.co.il/Jobs/JobDetails?token=NWk1WHJWZkVhOEFXdFROZnNleGR5a21kZllIaGd2WU5MUVJoaDROTFdOUEw4VUd5bnRGN3RxcXlESm1EYm1Gd0p2elV2b1JXRmFjbEZtRXFkWitJaFE9PQ==&shr=&eid=,אגף פנסיה וגמל,onsite,harel,"איך ייראה היומיום שלך ? ניהול יומנים של 2 מנהלים/מנהלות תיאום פגישות וזימון חדרי ישיבות זימוני חניה ואישורי כניסה הזמנת ציוד משרדי ריכוז משימות אגפיות ניהול ממשקים רבים סיוע בארגון אירועים חטיבתיים מה אנחנו מחפשים? שליטה בתוכנות אופיס- חובה ניסיון במזכירות- יתרון משמעותי ניסיון בעבודה תפעולית – יתרון היקף משרה: משרה מלאה, 8.5 שעות ביום, היתכנות לשעות נוספות לפי צורך. אנחנו על המפה: רמת גן, מתחם הבורסה, צמוד לרכבת סבידור מרכז",
עוזר/ת גזבר/ית אגף כספים,הראל,בית הראל רמת גן,2026-07-01,https://career.adamtotal.co.il/Jobs/JobDetails?token=NWk1WHJWZkVhOEFXdFROZnNleGR5a21kZllIaGd2WU5MUVJoaDROTFdOTTlHSHFKSnRlajNESmdWQzdPLy92aVRyMGR1Y3MrNTlxbit5TFVmY055RVE9PQ==&shr=&eid=,מחלקת גזברות,onsite,harel,"איך ייראה היומיום שלך ? טיפול שוטף בהתאמות יומיות העברות בנקאיות בין הבנקים והחוצה מעקב ובקרה על חשבונות הבנקים התנהלות מול הבנקים, בדיקות ועוד. התנהלות פנים וחוץ ארגונית. התעסקות עם כספים ותשלומים בסכומים גבוהים טיפול ישיר בתשלומים באתרי בנקים מה אנחנו מחפשים? הנה""ח סוג 2 ומעלה- חובה ניסיון של כשנתיים בתשלומים / הנה""ח / כספים - חובה שליטה בסביבה ממוחשבת – אופיס , אקסל- חובה היקף משרה: משרה מלאה, ימים א-ה' 8.5 שעות ביום, שעות נוספות לפי דרישה אנחנו על המפה: רמת גן, מתחם הבורסה, צמוד לרכבת סבידור מרכז",
רפרנט/ית פדיונות פנסיה וגמל,הראל,בית הראל רמת גן,2026-07-01,https://career.adamtotal.co.il/Jobs/JobDetails?token=NWk1WHJWZkVhOEFXdFROZnNleGR5a21kZllIaGd2WU5MUVJoaDROTFdOT2NpV2NMeG4vMVNPQytqOUlnNGc5TmJpdTdINmloL09GeGlRaTBNS1RFY1E9PQ==&shr=&eid=,צוות פדיונות פנסיה וגמל,onsite,harel,"איך ייראה היומיום שלך ? מתן מענה מקצועי כתוב לפניות המתקבלות ממוקד השירות, סוכנים וגורמים נוספים בחברה ניהול בקשות לביצוע פדיון מקצה לקצה על ידי מערכות התפעול עבודת צוות וחתירה לסגירת מעגל טיפול ביצוע בקרות בטרם תשלום עמידה ביעדי איכות וכמות מה אנחנו מחפשים? היכרות עם תחום הפנסיה/הגמל/הפיננסי – יתרון משמעותי ניסיון בבק אופיס – יתרון היקף משרה: משרה מלאה, לאחר חפיפה יום עבודה 1 מהבית 8.5 שעות בימי א'-ד' ו6 שעות ביום ה' נכונות לשעות נוספות, ימי שישי וחול המועד לפי צורך אנחנו על המפה: רמת גן, מתחם הבורסה, צמוד לרכבת סבידור מרכז",
בודק/ת QA,הראל,חיפה והקריות,2026-07-01,https://career.adamtotal.co.il/Jobs/JobDetails?token=NWk1WHJWZkVhOEFXdFROZnNleGR5a21kZllIaGd2WU5MUVJoaDROTFdOTVJML01wMyt3ZmtqUnJuY0xEMGF5TmFrLzc4YXMxdEVTUHFnelV4dGE5N0E9PQ==&shr=&eid=,יישומים טכנולוגיים חטיבת ישירים אלמנטרי,onsite,harel,"לחברת הראל דרוש/ה בודק/ת QA במסגרת התפקיד: אחריות על מעקב וטיפול שוטף בתקלות בדיקות במערכת עבודה מול ממשקים מרובים בארגון מה אנחנו מחפשים? ידע וניסיון בעבודה מול מערכת הSALESFORCE- חובה ידע וניסיון בבדיקות ידניות- חובה נכונות לעבודה במשרה מלאה יכולת עבודה בצוות ומול ממשקים משרה מלאה , יום חמישי מקוצר, יום עבודה מהבית. מיקום המשרה: רמת גן, אזור הבורסה, סמוך לרכבת סובידור מרכז.",
"רפרנט/ית פניות הציבור- החלפה לחל""ד",הראל,בית מ.א.ה,2026-07-01,https://career.adamtotal.co.il/Jobs/JobDetails?token=NWk1WHJWZkVhOEFXdFROZnNleGR5a21kZllIaGd2WU5MUVJoaDROTFdOUHdXNnY0YmFEbGliUjV1MjVVWEkvOS9KaUdyakdHUVR6NmJQMThKQ1NJMEE9PQ==&shr=&eid=,צוות דיגיטל - פניות הציבור,onsite,harel,"איך ייראה היומיום שלך ? קליטת פניות ציבור, תיעוד שלהן וקבלת התייחסות מקצועית . בקרה ותחקור פניות; מתן מענה מקצועי במידת הצורך לפניות, מענה לבירורי זכויות ועוד. פתיחת תיקים, מיפתוח, קבלת תשובות, משלוח תזכורות ומגע מול הרפרנטים השונים ביחידות המקצועיות. מה אנחנו מחפשים? ניסיון בענף הביטוח – חובה ניסיון בטיפול בפניות ציבור – יתרון משמעותי ניסיון ממוקד שירות – יתרון משמעותי היקף משרה: משרה מלאה, ימים א'-ד', 8.5 שעות ביום, יום ה' 6 שעות אנחנו על המפה: רמת גן, מתחם הבורסה, צמוד לרכבת סבידור מרכז, והרכבת הקלה",maternity_cover
אנליסט/ית תחקור ובקרה,הראל,בית מ.א.ה,2026-07-01,https://career.adamtotal.co.il/Jobs/JobDetails?token=NWk1WHJWZkVhOEFXdFROZnNleGR5a21kZllIaGd2WU5MUVJoaDROTFdOT05ib3dVcHlQS291WmxNam5GbGdIRkJWMDVCYlMwMi9PWGZ5akw2M0hQMFE9PQ==&shr=&eid=,מחלקת תחקור ובקרה,onsite,harel,"איך ייראה היומיום שלך ? ביצוע בקרות שכר וניתוח הוצאות השכר ביצוע אנליזות ודו""חות על בסיסי נתונים גדולים אפיון מערכות, דשבורדים ואוטומציות של תהליכים ליווי פיתוח, בדיקות והטמעת תהליכים מקצה לקצה עבודה בשיתוף פעולה עם יחידות מקבילות עזרה שוטפת למנהלת המחלקה מה אנחנו מחפשים? ניסיון של שנתיים לפחות כאנליסט/ית - חובה ידע בשליפה מורכבת של נתונים משרת SQL – חובה ניסיון מעשי בעבודה עם Excel לרבות עבודה שוטפת עם פונקציות מורכבות - חובה ניסיון כאנליסט/ית שכר והטבות – יתרון תואר ראשון ומעלה בכלכלה, מנע""ס, הנדסת תעשיה וניהול, ו/או מקצוע ריאלי דומה - חובה היקף משרה: משרה מלאה, ימים א'-ד', 8.5 שעות ביום, יום ה' 6 שעות, שעות נוספות עפ""י דרישה אנחנו על המפה: רמת גן, מתחם הבורסה, צמוד לרכבת סבידור מרכז, והרכבת הקלה",
מאפיינ/ת דרישה עסקית,הראל,רמת גן,2026-07-01,https://career.adamtotal.co.il/Jobs/JobDetails?token=NWk1WHJWZkVhOEFXdFROZnNleGR5a21kZllIaGd2WU5MUVJoaDROTFdOUG9USTRCTTVXUFlGRDhMR1FGY3FKT1VaOVRGeHVjVWI0WWQxMExKbFJSUVE9PQ==&shr=&eid=,מטה ופרויקטים חטיבה עסקית בטוח כללי,onsite,harel,"איך יראה היום שלך? הובלת פרויקטים חוצי ארגון בעולמות מערכות ליבה, דיגיטל ותפעול הבנה עמוקה של צרכים עסקיים והפיכתם לאפיון פונקציונלי ברור עבודה שוטפת מול צוותי פיתוח וגורמים עסקיים ייזום פתרונות ושיפורים במערכות קיימות ניהול E2E משלב הרעיון, אפיון, פיתוח ועד עלייה לאוויר תיעדוף משימות וניהול backlog בממשקים מרובים ניתוח נתונים עסקיים ושימוש בהם לקבלת החלטות ליווי המוצר לאחר השקה ומדידת הצלחה (KPI / ROI) מה אנחנו מחפשים? ניסיון בתחום האלמנטרי – חובה ניסיון במערכת הירוקה / בוסנובה / AS400 – חובה ניסיון של 2-3 שנים בניהול פרויקטים / ניתוח מערכות / ניהול ממשקים – חובה ניסיון מחברת ביטוח \ בנקים – יתרון משמעותי תואר ראשון (ביטוח / תחום פיננסי) היקף משרה: משרה מלאה, ימים א'-ד' 8 וחצי שעות עבודה, יום ה' 6 שעות עבודה ( חמישי קצר) מיקום: מתחם הבורסה ברמת גן, בסמוך לרכבת סבידור מרכז ולרכבת הקלה",
