title,company,location,date,deadline,url,jobcode,campus,department,workplace_type,description,requirements
רכז/ת אדמיניסטרטיבי/ת- בית הספר לרוקחות,האוניברסיטה העברית בירושלים,ירושלים,2026-05-23,,https://huji.hunterhrms.com/job-details/?jobcode=JB-4985,JB-4985,קמפוס עין כרם,,onsite,"סיוע אדמיניסטרטיבי למנהל ולמנהלת האדמיניסטרטיבית של ביה""ס ובכלל זה:
•	טיפול בעניינים מנהליים וכספיים של יחידת הצב""מ ושל מרכזי המחקר הכוללים טיפול בהזמנות עבודה ומעקבם, הכנת דוחות כספיים ומדעיים ומעקב אחר פעילותם.
•	סיוע בהיבטים לוגיסטיים בביה""ס ובכלל זה: תחזוקה שוטפת של הבניין, הכנת תוכניות לשיפוצי מעבדות קיימות ומעבדות חוקרים נקלטים וליווי בהקמתם.
•	סיוע בתחזוקת ציוד בית הספר, הכולל ציוד מולטימדיה.
•	טיפול ומעקב אחר הזמנות רכש, ציוד, עבודה ואישור חשבונות לתשלום.
•	אחריות על  פרויקטים ואירועי ביה""ס.
•	קשר שוטף עם גורמי פנים וחוץ לרבות תיאום פגישות וביקורי אורחים מחו""ל.
•	תפעול אתר האינטרנט של ביה""ס ומסכי תצוגה.
•	טיפול בנסיעות סטודנטים וחוקרים לחו""ל.
•	ביצוע משימות נוספות ופרויקטים בהתאם להוראות הממונים.","•	תואר אקדמי/ *סטודנטים לפי שעות באוניברסיטה העברית הנמצאים בשנתם האחרונה לתואר.
•	ניסיון אדמיניסטרטיבי קודם.
•	ידע וניסיון בהנהלת חשבונות- יתרון.
•	ניסיון בעבודה עם מערכות כספים ממוחשבות  -  יתרון.
•	הכרות עם יחידות האוניברסיטה – יתרון.
•	ידיעת השפה העברית על בוריה ואנגלית ברמה טובה.
•	שליטה מלאה ביישומי Office ואינטרנט.
•	יכולת ארגון, יכולת עבודה בצוות, יחסי אנוש מעולים ותודעת שירות גבוהה.
היקף:	משרה מלאה."
רכז/ת תקציבי מחקר- רוח,האוניברסיטה העברית בירושלים,ירושלים,2026-05-23,2026-05-25,https://huji.hunterhrms.com/job-details/?jobcode=JB-4958,JB-4958,קמפוס הר הצופים,,onsite,"אחריות כוללת לתחום הרכש והמלגות בתקציבי המחקר בפקולטה, לרבות מרכזי מחקר ובכלל זה:
•	טיפול ברכש – עבודה מול ספקים בארץ ובחו""ל, רכש פנימי, טיפול בהחזרי הוצאות.
•	טיפול במלגות של מרכזי מחקר – הקמה וניהול אתר, הפצת מידע, מתן מענה למועמדים, ארגון ושליחת תיקי מועמדות לוועדה האקדמית, מתן הודעות לזוכים ולנדחים ומילוי טפסים לדיווח.
•	טיפול במלגות מתקציבי מחקר בארץ ובחו""ל.
•	הכנת דוחות כספיים.
•	ייעוץ לחוקרים בכל הנוגע לתפעול תקציבי מחקר ומענה שוטף בתחום.
•	סיוע בארגון כנסים, לרבות טיפול בתשלומים למרצים אורחים.
•	ביצוע מטלות נוספות בהתאם להוראות הממונים.","•	תואר אקדמי.
•	ניסיון בעבודה בתחום הכספים/הנהלת חשבונות – יתרון.
•	היכרות עם מערכת ה-SAP – יתרון.
•	ידיעת השפה העברית על בוריה ואנגלית ברמה טובה.
•	שליטה מלאה ביישומי Office ואיטרנט, ו -Excel  בפרט.
•	יכולת עבודה עצמאית ועמידה בלוחות זמנים.
•	אחריות, יוזמה, יחסי אנוש מעולים ותודעת שירות גבוהה.
היקף:	משרה מלאה"
רכז/ת שיווק ומדיה דיגיטלית-המכון הישראלי ללימודים מתקדמים,האוניברסיטה העברית בירושלים,ירושלים,2026-05-23,2026-05-25,https://huji.hunterhrms.com/job-details/?jobcode=JB-5001,JB-5001,"קמפוס  ע""ש אדמונד י.ספרא",,onsite,"ניהול מערך השיווק והמדיה של המכון ובכלל זה:
•	אחריות על התכנים באתר האינטרנט של המכון וכן על תאום הטיפול בבנייה ותחזוקת דפי היחידה ברשתות החברתיות השונות.
•	מעקב אחר תגובות ופניות במדיה החברתית ואחריות על מענה לפונים.
•	עריכה לשונית באנגלית של כל פרסומי המכון: חוברת העמיתים, הדוח השנתי, פרסומי אירועים, מכתבים רשמיים ועוד.
•	הכנת רשימות תפוצה לפרסומי המכון, עדכונן והפצת החומרים.
•	איתור מחקרים וריכוז המידע אודותיהם, ריכוז פעילויות במכון וטיפול בהם בתיאום מול אגף השיווק.
•	תיעוד אירועים וכנסים במדיה הדיגיטלית והפקת חומרים דיגיטליים כגון סרטים.
•	השתתפות בפורומים של רכזי מדיה דיגיטלית שמוביל אגף שיווק.
•	קיום קשר שוטף והנחייה מקצועית של אגף השיווק.
•	מטלות נוספות בהתאם להוראות הממונים.","•	תואר אקדמי. תואר בתחומי תקשורת/שיווק- יתרון.
•	ניסיון בעבודה בתחום השיווק.
•	היכרות מעולה עם עולם הרשתות חברתיות והמדיה הדיגיטלית.
•	שליטה מלאה ביישומי Office ואינטרנט.
•	ידיעת השפה העברית על בוריה ואנגלית ברמה טובה מאוד.
•	יוזמה, יחסי אנוש מעולים ויכולת רתימה ושכנוע.
•	יכולת ונכונות לעבודה בשעות נוספות, בהתאם לצורך.
היקף:	משרה מלאה"
עוזר/ת בכיר/ה לפיתוח אקדמי-המינהל האקדמי,האוניברסיטה העברית בירושלים,ירושלים,2026-05-23,2026-05-20,https://huji.hunterhrms.com/job-details/?jobcode=JB-4961,JB-4961,קמפוס הר הצופים,,onsite,"•	הכנה, בנייה, תחזוקה והרצה של מודל התקצוב הפנימי של האוניברסיטה, ריכוזו ופיתוחו בהתאם לפרמטרים משתנים, תוך בדיקת ההשלכות התקציביות, הארגוניות והאקדמיות.
•	פיתוח כלים, מתודולוגיות ותהליכי עבודה להטמעה של המודל בשטח והדרכה של אנשי מפתח בפקולטות לגבי המודל.
•	פיתוח ובקרה על כל הדו""חות הקשורים לנתוני הסגל האקדמי הבכיר ובהם דו""ח סגל אקדמי ודו""ח סגל רפואה.
•	יצירת תהליכי עבודה להנגשת הדוחות להנהלה ולגורמים רלוונטיים בתוך האוניברסיטה ומחוצה לה.
•	אחריות על בנייה והכנה של בסיסי נתונים עבור המדדים הבינלאומיים.
•	אחריות לבנייה ולשימוש במערכי הנתונים והדוחות בתחומים שתחת לשכת הרקטור והמינהל האקדמי, תוך שימוש מיטבי בתשתיות הנתונים הכלל מוסדיות.
•	מענה על בקשות מידע מות""ת, מהלמ""ס ומגופים נוספים הנוגעות למאגרי הנתונים של המינהל האקדמי.
•	מטלות נוספות בהתאם להוראות הממונים.","•	תואר אקדמי. תואר בכלכלה/סטטיסטיקה/מדעי המחשב/ מינהל עסקים ותחומים קרובים ו/או תואר שני בתחומים אלו-  יתרון.
•	ניסיון בעבודה בניתוח נתונים ודו""חות מערכתיים.
•	ניסון בעבודה כראש צוות או בעבודה עצמאית מול דרגי הנהלה.
•	ניסיון בעבודה בארגונים גדולים, ובפרט ניסיון בעבודה מול יחידות אקדמיות - יתרון.
•	שליטה מצוינת ב-Excel, בפרט PIVOT ונוסחאות כלכליות וסטטיסטיות מורכבות.
•	שליטה בסיסית בפייתון ובכתיבת קוד (בעיקר בחבילות כגון numpy, pandas) - יתרון.
•	הכרה ושימוש במערכת POWERBI - יתרון.
•	היכרות וניסיון בעבודה עם מערכות אוניברסיטאיות ממוחשבות - יתרון.
•	שליטה מלאה ביישומיי Office ואינטרנט.
•	ידיעת השפה העברית על בוריה והשפה האנגלית ברמה טובה.
•	יכולות אנליטיות, חשיבה שיטתית ויכולת גבוהה של הסקת מסקנות מנתונים.
•	יכולת רתימה, הובלת תהליכים והטמעת שינויים.
•	יחסי אנוש מעולים, תודעת שירות גבוהה ויכולת עבודה עצמאית ובצוות.
היקף:	משרה מלאה"
מנהל/ת היחידה לתשתיות מחקר- הרשות למחקר ופיתוח,האוניברסיטה העברית בירושלים,ירושלים,2026-05-23,,https://huji.hunterhrms.com/job-details/?jobcode=JB-5029,JB-5029,"קמפוס  ע""ש אדמונד י.ספרא",,onsite,"ניהול והובלה של היחידה המרכזית לתשתיות מחקר ובכלל זה:
•	מיפוי תשתיות מחקר קיימות אל מול מיפוי צרכים רוחביים של יחידות האוניברסיטה השונות.
•	גיבוש תכנית עבודה רב־שנתית לפיתוח תשתיות המחקר, זיהוי מגמות עתידיות והמלצות לפיתוחים חדשים.
•	הובלת פרויקטים לשדרוג והקמת תשתיות חדשות, בתיאום עם יחידות רכש, תקציבים ואב""ת.
•	הבטחת שימוש יעיל במשאבי יחידות התשתית והנגשתם לחוקרים וליחידות שונות.
•	ניהול תקציב ותכנון משאבים: הכנת תקציבי פיתוח ותפעול, איגום מקורות מימון, הטמעת מנגנוני תמחור ובקרה.
•	ניהול צוות, פיתוח מקצועי והכשרה.
•	תיאום ושיתוף פעולה עם גורמי פנים באוניברסיטה ועם משרדי ממשלה, קרנות וגופים חיצוניים לקידום השקעות בתשתיות מחקר.
•	ייזום ופיתוח שיתופי פעולה עם מוסדות בארץ ובעולם בתחומי תשתיות המחקר.
•	ייצוג האוניברסיטה בפורומים מקצועיים מול גופים ממשלתיים, רגולטוריים ואקדמיים בארץ ובחו""ל.
•	מטלות נוספות בהתאם להוראות הממונים.
כפיפות למנהלת הרשות למו""פ ולסגן הנשיא למו""פ.","•	תואר ראשון בכלכלה/ מנהל עסקים/ חשבונאות/ מדעים ניסויים או תחום רלוונטי אחר. תואר שני ומעלה – יתרון.
•	ניסיון מוכח בניהול תקציבים, בניית מודלים כלכליים ותמחור.
•	ניסיון בניהול תחום תשתיות מחקר/ מעבדות/ מרכזי שירות למחקר באקדמיה או בגוף ציבורי/ממשלתי- יתרון.
•	היכרות עם עולם המימון למחקר ותשתיות מחקר בארץ ובעולם – יתרון.
•	ניסיון בניהול צוות עובדים - יתרון.
•	שליטה מלאה ביישומי Office.
•	שליטה בשפות עברית ואנגלית ברמה טובה מאוד, בכתב ובעל פה.
•	כושר ניהול, יוזמה, ראייה מערכתית, יכולת עבודה מול גורמים בכירים בארץ ובחו""ל, תודעת שירות גבוהה ויחסי אנוש מצוינים.
היקף:	משרה מלאה"
