id,title,company,city,url,date_posted,source,work_type,sector,level,raw_text
e8f94e90d515,תקציבן/ית ראשי/ת לתוכנית העשרה ארצית,,מרכז הארץ,cv4economicsjobs@gmail.com,2026-05-01,Telegram: מציאת עבודה,משרה מלאה,חינוך,בכיר,"אשמח לעזרתך בפרסום המשרה:  דרוש/ה תקציבן/ית ראשי/ת לתוכנית העשרה ארצית    תיאור משרה:  ניהול המערך הכלכלי של התוכנית, אחריות על תהליכי הגבייה ובקרת התקציב, והובלת צוות התקציבנים והמנהלניות למיקסום היעילות התפעולית והכלכלית מול מנהלי התוכנית, המוסדות הרשויות והזכיינים.  • בקרה ודיווח: ביצוע בקרות תקצ"
2c4cda16ae26,מנהל.ת קבוצות תמיכה,עמותת עמדא,,https://t.me/biltiformali/33137,2026-05-01,Telegram: מציאת עבודה,משרה חלקית,עמותות,ניהולי,"לעמותת עמדא דרוש.ה:  מ͢נ͢ה͢ל͢.͢ת͢ ͢ק͢ב͢ו͢צ͢ת͢ ͢ת͢מ͢י͢כ͢ה͢  לליווי ופיתוח של מערך קבוצות התמיכה של עמדא לבני משפחה של אנשים עם דמנציה ואלצהיימר, בפריסה ארצית ובזום, בהיקף של חצי משרה.     אודות העמותה: עמותת עמדא מספקת הכוונה מעשית ותמיכה רגשית, למשפחות המתמודדות עם דמנציה.      אופי העבודה: עבודה הי"
67c1a7d16dea,צוות הניהול של מרכז גוונים,מרכז גוונים,רמת גן,tps://career.gvanim.org.il/career/jobs/240,2026-05-01,Telegram: מציאת עבודה,משרה מלאה,עמותות,ניהולי,הצטרף.י לצוות הניהול של מרכז גוונים ברמת גן - לתפקיד מלא משמעות 💙פרטים נוספים והגשת מועמדות בלינק👇https://career.gvanim.org.il/career/jobs/240
088b7fa42d62,מנהל/ת לאזור הצפון,צעד ירוק,צפון,https://forms.gle/nzhGsg3euaEfn2eY9,2026-05-01,Telegram: מציאת עבודה,משרה מלאה,חינוך,ניהולי,"צעד ירוק -  לא עוד עבודה במשרד. קריירה עם שורשים.   דמיינו את יום העבודה שלכם: השילוב המושלם בין אסטרטגיה גבוהה לבין המפגש האנושי בשטח.   בין המגזר הפורמלי ללא-פורמלי.   בין חברה יהודית לערבית.  אנחנו מחפשים מנהל/ת לאזור הצפון.   מישהו/י שרואה את התמונה הגדולה, שלא מפחד/ת ממכרזים ומערכות גדולות, והל"
52e8572ecd15,"מנכ""ל לפרויקט סינון העפר מהר הבית ולקרן לקידום הארכיאולוגיה בישראל",פרויקט סינון העפר מהר הבית וקרן לקידום הארכיאולוגיה בישראל,,ל-tmsifting@gmail.com,2026-04-30,Telegram: מציאת עבודה,משרה מלאה,עמותות,בכיר,"לפרויקט סינון העפר מהר הבית ולקרן לקידום הארכיאולוגיה בישראל (ע״ר) דרוש/ה מנכ""ל  הזדמנות יוצאת דופן להוביל את אחד המיזמים הארכיאולוגיים המרתקים והמשמעותיים בישראל. פרויקט סינון העפר מהר הבית מתרחב ומתמסד, ואנו מחפשים מנכ""ל/ית שותף/ה לדרך, בעל/ת ניסיון ניהולי וארגוני עשיר. התפקיד כולל הובלת האסטרטגיה"
0e204f46831d,סגן/ית מנהל מכינה קדם צבאית,מכינת קול עמי,"קיבוץ בחן, עמק חפר",http://bit.ly/4sJEEHK,2026-04-30,Telegram: מציאת עבודה,משרה מלאה,חינוך,ניהולי,"מכינת קול עמי בקיבוץ בחן בעמק חפר מחפשת סגן/ית מנהל לשנה הבאה ☀️ מחפשת מישהו אחראי, עם זיקה לשטח ולעולם החינוך -  מכינות / ש״ש, פיקוד בצבא, הדרכה.  כזה שיודע לעבוד עם אנשים, לתקתק משימות, להוביל קבוצה, ולהיכנס ללב של עשייה חינוכית.  אחד כזה עם מלא אנרגיה, דרייב ורצון לקחת תפקיד משמעותי ולהשפיע באמת."
3956db0f3096,הובלת פיתוח והאצה של חזון לאומי,,,https://minisite.niloos.ai/vacancy/69edc61991674d48cdeef107,2026-04-30,Telegram: מציאת עבודה,משרה מלאה,ממשלתי,בכיר,"משרה של פעם ב 78 שנה! מחפשים לעם ולמדינת ישראל את מי שיודע, רוצה ויכול להוביל פיתוח והאצה של חזון לאומי ויישומו בממשלה, ברשויות ובקהילות. לנהל ביד רמה וחמה; צוות, תהליכים ומורכבויות ולוודא שיש את כל המשאבים הדרושים להוצאה לפועל של בניית הקומה הבאה של מדינת ישראל. מוזמנים להוביל! https://minisite.nil"
c62a2aa79502,הזדמנות להצטרף לצוות - מועצה אזורית רמת הנגב,מועצה אזורית רמת הנגב,רמת הנגב,https://www.rng.org.il/bids/?id=460,2026-04-30,Telegram: מציאת עבודה,,ממשלתי,,"מועצה אזורית רמת הנגב מחפשת אנשים עם לב גדול, אחריות ורצון להשפיע, להצטרף לצוות חם, מקצועי ושותף לדרך. #תייגו_מתאימים לפרטים נוספים: https://www.rng.org.il/bids/?id=460"
8b48d2f3e9a3,מנהלת מחלקת גיוס ומנהלות מדור במשאבי אנוש,עיריית רעננה,רעננה,"//www.raanana.muni.il/cityhall/tender-and-jobs/jobs-and-bids
לפרטי",2026-04-30,Telegram: מציאת עבודה,משרה מלאה,ממשלתי,ניהולי,"בתקופה שבה חוסר ודאות הוא חלק מהמציאות, יש מקומות שבהם יש יציבות, משמעות והשפעה אמיתית.  עיריית רעננה מחפשת אותך! להצטרף לאגף משאבי אנוש לתפקידי מפתח  📌 התפקידים הפתוחים: 🔹 מנהלת מחלקת גיוס 🔹 מנהלות מדור בתחומים: גיוס, רווחת פרט, תנאי העסקה ונוכחות 🔹 תפקידים מקצועיים נוספים בתחום משאבי אנוש  💙 ביטחו"
fcece8ba1535,רכז/ת בכיר/ה לתואר שלישי,בית הספר ללימודים מתקדמים,,ttps://campaign.adamtotal.co.il?d=cw8OWgbP0PVcjNfvY%2fMwxg%3d%3d,2026-04-30,Telegram: מציאת עבודה,,חינוך,בכיר,"לביה""ס ללימודים מתקדמים דרוש/ה *רכז/ת בכיר/ה לתואר שלישי* 🎓 רוצים לקחת חלק בליווי הדור הבא של החוקרים? תפקיד מרכזי הכולל ליווי דוקטורנטים משלב הקבלה ועד סיום התואר,  עבודה מול סגל אקדמי וגורמים בכירים ומתן שירות שוטף. תואר ראשון – חובה לא מתאים לכם?מכירים מישהו/י שמתאים? תעבירו להם https://campaign."
2f6c5685a1d2,"מוביל/ת מעורבות קהל וקהילה, מוביל/ת מערך למידה וחינוך, רכז/ת אדמינסטרציה ואחראי/ת שותפויות",זומו - המוזיאון שבדרך - Zumu,,https://bit.ly/4vALh1u,2026-04-29,Telegram: מציאת עבודה,,חינוך,ניהולי,"חברות וחברים, אנחנו ב זומו - המוזיאון שבדרך - Zumu מגייסים שלושה אנשי צוות  חדשים. אז אם אתם/ן מחפשות ומנוסות אז הגישו לנו: 1. מוביל.ת מעורבות קהל וקהילה. 2. מוביל.ת מערך למידה וחינוך. 3. רכז .ת אדמינסטרציה ואחראי.ת שותפויות.  הפיצו, חברו, שתפו ותזכו למצוות: https://bit.ly/4vALh1u"
fc6a998944f8,מנהל.ת מחוז הצפון | אגף התעסוקה והפנאי,אקים ישראל,הצפון,ps://tinyurl.com/2m74zpvv,2026-04-29,Telegram: מציאת עבודה,משרה מלאה,עמותות,בכיר,🌟 *אקים ישראל – מנהל.ת מחוז הצפון | אגף התעסוקה והפנאי* תפקיד בכיר ומשמעותי: ניהול כ-350 עובדים על פני שלושה אשכולות בצפון – מעפולה ועד כרמיאל. רקע בעולם המוגבלות – חובה.  *📍 מה כולל התפקיד?* ניהול ישיר של מנהלי האשכולות ומסגרות התעסוקה והפנאי ● פיתוח פרויקטים ומסגרות חדשות ● ניהול תקציב ותוכניות עב
d7787840a7c5,תפקיד במכינה באופקים,מכינת אופקים,אופקים,hagit.dolgin@weizmann.ac.il,2026-04-29,Telegram: מציאת עבודה,,חינוך,,"תפקיד עם הרבה עניין, השפעה ותרומה לקהילה, במכינה מדהימה באופקים. מוזמנים/ות לשלוח לי קורות חיים: hagit.dolgin@weizmann.ac.il"
22e2270f1168,מנהל/ת מחלקת תיירות,החברה הכלכלית לערד,ערד,s://kalkalit-arad.co.il/auctions/4050/,2026-04-29,Telegram: מציאת עבודה,משרה מלאה,ממשלתי,ניהולי,"📢 מכרז פומבי להגשת מועמדות לתפקיד מנהל/ת מחלקת תיירות 📢 החברה הכלכלית לערד מזמינה אתכם להגיש מועמדות לתפקיד משמעותי הכולל הובלת תחום התיירות בעיר, פיתוח יוזמות, שיווק וקידום תיירות בערד !  📅 מועד אחרון להגשה: 30.04.26  🔗 לפרטים מלאים והגשה: https://kalkalit-arad.co.il/auctions/4050/"
a9b0ec3a744c,עובדים.ות סוציאליים.ות,אור שלום,,https://orrshalom.formtitan.com/ftproject/recruitment?job_id=a2ITu0000007Fjt,2026-04-29,Telegram: מציאת עבודה,,עמותות,ביניים,"מקצועיות, אנושיות ועשייה עם עומק, זה הבסיס של העבודה אצלנו.  באור שלום אנחנו מגייסים עובדים.ות סוציאליים.ות שלא מפחדים.ות להשפיע, להוביל, לחשוב וליצור שינוי אמיתי.  לפרטים:  https://orrshalom.formtitan.com/ftproject/recruitment?job_id=a2ITu0000007Fjt"
dc6f61707412,"סמנכ""ל שותפויות",מישרים,,https://medulla.co.il/?p=29787,2026-04-29,Telegram: מציאת עבודה,,עמותות,בכיר,"משרה חדשה ב #מדולה_לקהילה ❤️  *לארגון ""מישרים"" דרוש.ה סמנכ""ל.ית שותפויות*  התפקיד כולל תכנון והובלה אסטרטגית של הארגון ותכנון וניהול ממשקי העבודה של המיזם אל מול השותפים השונים בשיתוף עם מנכ""ל המיזם.   אם יש לך ניסיון בעבודה במערכת החינוך והכרות עם בעלי התפקיד המרכזיים בתחום בתי הספר, ניסיון במיסוד "
f1552e32ed84,מתאמ.ת טיפול לדיור המוגן,עמותת אנוש,אשקלון,https://t.me/biltiformali/33082,2026-04-29,Telegram: מציאת עבודה,,עמותות,ביניים,"מחפשים עבודה עם משמעות אמיתית – כזו שגם מתפתחים בה וגם משנים חיים? ❤️ עמותת אנוש באשקלון מחפשת מתאמ.ת טיפול לדיור המוגן – תפקיד שמשלב קשר אנושי עמוק, הובלת תהליכי שיקום ועבודה מקצועית עם צוות מוביל.  מה מחכה לך אצלנו? ✨ הדרכה מקצועית וליווי צמוד ✨ מענקי הצטרפות והתמדה 💰 ✨ הכשרות, קורסים ואופק קידום "
424a76df4752,עו״ס/ית | תכנית עלמיא,עלה מוריה,גדרה והסביבה,ps://wa.me/972523159832,2026-04-29,Telegram: מציאת עבודה,משרה חלקית,רווחה,ביניים,"*דרוש/ה עו״ס/ית | תכנית „עלמיא” מבית 'עלה מוריה'  בית לצמיחה ולחיים עצמאיים עבור נערות דתיות צעירות בגילאי 18+ עם מוגבלות קוגניטיבית, אוטיזם ושיקום.  📍גדרה והסביבה  *מה בתפקיד :* * ליווי והעצמה אישית של הבנות בתהליך חיי היומיום והעצמאות * טיפולים פרטניים * הנחיית קבוצות * ליווי צוות  *היקף משרה:* * "
8a82908c28c1,רכז/ת תכנית אלפא,אוניברסיטת אריאל,אריאל,"tps://campaign.adamtotal.co.il?d=i9Bt961BZ9iPufaEamZpCg%3d%3d
מ",2026-04-29,Telegram: מציאת עבודה,משרה מלאה,חינוך,ניהולי,"אם את/ה אוהב/ת חינוך, ארגון ועבודה עם נוער מצטיין – זה המקום בשבילך! 🌟 תכנית ""אלפא"" באוניברסיטת אריאל מחפשת *רכז/ת תכנית* 🎓 התפקיד מגוון הכולל ניהול ותפעול של התכנית, עבודה מול צוותים מקצועיים וממשקים מגוונים – אקדמיה, משרד החינוך, תלמידות והורים. תואר ראשון – חובה | תואר שני – יתרון לפרטים והגשת מו"
9c3a7d466a2e,"רכז/ת קשרי קהילות יהודיות בחו""ל",מטיב,ירושלים,https://t.me/biltiformali/33074,2026-04-29,Telegram: מציאת עבודה,משרה מלאה,עמותות,ביניים,"אנחנו במטיב מגייסים – הצטרפו לעשייה משמעותית תכנית ""מסע שחרור"" (Peace of Mind) של מטיב פועלת כבר שנים לצד לוחמים וחיילי מילואים בתהליכי עיבוד חוויות לחימה, בשיתוף קהילות יהודיות ברחבי העולם. כדי להמשיך ולהרחיב את הפעילות – אנחנו מחפשים אנשים מצוינים שיצטרפו לצוות. רכז/ת קשרי קהילות יהודיות בחו""ל תפק"
aa6ad4dd7e2b,"תפקיד מאתגר, מגוון ומתגמל",,,https://app.civi.co.il/promo/id=951381&src=12749,2026-04-29,Telegram: מציאת עבודה,,,,"הצטרפו אלינו לצוות מדהים, בתפקיד מאתגר, מגוון ומתגמל. https://app.civi.co.il/promo/id=951381&src=12749"
3ca20fe210f1,כותב/ת תוכן,עמותת סולמות,,Hagitmenat@sulamot.org,2026-04-28,Telegram: מציאת עבודה,,עמותות,,"דרוש/ה כותב/ת תוכן לעמותת סולמות! אם אתם נושמים דיגיטל, חיים את העולם היהודי ורוצים לייצר אימפקט משמעותי - אנחנו מחפשים אתכם.  הגשת מועמדות (נא לצרף קורות חיים ודוגמאות כתיבה): Hagitmenat@sulamot.org נשמח אם תעבירו הלאה למי שרלוונטי!"
a801b7df3f59,רכז/ת מתחום הייעוץ/עבודה סוציאלית,אוניברסיטת תל אביב,תל אביב,kidumst@gmail.com,2026-04-28,Telegram: מציאת עבודה,,חינוך,ביניים,רוצה להשתלב בתפקיד משמעותי ומעניין? דרוש.ה רכזת מתחום הייעוץ/עבודה סוציאלית לתכנית ליווי ותמיכה לסטודנטים מהפריפריה באוניברסיטת תל אביב. להגשת קורות חיים: kidumst@gmail.com
e63fdce74667,מנהל/ת מרכז לעכו,מרכזים לצדק חברתי,עכו,ps://wkf.ms/3OfXwzU,2026-04-28,Telegram: מציאת עבודה,משרה מלאה,עמותות,ניהולי,"🌿 מחפשים מנהל/ת מרכז לעכו 🌿  רוצה לעבוד בעבודה עם משמעות אמיתית, להוביל קהילה מקומית ולייצר שינוי חברתי בשטח?  מרכזים לצדק חברתי מגייסים מנהל/ת מרכז לעכו- תפקיד משמעותי שמחבר בין הנהגה קהילתית, עבודה עם פעילים ופעילות, הובלת יוזמות וקמפיינים, ובניית שותפויות בעיר.  משרה מלאה, שעות גמישות  🌻מתאים במי"
570c5f9e7e4a,מנהלת משאבי אנוש,תנועת הנוער האיחוד החקלאי,,https://t.me/biltiformali/33050,2026-04-28,Telegram: מציאת עבודה,משרה מלאה,עמותות,בכיר,"*מחפשים מנהלת משאבי אנוש לתנועת הנוער האיחוד החקלאי*  תנועת הנוער נמצאת בצמיחה ואנו מחפשים את הדמות שתהיה יד ימינו של המזכ""ל בהובלת המשאב הכי חשוב בבית הזה - האנשים שלנו 😊  אנחנו מחפשים מנהל.ת מחלקת משאבי אנוש שתהיה שותפה אמיתית לדרך, תדע לבנות תשתיות ולהוביל את שדרת הניהול שלנו קדימה.  מדובר על תפק"
1c47e953f41a,"מנכ""ל/ית למעגלים",מעגלים,בני עטרות,https://mitam-hr.org/jobs/152,2026-04-28,Telegram: מציאת עבודה,משרה מלאה,עמותות,בכיר,"דרוש/ה מנכ""ל/ית למעגלים “מעגלים” הוא ארגון חינוכי-לאומי הפועל בקרב תלמידי י""א-י""ב בפריפריה החברתית, במטרה לחזק מסוגלות אישית, ערכים ויכולת התמודדות עם אתגרי החיים. לאחר 25 שנות הובלה, המנכ""ל המייסד עובר לתפקיד נשיא העמותה וימשיך ללוות את הארגון מקרוב. כעת, בתקופה של צמיחה והתפתחות, מעגלים מחפשת מנכ"""
6e923752d5af,רכז/ת פיתוח משאבים,מדרשת עין הנציב,,midresheteinhanatziv@gmail.com,2026-04-28,Telegram: מציאת עבודה,,חינוך,ביניים,"מדרשת עין הנצי״ב - Midreshet Ein Hanatziv  מחפשת אותך...  קול קורא 📢 משרת רכז.ת פיתוח משאבים במדרשת עין הנצי""ב!  התחלה מידית.  קו""ח לשלוח ל: midresheteinhanatziv@gmail.com"
5ab535eff362,מנהל/ת מרפאה רב מקצועית,המרכז הירושלמי לבריאות הנפש,ירושלים,://merkava.mrp.gov.il/giusp/index.html#/position/07316596,2026-04-28,Telegram: מציאת עבודה,משרה מלאה,ממשלתי,ניהולי,"למרכז ירושלמי לבריאות הנפש דרוש/ה מנהל/ת מרפאה רב מקצועית  ⬅️אחריות לניהולה המקצועי והמינהלי של מרפאה לבריאות הנפש, בהתאם למדיניות משרד הבריאות. ⬅️אחריות לניהול העובדים המקצועיים והמינהליים במרפאה וכוח אדם הנמצא בהכשרה או בהתנסות מעשיים, הדרכתם בעבודה ופתרון בעיות בהתאם לצורך. ⬅️אחריות להכנה וביצוע "
4049de3406ca,מנהל/ת סל מענים למערך נושמים,המצמד החברתי,ראשון לציון,s://tinyurl.com/p6psyb7f 🌈,2026-04-28,Telegram: מציאת עבודה,משרה מלאה,רווחה,ניהולי,"*🌟 דרוש/ה מנהל/ת סל מענים למערך ""נושמים"" 🌟*  מערך ""נושמים"" ( המשותף למשרד הרווחה והביטחון החברתי), פועל ב-211 רשויות..  *מהות התפקיד:* ניהול אסטרטגי של משאבי הסל מתוך תפיסת כלכלה מודעת עוני. התפקיד משלב ניתוח נתונים (Data), פיתוח ידע מקצועי, ניהול וליווי צוות והובלת תהליכי הטמעה טכנולוגיים בפריסה אר"
e5b29ca1c285,רכז/ת תואר שני - הפקולטה למדעי הבריאות,הפקולטה למדעי הבריאות,,https://campaign.adamtotal.co.il?d=VzAeu7neoRSBgOidxtzxog%3d%3d,2026-04-28,Telegram: מציאת עבודה,משרה מלאה,חינוך,ביניים,"הפקולטה למדעי הבריאות מגייסת *רכז/ת* לתואר שני✨ התפקיד כולל ניהול אדמיניסטרטיבי שוטף, מתן שירות לסטודנטים ולסגל, סיוע בתפעול התוכנית, שותפות בבניית מערכת שעות ובחינות ומעקב אחר תהליכי תזות. דרישות: תואר ראשון/הנדסאי – חובה | ניסיון בשירות – יתרון. לפרטים נוספים >> https://campaign.adamtotal.co.il?d="
7a0a6b97b88b,מנהל/ת פיתוח משאבים וקשרי שותפים,רוח איתן,ירושלים,https://forms.gle/UvNfE2J5znb1QLaY9,2026-04-28,Telegram: מציאת עבודה,משרה מלאה,עמותות,ניהולי,"*דרוש/ה שותפ/ה לדרך: מנהל/ת פיתוח משאבים וקשרי שותפים*  ""רוח איתן"" צומחת במהירות, ואנחנו מחפשים את ה""פנים"" של העמותה מול שותפים אסטרטגיים, פילנתרופים וגופים מובילים בארץ ובעולם.  *מה אנחנו מחפשים?* • איש של אנשים – יכולת לייצר אמון וכימיה מהירה. • עצמאות ויוזמה – הנעת תהליכים מאפס (בלי לחכות להוראות"
11a466dfcedc,מנהל יישוב,,דרום,https://drive.google.com/file/d/1n-vRgEW7ssRTNlxJdeKOEZdhTr5yJxEM/view?usp=sharing,2026-04-28,Telegram: מציאת עבודה,,ממשלתי,ניהולי,דרום  למה להקים יישוב אם אפשר לנהל אחד?  לפרטים נוספים והגשת מועמדות   https://drive.google.com/file/d/1n-vRgEW7ssRTNlxJdeKOEZdhTr5yJxEM/view?usp=sharing
17a5cd7eb3d6,מנהל/ת ליחידת ניהול במעון דיור לאנשים עם מוגבלויות,עמותת עלה מוריה,גדרה,ttps://wa.me/972523159832*,2026-04-28,Telegram: מציאת עבודה,משרה מלאה,עמותות,ניהולי,"*לעמותת ""עלה מוריה"" - גדרה*  *דרוש/ה מנהל/ת ליחידת ניהול במעון דיור לאנשים עם מוגבלויות*   ניהול והובלת  דיור לאנשים עם מוגבלויות, כולל אחריות מלאה על תפעול היחידה, רווחת הדיירים וניהול צוות עובדים.  *תחומי אחריות:* -ניהול והובלת צוות עובדים  -אחריות כוללת על רווחת הדיירים ואיכות חייהם -ניהול שוטף ש"
a41dc8ca93a7,מדריכ.ה - ראש צוות משפחות,מועצה אזורית דרום השרון,דרום השרון,"://www.dsharon.org.il/bids/457/

נשמ",2026-04-27,Telegram: מציאת עבודה,משרה מלאה,ממשלתי,ניהולי,*דרוש.ה מדריכ.ה - ראש צוות משפחות במועצה אזורית דרום השרון!* 📢  האגף לשירותים חברתיים מתרחב ומחפש אותך להובלת צוות ופיתוח מדיניות.  מה התפקיד כולל? 📍 ניהול מקצועי והדרכת עובדים סוציאליים. 📍 שותפות בצוות הבכיר של האגף וקביעת מדיניות. 📍 ייצוג הצוות מול ממשקים ופיתוח שירותים בקהילה.  דרישות סף: ✅ תואר 
886247301c9e,רכז/ת תחום חברתי אקדמי לפרויקט מעטפ״ת,,באר שבע,tal.li@kidum-edu.org.il,2026-04-27,Telegram: מציאת עבודה,משרה מלאה,חינוך,ניהולי,"💜 מחפשים תפקיד עם משמעות אמיתית?💜 דרוש/ה רכז/ת תחום חברתי אקדמי לפרויקט מעטפ״ת (החלפה לחל״ד)🧑🏼‍🎓  הובלה וליווי צוותים, והפעלת תוכניות חברתיות לסטודנטים עולים  עבודה עם השפעה רחבה ואנשים מדהימים!  📍באר שבע | משרה מלאה (100%) | התחלה: אוגוסט 2026 |עבודה גמישה בשעות ובמיקום |  📩 קו״ח למייל: tal.li@kidu"
9083f5971c79,Development Department Director,International Healthcare NGO,חולון,info@mikumconsulting.com,2026-04-27,Telegram: מציאת עבודה,משרה מלאה,עמותות,בכיר,"International Healthcare NGO seeks Full Time Development Department Director   Location: Holon; this is an in-office position, with some hybrid work; the position requires travel overseas 2-3 times annually.  Responsibilities: Manage and oversee fundraising strategy and operations, including managem"
4598af3c0ae5,מטפל/ת קליני/ת למרכז הטיפול עדן-דורות,מרכז הטיפול עדן-דורות,קיבוץ דורות (ליד שדרות),misroteden@eden.org.il,2026-04-27,Telegram: מציאת עבודה,פרילנס,עמותות,ביניים,"✨דרוש/ה מטפל/ת קליני/ת למרכז הטיפול עדן-דורות✨ מרכז טיפול עדן מתרחב ואנחנו מזמינים אותך להצטרף לנבחרת המטפלות שלנו, המעניקות טיפולים מכוונים טראומה לנשים מהאזור.  למה כדאי להצטרף אלינו? ·        צמיחה מקצועית: הכשרות מקצועיות רלוונטיות כחלק מהתפקיד. ·        גמישות: היקף משרה גמיש, העסקה כפרילנסר/ית"
498657724df7,ניהול החינוך החברתי במושבי יחדיו,"מושבי יחדיו (ברוש, תדהר ותאשור)","ברוש, תדהר ותאשור",https://t.me/biltiformali/33018,2026-04-26,Telegram: מציאת עבודה,,חינוך,ניהולי,"הזדמנות להשפיע ולצמוח יחד איתנו - ניהול החינוך החברתי במושבי יחדיו (ברוש, תדהר ותאשור)  לבנות קהילה להוביל ילדים ונוער.  לפרטים נוספים : 058-7671705 ירין"
