id,title,company,city,url,date_posted,source,work_type,sector,level,employer_type,description,raw_text
e3f5d64adf37,אחראי/ת נושא שיבוץ כ״א בגני ילדים,עיריית רעננה,רעננה,https://did.li/xZjba,2026-06-09,Biltiformali-Telegram,משרה מלאה,ממשלתי,ביניים,Nonprofit/NGO,עיריית רעננה מגייסת לאגף החינוך- אחראי/ת נושא שיבוץ כ''א בגני ילדים !  הגישו מועמדות עוד היום והצטרפו לצוות מקצועי  https://did.li/xZjba,עיריית רעננה מגייסת לאגף החינוך- אחראי/ת נושא שיבוץ כ''א בגני ילדים !  הגישו מועמדות עוד היום והצטרפו לצוות מקצועי  https://did.li/xZjba
eb34cd4d6312,יועצ.ת מעבר גליל,תנועת אור,גליל,"https://ttps://minisite.niloos.ai/vacancy/69edf2e391674d48cdeef32d
",2026-06-09,Biltiformali-Telegram,,עמותות,,Nonprofit/NGO,"לתנועת אור, הפועלת להקמת המרכזים החדשים בנגב ובגליל, דרוש.ה *יועצ.ת מעבר גליל* לייעוץ ומתן מידע לפונים המתעניינים במעבר לגליל, ניהול קשר שוטף, סיוע בתהליך המעבר ומעקב אישי עד לקליטה באזור.   📩 לפרטים נוספים והגשת מועמדות: https://minisite.niloos.ai/vacancy/69edf2e391674d48cdeef32d  תנועת אור","לתנועת אור, הפועלת להקמת המרכזים החדשים בנגב ובגליל, דרוש.ה *יועצ.ת מעבר גליל* לייעוץ ומתן מידע לפונים המתעניינים במעבר לגליל, ניהול קשר שוטף, סיוע בתהליך המעבר ומעקב אישי עד לקליטה באזור.   📩 לפרטים נוספים והגשת מועמדות: https://minisite.niloos.ai/vacancy/69edf2e391674d48cdeef32d  תנועת אור"
6023916564a5,מנהל/ת תוכנית ארצית לנוער עובר חוק,עמותת ידידים למען הנוער והחברה,ירושלים,https://app.civi.co.il/promo/id=833478&src=8842,2026-06-09,Biltiformali-Telegram,משרה מלאה,עמותות,ניהולי,Nonprofit/NGO,"לעמותת ""ידידים למען הנוער והחברה"" דרוש/ה מנהל/ת תוכנית ארצית לנוער עובר חוק.   ירושלים. כל הפרטים בקישור https://app.civi.co.il/promo/id=833478&src=8842","לעמותת ""ידידים למען הנוער והחברה"" דרוש/ה מנהל/ת תוכנית ארצית לנוער עובר חוק.   ירושלים. כל הפרטים בקישור https://app.civi.co.il/promo/id=833478&src=8842"
fab9fb1b223b,עו״ס/ית לתכנית עלמיא,עלה מוריה,גדרה,"https://tps://wa.me/972523159832

",2026-06-09,Biltiformali-Telegram,,אחר,,Nonprofit/NGO,"דרוש/ה עו״ס/ית  לתכנית ""עלמיא” | מבית ""עלה מוריה"".  📍גדרה  📲 לפרטים והגשת מועמדות: https://wa.me/972523159832  * *המשרה פונה לנשים וגברים כאחד.*","דרוש/ה עו״ס/ית  לתכנית ""עלמיא” | מבית ""עלה מוריה"".  📍גדרה  📲 לפרטים והגשת מועמדות: https://wa.me/972523159832  * *המשרה פונה לנשים וגברים כאחד.*"
3f6f4383ace4,מנהל.ת בית,בית הגלגלים,קיבוץ אורים,orel@beitgalgalim.org.il,2026-06-09,Biltiformali-Telegram,משרה מלאה,עמותות,ניהולי,Nonprofit/NGO,"לבית הדרומי של עמותת בית הגלגלים דרוש.ה מנהל.ת בית במשרה מלאה.  בית הגלגלים היא עמותה שנותנת מענה שיקומי וחברתי לילדים, בני נוער וצעירים.ות עם מוגבלויות פיזיות 👨🏻‍🦼👨🏽‍🦽בדרכם לשילוב בקהילה. העמותה מפעילה בתים ברחבי הארץ, הבית הדרומי נותן מענה לכל מחוז דרום וממוקם בקיבוץ אורים.   מחפשים את האחד.ת שיבואו להוביל את הבית שלנו לגבהים חדשים.   מכירים.ות אותו.ה? עזרו לנו לגלגל את זה הלאה  לפרטים ושליחת קורות חיים אוראל orel@beitgalgalim.org.il","לבית הדרומי של עמותת בית הגלגלים דרוש.ה מנהל.ת בית במשרה מלאה.  בית הגלגלים היא עמותה שנותנת מענה שיקומי וחברתי לילדים, בני נוער וצעירים.ות עם מוגבלויות פיזיות 👨🏻‍🦼👨🏽‍🦽בדרכם לשילוב בקהילה. העמותה מפעילה בתים ברחבי הארץ, הבית הדרומי נותן מענה לכל מחוז דרום וממוקם בקיבוץ אורים.   מחפשים את האחד.ת שיבו"
6ffa197e03f6,"מנהל/ת למידה, מחקר ופיתוח",מגדל אור - יעדים לצפון,,https://app.civi.co.il/promo/id=881617&src=8842,2026-06-09,Biltiformali-Telegram,משרה מלאה,עמותות,ניהולי,Nonprofit/NGO,"למגדל אור, מבית יעדים לצפון, דרוש/ה מנהל/ת למידה, מחקר ופיתוח!   בואו להיות חלק מהארגון המוביל בארץ בתחום של אנשים עם לקויות ראייה או עיוורון!  תפקיד סופר משמעותי בהובלה ובפיתוח מענים עבור אוכלוסיית בעלי העיוורון.  100% משרה  לבעלי ניסיון ניהולי קודם מוכח ולבעלי ניסיון מוכח בכתיבת תוכניות ובפיתוח מענים.  לפרטים נוספים ולהגשת מועמדות יש להיכנס לקישור: https://app.civi.co.il/promo/id=881617&src=8842","למגדל אור, מבית יעדים לצפון, דרוש/ה מנהל/ת למידה, מחקר ופיתוח!   בואו להיות חלק מהארגון המוביל בארץ בתחום של אנשים עם לקויות ראייה או עיוורון!  תפקיד סופר משמעותי בהובלה ובפיתוח מענים עבור אוכלוסיית בעלי העיוורון.  100% משרה  לבעלי ניסיון ניהולי קודם מוכח ולבעלי ניסיון מוכח בכתיבת תוכניות ובפיתוח מע"
363bdcc46039,מנהל/ת תחום טיפול וחוסן עובד (טיפו״ח),משרד האוצר,,"https://ttps://merkava.mrp.gov.il/giusp/index.html#/search-results?q=141091&isPublic=true
",2026-06-09,Biltiformali-Telegram,משרה מלאה,ממשלתי,ניהולי,Nonprofit/NGO,"הזדמנות להוביל את תחום הרווחה והחוסן הארגוני של עובדי משרד האוצר – דרוש/ה מנהל/ת תחום טיפול וחוסן עובד (טיפו""ח)! 🤝✨  אם יש לכם ניסיון בעבודה סוציאלית, יכולת להוביל תהליכים משמעותיים ורצון להשפיע על רווחתם של האנשים שמעצבים מדי יום את סדר היום הכלכלי של מדינת ישראל – מקומכם איתנו.  לפרטים והגשת מועמדות:  https://merkava.mrp.gov.il/giusp/index.html#/search-results?q=141091&isPublic=true  רוצים לראות איך זה באמת לעבוד במשרד האוצר?  עקבו אחרי העמוד שלנו 🤩 – האוצר מבפנים  https://www.instagram.com/lifeatmof_il?igsh=MThwNzFkbndkNzV4YQ%3D%3D&utm_source=qr","הזדמנות להוביל את תחום הרווחה והחוסן הארגוני של עובדי משרד האוצר – דרוש/ה מנהל/ת תחום טיפול וחוסן עובד (טיפו""ח)! 🤝✨  אם יש לכם ניסיון בעבודה סוציאלית, יכולת להוביל תהליכים משמעותיים ורצון להשפיע על רווחתם של האנשים שמעצבים מדי יום את סדר היום הכלכלי של מדינת ישראל – מקומכם איתנו.  לפרטים והגשת מועמד"
29503ac312bd,עו״ס להוסטל,עמותת איכות בשיקום,חולון,mailto:Arina@eychut.org.il,2026-06-09,Biltiformali-Telegram,משרה חלקית,עמותות,ביניים,Nonprofit/NGO,"עמותת ""איכות בשיקום"" מחפשת עו""ס להוסטל ייחודי בחולון המיועד למתמודדי נפש בתפקוד גבוה💙 התפקיד כולל עבודה תהליכית, משמעותית ועמוקה עם המתמודדים, ומשלב עבודה פרטנית ומערכתית.  ✨ מה מחכה לך אצלנו? ✔️ עבודה טיפולית-שיקומית עם משמעות אמיתית ✔️ עבודה עם אוכלוסיות מגוונות ומרתקות ✔️ גמישות בשעות העבודה ✔️ ליווי מקצועי וצוות תומך ✔️ הכשרות מקצועיות וימי למידה ✔️ תנאים טובים למתאימים  בין 75%- 100% משרה עם גמישות בשעות העבודה לפרטים נוספים ושליחת קורות חיים: Arina@eychut.org.il 📩","עמותת ""איכות בשיקום"" מחפשת עו""ס להוסטל ייחודי בחולון המיועד למתמודדי נפש בתפקוד גבוה💙 התפקיד כולל עבודה תהליכית, משמעותית ועמוקה עם המתמודדים, ומשלב עבודה פרטנית ומערכתית.  ✨ מה מחכה לך אצלנו? ✔️ עבודה טיפולית-שיקומית עם משמעות אמיתית ✔️ עבודה עם אוכלוסיות מגוונות ומרתקות ✔️ גמישות בשעות העבודה ✔️ ל"
aef61a0906f4,מנהל/ת מחלקת גיוס,עיריית רעננה,רעננה,https://ps://www.raanana.muni.il/gd_job/מנהל-ת-מחלקת-מיון-וגיוס-עובדים-באגף-משא/,2026-06-09,Biltiformali-Telegram,משרה מלאה,ממשלתי,ניהולי,Nonprofit/NGO,"בתקופה שבה חוסר ודאות הוא חלק מהמציאות, יש מקומות שבהם יש יציבות, משמעות והשפעה אמיתית.  עיריית רעננה מחפשת מנהל/ת מחלקת גיוס להובלת אחד התחומים המשמעותיים ביותר בארגון ציבורי גדול ומוביל.  💡 למה דווקא אצלנו? כי גיוס אצלנו הוא לא “לסגור משרות”, זה לבחור את האנשים שישפיעו על אלפי תושבים.  ✔️ ניהול והובלת מערך גיוס רחב ומגוון ✔️ הובלת פרויקטים חוצי ארגון ✔️ עבודה עם הנהלה בכירה וממשקים רבים ✔️ השפעה אמיתית על ההון האנושי של העיר  🌟 מה מיוחד בעבודה כאן? ✔️ יציבות וביטחון תעסוקתי – גם בתקופות מורכבות ✔️ עשייה עם משמעות אמיתית ✔️ צוות איכותי ומקצועי ✔️ עבודה דינאמית בארגון גדול ומאתגר  🎯 למי זה מתאים? למי שיודע/ת להוביל, לנהל ולהזיז תהליכים למי שחושבת רחב, רואה אנשים ויודע/ת להביא את הטובים ביותר ולמי שמחפש/ת מקום שבו העבודה שלו/ה באמת משנה  אם את/ה מחפש/ת תפקיד עם עומק, אחריות והשפעה, המקום שלך איתנו. לפרטים נוספים והגשת מועמדות, לחצו על הקישור:https://www.raanana.muni.il/gd_job/מנהל-ת-מחלקת-מיון-וגיוס-עובדים-באגף-משא/","בתקופה שבה חוסר ודאות הוא חלק מהמציאות, יש מקומות שבהם יש יציבות, משמעות והשפעה אמיתית.  עיריית רעננה מחפשת מנהל/ת מחלקת גיוס להובלת אחד התחומים המשמעותיים ביותר בארגון ציבורי גדול ומוביל.  💡 למה דווקא אצלנו? כי גיוס אצלנו הוא לא “לסגור משרות”, זה לבחור את האנשים שישפיעו על אלפי תושבים.  ✔️ ניהול וה"
3329c63401f8,יועץ/ת קריירה והתמחויות,אוניברסיטת בן-גוריון,באר שבע,https://bguhr.my.salesforce-sites.com/Gius?mode=jobs,2026-06-09,Biltiformali-Telegram,משרה מלאה,אקדמיה,ביניים,Nonprofit/NGO,"🎯💼 רוצים לעזור לדור הבא של הבוגרים להשתלב בשוק העבודה? למרכז לפיתוח קריירה דרוש/ה יועץ/ת קריירה והתמחויות!   🔍 מה כולל התפקיד? מתן שירותי ייעוץ וליווי קריירה אישיים לסטודנטים ובוגרים, לצד פיתוח וניהול קשרי מעסיקים לשיתופי פעולה. התפקיד כולל הובלת תוכנית התמחויות מקצה לקצה (גיוס, שיווק, ראיונות ושיבוץ), ארגון אירועי גיוס, סדנאות והרצאות אורח, ואיתור הזדמנויות תעסוקתיות תוך ביצוע הדרכות שוטפות.  💼 דרישות: ✔️ תואר ראשון ברוח וחברה ו/או ניהול - חובה ✔️ ניסיון תעסוקתי לפחות 3 שנים בייעוץ תעסוקתי/ גיוס והשמה / משאבי אנוש - חובה ✔️ הכרות עם שינויים ומגמות בשוק התעסוקה ✔️ שליטה ב – LinkedIn ✔️ הכרות עם כלי AI בניהול קריירה - יתרון ✔️ הכרות עם עולם האקדמיה - יתרון ✔️ שליטה, הבנה ויכולת בכל הקשור בפרסום ברשתות חברתיות ✔️ יכולת הובלה ויוזמה ✔️ ניסיון בארגון אירועים - יתרון ✔️ אנגלית ברמה טובה ✔️ תודעת שירות גבוהה, יחסי אנוש מצוינים ויכולת עבודה עצמאית ובצוות   📍 המשרה ממוקמת באוניברסיטת בן-גוריון 🕐 היקף: 100% משרה בחוזה אישי 💡 הערה: נכונות לעבודה בשעות אחה""צ באירועי המרכז 📧 הגשת מועמדות תיעשה דרך אתר האוניברסיטה. יש להיכנס לקישור הבא (מכרז 216-2025): https://bguhr.my.salesforce-sites.com/Gius?mode=jobs","🎯💼 רוצים לעזור לדור הבא של הבוגרים להשתלב בשוק העבודה? למרכז לפיתוח קריירה דרוש/ה יועץ/ת קריירה והתמחויות!   🔍 מה כולל התפקיד? מתן שירותי ייעוץ וליווי קריירה אישיים לסטודנטים ובוגרים, לצד פיתוח וניהול קשרי מעסיקים לשיתופי פעולה. התפקיד כולל הובלת תוכנית התמחויות מקצה לקצה (גיוס, שיווק, ראיונות ושיבו"
e1759571045a,מנכ״ל/ית,אגודה בגבעת רם,גבעת רם,mazkirut@givatram.org,2026-06-09,Biltiformali-Telegram,משרה מלאה,עמותות,ניהולי,Nonprofit/NGO,"📢 דרוש/ה מנכ״ל/ית אנחנו מחפשים את המנהיג/ה הבא/ה שיובילו את הדרג המקצועי של האגודה בגבעת רם!  💼 הגדרות התפקיד:   * ניהול והוצאה לפועל של כלל פעילות האגודה.   * הובלת צוות העובדים.   * אחריות על התקציב, תוכניות העבודה והדו״חות כספיים.   * ניהול קשרים עסקיים עם ספקים וארגונים שותפים.   * אחריות כוללת על הניהול התקין של האגודה.  📋 דרישות התפקיד:   * ניסיון ניהולי מוכח של שנה לפחות או ניסיון כבעל/ת תפקיד באגודת סטודנטים.   * שליטה מלאה בתוכנות אופיס (Office).   * יכולת עבודה בצוות ויחסי אנוש מעולים.   * ניסיון בניהול תקציב - יתרון.   * בוגר/ת האוניברסיטה העברית - יתרון.  📄 פרטים נוספים:   * תחילת עבודה: מיידית   * היקף המשרה: משרה מלאה (100%)   * משך ההעסקה: שנתיים   המכרז פתוח עד 22.6 (כולל)  הגשת המועמדות כוללת קורות חיים ומכתב מוטיבציה (עד עמוד אחד).  מומלץ לצרף גם מכתבי המלצה.  להגשת מועמדות 👇  📩 mazkirut@givatram.org","📢 דרוש/ה מנכ״ל/ית אנחנו מחפשים את המנהיג/ה הבא/ה שיובילו את הדרג המקצועי של האגודה בגבעת רם!  💼 הגדרות התפקיד:   * ניהול והוצאה לפועל של כלל פעילות האגודה.   * הובלת צוות העובדים.   * אחריות על התקציב, תוכניות העבודה והדו״חות כספיים.   * ניהול קשרים עסקיים עם ספקים וארגונים שותפים.   * אחריות כוללת "
