id,title,company,city,url,date_posted,source,work_type,sector,level,raw_text
50f5ce90d1d8,"מנכ""ל/ית להאב חדשנות",קרן פילנתרופית,,noa@hunter.co.il,2026-05-10,Telegram: מציאת עבודה,משרה מלאה,עמותות,בכיר,"🌼*מנכ""ל/ית להאב חדשנות*🌼 קרן פילנתרופית מהמובילות בארץ מחפשת מנכ""ל/ית להקמה מאפס וניהול של האב חדשנות שיוקם לטובת מתן פתרונות לסוגיות חברתיות שונות בארץ.   על המנכ""ל/ית לתרגם את החזון לתכנית מפורטת ולבנות את ההאב תוך בחירה של המיזמים. כחלק מניהול ההאב תהיה על המנכ""ל/ית האחריות לספק תמיכה חניכה והנחי"
dcf6e4c8b744,"סמנכ""ל שותפויות",מישרים,,https://medulla.co.il/?p=29787,2026-05-10,Telegram: מציאת עבודה,,עמותות,בכיר,"משרה חדשה ב #מדולה_לקהילה ❤️  *לארגון ""מישרים"" דרוש.ה סמנכ""ל.ית שותפויות*  התפקיד כולל תכנון והובלה אסטרטגית של הארגון ותכנון וניהול ממשקי העבודה של המיזם אל מול השותפים השונים בשיתוף עם מנכ""ל המיזם.   אם יש לך ניסיון בעבודה במערכת החינוך והכרות עם בעלי התפקיד המרכזיים בתחום בתי הספר, ניסיון במיסוד "
243d0dbe5358,עבודה באגודה לבריאות הציבור,אגודה לבריאות הציבור,,https://t.me/biltiformali/33301,2026-05-09,Telegram: מציאת עבודה,,עמותות,,"עדיין רלוונטי! אם אתם מחפשים עבודה משמעותית, עם סיפוק ולב גדול, יחד עם תמוש — אישה עם לב ענקי — באגודה לבריאות הציבור, זו העבודה בשבילכם. מבטיחה לכם, מניסיון, שתזכו בגדול ולא תצטערו.  לפרטים נוספים ולשליחת קורות חיים: תמי:0502528937 Tamik@aguda.co.il"
98018f421a12,חוקרת - תחום הערכת תכניות,מטח,,https://cet.ac.il/jobs_categories/head/,2026-05-08,Telegram: מציאת עבודה,,חינוך,ביניים,"https://cet.ac.il/jobs_categories/head/  חוקרת - תחום הערכת תכניות, מטח"
3992384507ee,מנהל.ת מחלקת קיימות,עיריית רמת גן,רמת גן,"ttps://katzr.net/1657ae
",2026-05-08,Telegram: מציאת עבודה,משרה מלאה,ממשלתי,ניהולי,"לראשונה בעיריית ר״ג – אצלינו ביחידה הסביבתית קמה מחלקה חדשה: מחלקת קיימות!  לא עוד פרויקט, לא עוד יוזמה בודדת. מחלקה שלמה שתעבוד יחד עם התושבים על מה שבאמת משנה: פסולת וכלכלה מעגלית, חינוך סביבתי, גינות קהילתיות. קהילה שחיה אחרת.  ועכשיו אנחנו מחפשים את האיש.ה שתקח את זה קדימה.  דרוש.ה מנהל.ת מחלקת "
fbfa9f0b6769,משרות מטה - קרן רמון,קרן רמון,,s://form.jotform.com/261254429790462,2026-05-07,Telegram: מציאת עבודה,משרה מלאה,עמותות,,"✨ יכול להיות שהצעד הבא שלכם מתחיל כאן ✨  קרן רמון מגייסת למגוון משרות מטה ומחפשת א.נשים עם חיבור לעשייה חינוכית, אהבה לאנשים, ורצון לקחת חלק בעבודה עם משמעות אמיתית!  אנחנו פועלים ברוחם של אילן, רונה ואסף רמון, ומפתחים תוכניות חינוכיות מעוררות השראה דרך עולמות החלל והתעופה, עבור אלפי ילדים וילדות בר"
8924408b1376,עובד/ת קידום נוער,עיריית תל אביב-יפו,תל אביב-יפו,https://t.me/biltiformali/33281,2026-05-07,Telegram: מציאת עבודה,,ממשלתי,ביניים,"עובד/ת קידום נוער - עיריית ת""א 📢 מחפשים עבודה עם שליחות?  הצטרפו לנבחרת קידום הנוער של תל אביב-יפו! 🌟  עיריית תל אביב-יפו מגייסת עובד/ת קידום נוער לעבודה משמעותית וייחודית עם בני נוער בסיכון בתוך המגזר החרדי. אם יש לך לב רחב, יכולת ליצור קשרים עמוקים ותשוקה לחולל שינוי אמיתי בחייהם של נערים – המקום "
974ffb503687,מנהל/ת בכיר/ה להקמת פעילות ארצית בתחום הגיוון והתעסוקה,,,https://minisite.niloos.ai/vacancy/69fc3826104e7a02c3f960be,2026-05-07,Telegram: מציאת עבודה,משרה מלאה,אחר,בכיר,"מובילים שינוי בתעסוקה? אנחנו מחפשים אתכם. להקמת פעילות ארצית חדשה בתחום הגיוון והתעסוקה, דרוש/ה מנהל/ת בכיר/ה.  דרישות התפקיד:      ניסיון בהקמת מערכים מורכבים בפריסה ארצית.      חובה נסיון בניהול מנהלים ותקציבים רחבי היקף (7M+).      מומחיות בעולמות התעסוקה ואוכלוסיות הגיוון.  הזדמנות להשפיע על פני"
b4e381c83d12,מנהל.ת בית לקידום נוער,קרן פרידמן ועמותת זיו נעורים,,keren.esfridman@gmail.com,2026-05-07,Telegram: מציאת עבודה,,עמותות,ניהולי,"קרן פרידמן ועמותת זיו נעורים מחפשות מנהל.ת בית לקידום נוער התפקיד כולל: 🔸 ניהול ותפעול הבית, ליווי בני ובנות הנוער. 🔸 ניהול קשר עם בתי הספר ומשפחות בני ובנות הנוער. 🔸 ניהול והוצאה לפועל שת""פים עם חברות, ארגונים, יחידות צה""ל ועוד.  דרישות התפקיד: 🔸 תואר ראשון במדעי החברה, עדיפות לחינוך 🔸 ניסיון בתפקי"
840ce88702f0,,,,ttps://did.li/QCQx5,2026-05-07,Telegram: מציאת עבודה,,,,*בואו להיות חלק מצוות מנצח* 🤗 לפרטים נוספים ותיאור התפקיד בלינק המצורף https://did.li/QCQx5
0aed8a699ea5,מנהל/ת חינוך לגיל הרך,קיבוץ שמיר,,https://t.me/biltiformali/33250,2026-05-06,Telegram: מציאת עבודה,משרה מלאה,חינוך,ניהולי,"""מחפשים תפקיד עם משמעות אמיתית?  קיבוץ שמיר מגייס מנהל/ת חינוך לגיל הרך להובלת מערכת חינוכית מגיל לידה ועד גן חובה 🌱  זו הזדמנות להוביל, להשפיע, ולבנות דור עתיד בתוך קהילה חמה, ערכית ותומכת.  התפקיד כולל: ✔ ניהול מערך חינוכי מלא ✔ הובלת צוותים והדרכה מקצועית ✔ בניית תכניות עבודה ופיתוח מערכת ✔ עבודה"
8a7b51ec269c,מוביל/ת גיוס ומיתוג,משרד המשפטים,,ps://merkava.mrp.gov.il/giusp/index.html#/position/07327563,2026-05-06,Telegram: מציאת עבודה,משרה מלאה,ממשלתי,ניהולי,"מגייס.ת ורוצה לעבור לשלב הבא? המשרה הבאה בשבילך. אם את.ה חי.ה ונושמ.ת גיוס, אבל מרגיש.ה שהגיע הזמן להשפיע יותר, זו ההזדמנות שלך. משרד המשפטים מגייס מוביל/ת גיוס ומיתוג   💡 מה בתפקיד? ▪️ הובלת אסטרטגיות גיוס והתאמה לשוק העבודה המשתנה ▪️ שותפות עם מנהלים מגייסים באפיון משרות ובניית תהליכי גיוס אפקטיבי"
39243b2f38a8,"מנהל/ת תחום טיפול וחוסן עובד (טיפו""ח)",משרד העלייה והקליטה,ירושלים,tps://go.gov.il/o397o,2026-05-06,Telegram: מציאת עבודה,משרה מלאה,ממשלתי,ניהולי,"משרד העלייה והקליטה מגייס מנהל/ת תחום טיפול וחוסן עובד (טיפו""ח)  אנחנו מחפשים עובד/ת סוציאלי/ת שיודע/ת לשלב בין ליווי עובדים ובני משפחותיהם לבין בניית מערך חוסן. 🤝✨  מה בתפקיד? ✔בניית מערך תמיכה וליווי אישי לעובדים ובני משפחותיהם וכן לגמלאי המשרד בעיתות מצוקה ומשבר. ✔בניית מערך חוסן וסיוע רווחתי שנת"
cccef160b02d,רכז/ת סגל פרא רפואי,מטה אסותא,,https://www.assuta.co.il/jobs/search/position/?jobid=101767&referid=300,2026-05-05,Telegram: מציאת עבודה,,עסקי,ביניים,מטה אסותא מגייס רכז/ת סגל פרא רפואי  מוזמנים/ות להגיש מועמדות. למידע נוסף ושליחת קורות חיים –  https://www.assuta.co.il/jobs/search/position/?jobid=101767&referid=300
0edd3a4d5bd1,"סמנכ""ל שותפויות",מישרים,,https://medulla.co.il/?p=29787,2026-05-05,Telegram: מציאת עבודה,,עמותות,בכיר,"משרה חדשה ב #מדולה_לקהילה ❤️  *לארגון ""מישרים"" דרוש.ה סמנכ""ל.ית שותפויות*  התפקיד כולל תכנון והובלה אסטרטגית של הארגון ותכנון וניהול ממשקי העבודה של המיזם אל מול השותפים השונים בשיתוף עם מנכ""ל המיזם.   אם יש לך ניסיון בעבודה במערכת החינוך והכרות עם בעלי התפקיד המרכזיים בתחום בתי הספר, ניסיון במיסוד "
dadf0cf8e8b2,רכז.ת למידה ופיתוח מנהיגות,הספריה הלאומית,ירושלים,https://www.nli.org.il/he/at-your-service/career#learning,2026-05-05,Telegram: מציאת עבודה,משרה מלאה,ממשלתי,ביניים,"דרוש.ה רכז.ת למידה ופיתוח מנהיגות לספריה הלאומית  תפקיד התחלתי המהווה הזדמנות מצוינת להשתלב בעולמות משאבי האנוש, הלמידה והפיתוח הארגוני. העבודה כוללת הוצאה לפועל של תוכניות למידה, הדרכה ופיתוח עובדים ומנהלים, כולל שת״פ עם מוסדות לימוד ותרבות בארץ ובעולם. מעקב אחרי ביצוע, הפקת דוחות ותפעול האופרציה ש"
7fa572b1a1f7,"אנשי ונשות טיפול לתכנית ""זמן אבא""",Early Starters ישראל,"כרמיאל, שלומי",https://t.me/biltiformali/33235,2026-05-05,Telegram: מציאת עבודה,משרה חלקית,עמותות,ביניים,"אנחנו מגייסים אנשי ונשות טיפול לתכנית “זמן אבא”  ב-Early Starters ישראל אנו מפעילים את תכנית “זמן אבא” – סדרת מפגשים לאבות משרתי מילואים ולילדיהם (בני 4–6), שנועדה לחזק את הקשר ביניהם דרך חוויה משותפת של משחק ושיח, במרחב בטוח ומקרב.  ✨ משרות פתוחות *באזור הצפון*: * כרמיאל (ימי שני החל מ1/6) * ⁠שלומי"
04873747e7de,פסיכולוגים/יות ועובדים/ות סוציאליים MSW למכון חיבורים,מכון חיבורים,"פתח תקווה, חולון, ראשל""צ, תל אביב, נתניה, רעננה ורמת גן",https://hiburimnamal.co.il/,2026-05-05,Telegram: מציאת עבודה,משרה חלקית,אחר,ביניים,"דרושים/ות פסיכולוגים/יות ו-עו""ס MSW למכון ""חיבורים"" (פתח תקווה, חולון, ראשל""צ, תל אביב, נתניה, רעננה ורמת גן). קצת עלינו https://hiburimnamal.co.il/  אנחנו מחפשים מטפלים/ות לקהל הילדים והנוער שלנו אבל לא רק בעיקר בגישת הגל השלישי :)  קהילת המטפלים שלנו נהנת מ:  ⭐ליווי צמוד בתכנית הדרכות, השתלמויות ו"
ea8b3703a766,רכז/ת התמכרויות ארצי/ת במערך בריאות הנפש,הכללית,,https://jobs.clalitapps.co.il/clalit/redmatch-apply/redmatch.apply.html?CompPositionId=44931&referrerId=3283,2026-05-05,Telegram: מציאת עבודה,משרה מלאה,עסקי,בכיר,"איש/אשת מקצוע בתחומי הטיפול: פסיכיאטריה, עבודה סוציאלית, פסיכולוגיה, קרימינולוגיה או אחיות ובעל/ת ניסיון נרחב וידע בתחום ההתמכרויות? ההנהלה הראשית של הכללית מזמינה אותך להגיש מועמדות לתפקיד רכז/ת התמכרויות ארצי/ת במערך בריאות הנפש. זהו תפקיד משמעותי ומשפיע ברמה הארצית, הכולל אחריות לפיתוח ובניית מער"
9a488bb5d126,מנהל/ת תקשורת ודיגיטל,ארגון שיתופים,בית יהושע,inyurl.com/3nzthfy8,2026-05-05,Telegram: מציאת עבודה,משרה מלאה,עמותות,ניהולי,*ארגון שיתופים מגייס מנהל/ת תקשורת ודיגיטל* אנחנו מחפשים מנהל/ת תקשורת ודיגיטל שיוביל/תוביל את האסטרטגיה התקשורתית של הארגון וימצב/תמצב אותו כגורם מוביל בשדה השינוי החברתי.  📌 *תחומי אחריות מרכזיים* 🔹 גיבוש והובלת האסטרטגיה התקשורתית של הארגון ועיצוב הנרטיב הארגוני 🔹 ניהול יחסי ציבור ומהלכי חשיפה תק
e9d9fd0d9837,מנהל/ת קבוצה - תוכנית הזנק,מדרשת תבור,,heznek@tavor.org.il,2026-05-05,Telegram: מציאת עבודה,משרה מלאה,חינוך,ניהולי,"מחפשים תפקיד עם משמעות עמוקה, אדרנלין ועבודה עם הדור הבא? 🇮🇱 מדרשת תבור מחפשת שחקני נשמה להובלת תוכנית ""הזנק"" – מחזורים אינטנסיביים ומעצבי זהות למסיימי י""א-י""ב לקראת שירותם הצבאי.  *מנהל/ת קבוצה:  מה כולל התפקיד?  - ניהול מלא: אחריות פדגוגית, לוגיסטית ותקציבית של הקבוצה. - הובלת צוות: ליווי מקצועי ו"
565e84ce9968,מנכ״ל/ית לעמותת גשר אל הנוער,עמותת גשר אל הנוער,אזור המרכז,https://t.me/biltiformali/33221,2026-05-05,Telegram: מציאת עבודה,משרה חלקית,עמותות,בכיר,"דרוש/ה מנכ״ל/ית לעמותת ""גשר אל הנוער"" (משרה חלקית – 3 ימים בשבוע)  עמותת גשר אל הנוער פועלת לקידום, ליווי והעצמה של בני נוער בסיכון, ומובילה תוכניות חינוכיות וחברתיות בעלות השפעה רחבה.  אנו מחפשים מנכ״ל/ית ערכי/ת, יוזמ/ת ומנוסה, שיצטרף/תצטרף להובלת הארגון לשלב הצמיחה הבא.  תחומי אחריות: הובלה אסטרטג"
f7dd8600ef2e,איש/אשת טיפול,עמותת חמניות - המקום לילדים שאיבדו הורה,אום אל פחם,"ttps://wkf.ms/3O0OBPD
",2026-05-05,Telegram: מציאת עבודה,משרה חלקית,עמותות,,"עמותת חמניות | המקום לילדים שאיבדו הורה - מחפשת אותך! 🌻  דרוש/ה איש/אשת טיפול   לתפקיד משמעותי במרכז העמותה באום אל פחם (דובר.ת השפה הערבית)  העבודה במשרה חלקית וכוללת עבודה בשעות הבוקר ובשעות אחה""צ.  לפרטים נוספים והגשת מועמדות בקישור הייעודי - https://wkf.ms/3O0OBPD  לכל המשרות הפתוחות בעמותה: htt"
23c1a965270b,מנכ״ל/ית לעמותת גשר אל הנוער,עמותת גשר אל הנוער,אזור המרכז,https://t.me/biltiformali/33213,2026-05-05,Telegram: מציאת עבודה,משרה חלקית,עמותות,בכיר,"דרוש/ה מנכ״ל/ית לעמותת ""גשר אל הנוער"" (משרה חלקית – 3 ימים בשבוע)  עמותת גשר אל הנוער פועלת לקידום, ליווי והעצמה של בני נוער בסיכון, ומובילה תוכניות חינוכיות וחברתיות בעלות השפעה רחבה.  אנו מחפשים מנכ״ל/ית ערכי/ת, יוזמ/ת ומנוסה, שיצטרף/תצטרף להובלת הארגון לשלב הצמיחה הבא.  תחומי אחריות: הובלה אסטרטג"
62e2c461818d,רכז.ת למידה ופיתוח מנהיגות,הספריה הלאומית,ירושלים,https://www.nli.org.il/he/at-your-service/career#learning,2026-05-05,Telegram: מציאת עבודה,משרה מלאה,ממשלתי,ביניים,"דרוש.ה רכז.ת למידה ופיתוח מנהיגות לספריה הלאומית  תפקיד התחלתי המהווה הזדמנות מצוינת להשתלב בעולמות משאבי האנוש, הלמידה והפיתוח הארגוני. העבודה כוללת הוצאה לפועל של תוכניות למידה, הדרכה ופיתוח עובדים ומנהלים, כולל שת״פ עם מוסדות לימוד ותרבות בארץ ובעולם. מעקב אחרי ביצוע, הפקת דוחות ותפעול האופרציה ש"
f0b524f93f99,ראש/ת תחום צעירים-דרום,קדמה,דרום,yogev@kedma-hityashvut.org,2026-05-04,Telegram: מציאת עבודה,משרה מלאה,עמותות,ניהולי,"קדמה מחפשת ראש/ת תחום צעירים-דרום   תפקיד ניהולי של דמות מובילה, מחברת ומלאת אנרגיה, שתלווה את המנהלים ותוביל עשייה משמעותית 🌵 אם יש לך רקע בניהול, יכולת לעבוד עם אנשים, אהבה לעשייה חברתית ורצון להשפיע באמת - אנחנו מחפשים אותך 💪  📍 משרה מידית בהיקף -100% 📧 שלחו קו""ח ל: yogev@kedma-hityashvut.org  📞 "
b2737819594c,מנהל/ת משאבי אנוש,כפר הנוקדים,ערד,https://t.me/biltiformali/33195,2026-05-04,Telegram: מציאת עבודה,משרה מלאה,אחר,ניהולי,"דרוש/ה מנהל/ת משאבי אנוש  לכפר הנוקדים  הלב שמוביל אנשים, תרבות ותהליכים 💛  מיקום - ערד  מה התפקיד כולל? • ניהול משאבי אנוש ושכר • גיוס, קליטה וליווי עובדים ומנהלים • הובלת רווחה ומחוברות עובדים • בקרה על שכר, שעות ודוחות מה חשוב לנו? • ניסיון בניהול HR– חובה • חשבות שכר – יתרון • סדר, דיוק ויכולת א"
b3efbd5181e9,מנהל.ת בית לקידום נוער,עמותת זיו נעורים וקרן פרידמן,,keren.esfridman@gmail.com,2026-05-04,Telegram: מציאת עבודה,,עמותות,ניהולי,"עמותת זיו נעורים וקרן פרידמן מחפשות מנהל.ת בית לקידום נוער התפקיד כולל: 🔸 ניהול ותפעול הבית, ליווי בני ובנות הנוער. 🔸 ניהול קשר עם בתי הספר ומשפחות בני ובנות הנוער. 🔸 ניהול והוצאה לפועל שת""פים עם חברות, ארגונים, יחידות צה""ל ועוד.  דרישות התפקיד: 🔸 תואר ראשון במדעי החברה, עדיפות לחינוך 🔸 ניסיון בתפקי"
0bc3c589976c,מנהל/ת מרכז מיטל,עמותת בית לכל ילד,פתח תקווה והסביבה,s://tinyurl.com/4zmdv8aa,2026-05-04,Telegram: מציאת עבודה,משרה מלאה,עמותות,ניהולי,"*דרוש/ה: מנהל/ת מרכז מיטל — פתח תקווה והסביבה* מרכז מיטל, המתמחה בטיפול בפגיעות מיניות, הינו חלק מעמותת בית לכל ילד — המעניקה מעטפת טיפולית מקצועית וחמה לילדים ולנוער בסיכון ולמשפחותיהם.  📌 *תחומי האחריות העיקריים* ניהול מקצועי, הכשרתי, תפעולי ותקציבי של המרכז | ליווי גיוס וניהול צוות מקצועי ומיומן "
62da16544ee7,רכז/ת מענקים מחקריים,רשות המחקר באוניברסיטה,,https://campaign.adamtotal.co.il?d=cLdgogfchQGDS%2bkE0ZhC3g%3d%3d,2026-05-04,Telegram: מציאת עבודה,,חינוך,ביניים,"רשות המחקר באוניברסיטה מגייסים *רכז/ת מענקים מחקריים*, *מתאים גם לסטודנטים בשנה האחרונה ללימודים*.  תפקיד אדמיניסטרטיבי מעניין בתחום המחקר, עבודה מול חברי סגל בכיר וגופי מימון מחוץ לאוניברסיטה בארץ ובעולם.  לפרטים נוספים והגשת מועמדות: https://campaign.adamtotal.co.il?d=cLdgogfchQGDS%2bkE0ZhC3g%3d%3"
cabc22cdd268,מנהל/ת תחום מעורבות חברתית,עיריית כפר סבא,כפר סבא,https://t.me/biltiformali/33181,2026-05-04,Telegram: מציאת עבודה,,ממשלתי,ניהולי,"👋 צעירים וצעירות בואו לקדם את העתיד שלכם  עיריית כפר סבא מגייסת למרכז צעירים (ה-מקום לגילאי 18-40):  🤝 -מנהל/ת תחום מעורבות חברתית   עבודה עם לב גדול, באווירה צעירה ומשפחתית.  📩 קורות חיים ואישורים נוספים- Uvalp@ksaba.co.il"
0e15d5f0a3ff,משרה בעמותת הנמר- בוגרי סיירת גולני,עמותת הנמר- בוגרי סיירת גולני,,https://drive.google.com/file/d/138S6pj61iUOiCBEkyRuSx7crMVgf1kgX/view?usp=sharing,2026-05-03,Telegram: מציאת עבודה,,עמותות,,משרה בעמותת הנמר- בוגרי סיירת גולני לפרטים נוספים ושליחת קורות חיים -  https://drive.google.com/file/d/138S6pj61iUOiCBEkyRuSx7crMVgf1kgX/view?usp=sharing
1a41dab90370,"מנהל.ת הוראה לתוכנית מגשימים מדמ""ח 5 יח""ל",,,https://did.li/HW7Iw,2026-05-03,Telegram: מציאת עבודה,משרה מלאה,חינוך,ניהולי,"מחפש.ת אתגר אמיתי, מצוינות טכנולוגית ושליחות חברתית? בואו להוביל איתנו.  דרוש.ה מנהל.ת הוראה לתוכנית מגשימים מדמ""ח 5 יח""ל. התפקיד כולל: * ניהול, הכשרה וליווי של מורים * * אחריות ארצית על תחום ההדרכה * * הזדמנות ליצור השפעה חינוכית-טכנולוגית משמעותית בפריפריה של ישראל * אנחנו מחפשים: * ניסיון של 3 שנ"
3fe0c42c0ca7,מנהל.ת מרכז ראשון לציון,עמותת צעד קדימה,ראשון לציון,https://t.me/biltiformali/33167,2026-05-03,Telegram: מציאת עבודה,משרה מלאה,עמותות,ניהולי,"מנהל.ת עם דרייב להוביל ולהשפיע? זה בשבילך 🔥  עמותת צעד קדימה מחפשת מנהל.ת מרכז ראשון לציון(בית ספר + גנים)  זה לא עוד תפקיד ניהולי. זו הזדמנות להוביל צוותים, להשפיע על ילדים ומשפחות, ולבנות מציאות חינוכית אחרת.  מה בתפקיד? ניהול כולל של מרכז חינוכי, הובלת צוותים רב מקצועיים, עבודה עם הורים וגורמי מק"
626921e5106b,רכז/ת לוגיסטיקה - אגף הבחינות,,,ttps://campaign.adamtotal.co.il?d=E75VtsmKm0ItdSbEGW9qPA%3d%3d,2026-05-03,Telegram: מציאת עבודה,משרה מלאה,ממשלתי,ביניים,"דרוש/ה *רכז/ת לוגיסטיקה* – אגף הבחינות📋 תפקיד משמעותי הכולל תכנון וארגון מערך הבחינות, עבודה מול ממשקים רבים ומענה לאתגרים בזמן אמת.  תואר ראשון / הנדסאי/ת – חובה למה אצלנו? # תפקיד עם משמעות והשפעה אמיתית # סביבת עבודה מקצועית ותומכת # עבודה מגוונת, לא שגרתית, עם אתגר ועניין # הזדמנות להשתלב באגף מ"
c0734d9af7dc,מנהל/ת פנימייה,הסוכנות היהודית,,https://careers.jewishagency.org/career/%D7%9E%D7%A0%D7%94%D7%9C-%D7%AA-%D7%A4%D7%A0%D7%99%D7%9E%D7%99%D7%99%D7%94-%D9%85%D8%AF%D9%8A%D8%B1%D8%A9-%D9%85%D9%8E%D8%AF%D9%92%D8%B1%D9%8E%D8%B3%D9%8E%D8%A9-%D8%AF%D9%8E%D8%A7%D8%AE%D9%90%D9%84/,2026-05-02,Telegram: מציאת עבודה,משרה מלאה,עמותות,ניהולי,https://careers.jewishagency.org/career/%D7%9E%D7%A0%D7%94%D7%9C-%D7%AA-%D7%A4%D7%A0%D7%99%D7%9E%D7%99%D7%99%D7%94-%D9%85%D8%AF%D9%8A%D8%B1%D8%A9-%D9%85%D9%8E%D8%AF%D9%92%D8%B1%D9%8E%D8%B3%D9%8E%D8%A9-%D8%AF%D9%8E%D8%A7%D8%AE%D9%90%D9%84/
9b29415a6b52,מנהל/ת פרויקט גיור עולי בני המנשה,הסוכנות היהודית,,https://careers.jewishagency.org/career/%D7%9E%D7%A0%D7%94%D7%9C-%D7%AA-%D7%A4%D7%A8%D7%95%D7%99%D7%A7%D7%98-%D7%92%D7%99%D7%95%D7%A8-%D7%A2%D7%95%D7%9C%D7%99-%D7%91%D7%A0%D7%99-%D7%94%D7%9E%D7%A0%D7%A9%D7%94/,2026-05-02,Telegram: מציאת עבודה,משרה מלאה,עמותות,ניהולי,https://careers.jewishagency.org/career/%D7%9E%D7%A0%D7%94%D7%9C-%D7%AA-%D7%A4%D7%A8%D7%95%D7%99%D7%A7%D7%98-%D7%92%D7%99%D7%95%D7%A8-%D7%A2%D7%95%D7%9C%D7%99-%D7%91%D7%A0%D7%99-%D7%94%D7%9E%D7%A0%D7%A9%D7%94/
