id,title,company,city,url,date_posted,source,work_type,sector,level,employer_type,description,raw_text
9fa99ce28286,מנהל/ת פיתוח משאבים ושותפויות,בינה בלב,עוטף וגליל (היברידי),https://t.me/biltiformali/33587,2026-05-19,Biltiformali-Telegram,משרה חלקית,עמותות,ניהולי,Nonprofit/NGO,"מנהל/ת פיתוח משאבים ושותפויות - בינה בלב (חל""צ) 🚀 ""בינה בלב"" פועלת לשיקום ופיתוח הנגב המערבי (ניר עוז) והגליל דרך בניית תשתית אנושית ללמידת AI בפריפריה. אנחנו מחפשים איש/אשת מקצוע להובלת מערך גיוס המשאבים והעמקת השותפויות שלנו.  📍 מיקום: מודל היברידי (בית + עבודה בשטח בעוטף ובגליל). ⏰ היקף משרה: 60% משרה. 💰 תנאים: שכר הוגן + מודל בונוסים מבוסס הצלחה.  מה התפקיד כולל?  ניהול ושימור קשרים: עבודה מול בסיס התורמים הקיים של הארגון ופיתוח ערוצים חדשים (פילנתרופיה, ממשל ו-CSR).  כתיבת תוכן ואימפקט: כתיבת מענקים, דוחות תורמים וניוזלטרים ברמה גבוהה מאוד (עברית ואנגלית).  חומרים אסטרטגיים: יצירת כלי עזר לגיוס (One-pagers, פרזנטציות) להצגת פעילות הארגון.  ניהול אופרטיבי: ניהול עצמאי של גאנט הגשות, מעקב אחר דיווחים ועמידה ביעדים.  חיבור לשטח: נסיעות למוקדי הפעילות לטובת חיבור בלתי אמצעי לעשייה וליווי ביקורי תורמים.  מה אנחנו מחפשים? ✔️ ניסיון מוכח בגיוס משאבים ופיתוח שותפויות במגזר השלישי – חובה. ✔️ יכולות כתיבה וניסוח מעולות בעברית ובאנגלית (רמה גבוהה מאוד/שפת אם). ✔️ יכולת ניהול עצמית גבוהה, סדר וארגון (עבודה מול יעדים ולוחות זמנים). ✔️ תקשורת בינאישית מעולה וניסיון בעבודה מול תורמים וקרנות. ✔️ רצון אמיתי להיות חלק מעשייה חברתית משמעותית בפריפריה.  📩 קורות חיים למייל: tal@binahbalev.org (המשרה מיועדת לנשים וגברים כאחד. רק פניות מתאימות תעננה).","מנהל/ת פיתוח משאבים ושותפויות - בינה בלב (חל""צ) 🚀 ""בינה בלב"" פועלת לשיקום ופיתוח הנגב המערבי (ניר עוז) והגליל דרך בניית תשתית אנושית ללמידת AI בפריפריה. אנחנו מחפשים איש/אשת מקצוע להובלת מערך גיוס המשאבים והעמקת השותפויות שלנו.  📍 מיקום: מודל היברידי (בית + עבודה בשטח בעוטף ובגליל). ⏰ היקף משרה: 60%"
fce0a279f7be,מזכיר/ת מושב – מבוא ביתר,מושב מבוא ביתר,מבוא ביתר,https://t.me/biltiformali/33582,2026-05-19,Biltiformali-Telegram,משרה מלאה,אחר,ניהולי,Nonprofit/NGO,"*דרוש/ה מזכיר/ת מושב – מבוא ביתר*  למושב מבוא ביתר דרוש/ה מזכיר/ה מושב. תחומי אחריות:  • ניהול ותפעול שוטף: אחריות על החזקה ותחזוקה של תשתיות המושב כולל מבנים, שפ""ע, עבודה מול ספקים ועובדי מנהלה  • ניהול תקציב וגבייה  • ריכוז ובינוי קהילה – אירועים קהילתיים, חינוך בלתי פורמאלי, מתנדבים. • עבודה מול ועד המושב והמועצה האזורית.   דרישות: • ניסיון ניהולי ותפעולי  • עבודה עם סדר וארגון, יכולת ניהול משימות ועצמאות • יחסי אנוש טובים  • ניסיון בניהול תקציב  היקף משרה: מלאה   הגשת מועמדות: קורות חיים בצירוף המלצה: לווטסאפ - 054-4998290  או למייל: mazkirmevibeitar@gmail.com  המועמדים המתאימים יוזמנו לראיון","*דרוש/ה מזכיר/ת מושב – מבוא ביתר*  למושב מבוא ביתר דרוש/ה מזכיר/ה מושב. תחומי אחריות:  • ניהול ותפעול שוטף: אחריות על החזקה ותחזוקה של תשתיות המושב כולל מבנים, שפ""ע, עבודה מול ספקים ועובדי מנהלה  • ניהול תקציב וגבייה  • ריכוז ובינוי קהילה – אירועים קהילתיים, חינוך בלתי פורמאלי, מתנדבים. • עבודה מול "
5b6652a3a218,רכז/ת סטודנטים,פקולטה להנדסה,,https://campaign.adamtotal.co.il?d=adtQObeD%2b0bHFgtgEP6hHg%3d%3d,2026-05-19,Biltiformali-Telegram,,חינוך,ביניים,Nonprofit/NGO,"*לפקולטה להנדסה דרוש/ה רכז/ת סטודנטים*  עבודה הכוללת מתן שירות לסטודנטים, מעקב מקליטת הסטודנט ועד סגירת התואר, בקרה וניתוב של קורסים, סיוע לראש המחלקה בתפעול ישיר, השתתפות בוועדות מחלקתיות ועוד.  לפרטים נוספים והגשת מועמדות: https://campaign.adamtotal.co.il?d=adtQObeD%2b0bHFgtgEP6hHg%3d%3d","*לפקולטה להנדסה דרוש/ה רכז/ת סטודנטים*  עבודה הכוללת מתן שירות לסטודנטים, מעקב מקליטת הסטודנט ועד סגירת התואר, בקרה וניתוב של קורסים, סיוע לראש המחלקה בתפעול ישיר, השתתפות בוועדות מחלקתיות ועוד.  לפרטים נוספים והגשת מועמדות: https://campaign.adamtotal.co.il?d=adtQObeD%2b0bHFgtgEP6hHg%3d%3d"
17067c329ba4,מוביל/ת תחום סושיאל,עמותת חמניות,תל אביב,https://ttps://wkf.ms/4qZmaTj ,2026-05-19,Biltiformali-Telegram,משרה מלאה,עמותות,ניהולי,Nonprofit/NGO,"יש לך תשוקה לתחום הסושיאל? מחפש/ת תפקיד עם משמעות? 🌻      עמותת חמניות – המקום לילדים שאיבדו הורה, מחפשת מוביל/ת תחום סושיאל לתפקיד Hands-on  עם אהבה לתוכן, וידאו וסטוריטלינג - ורצון להוביל עשייה עם משמעות דרך סושיאל   העבודה במשרה מלאה, במודל היברידי (שלושה ימים ממשרדי העמותה בת""א והשאר מהבית)  לפרטים נוספים והגשת מועמדות בקישור הייעודי –  https://wkf.ms/4qZmaTj   לכל המשרות הפתוחות בעמותה - https://www.hamaniot.org/jobs/","יש לך תשוקה לתחום הסושיאל? מחפש/ת תפקיד עם משמעות? 🌻      עמותת חמניות – המקום לילדים שאיבדו הורה, מחפשת מוביל/ת תחום סושיאל לתפקיד Hands-on  עם אהבה לתוכן, וידאו וסטוריטלינג - ורצון להוביל עשייה עם משמעות דרך סושיאל   העבודה במשרה מלאה, במודל היברידי (שלושה ימים ממשרדי העמותה בת""א והשאר מהבית)  לפר"
d863b42ea885,רכז/ת למשרד להוגנות מגדרית והנציבות לענייני הטרדות מיניות,אוניברסיטת בן-גוריון,באר שבע,https://bguhr.my.salesforce-sites.com/Gius?mode=jobs,2026-05-18,Biltiformali-Telegram,משרה מלאה,חינוך,ביניים,Nonprofit/NGO,"📢 למשרד להוגנות מגדרית והנציבות לענייני הטרדות מיניות דרוש/ה רכז/ת!  🔍 מה כולל התפקיד? עבודה מגוונת הכוללת ריכוז פעילות המשרד והנציבות, ניהול מנהלתי שוטף (יומן, פגישות וסיכום ישיבות), ומעקב תקציבי ובקרה על רכש ותשלומים. התפקיד כולל איסוף וניתוח נתונים, ניהול מערך המלגות (מהפצת קולות קוראים ועד יישום), עדכון אתר האינטרנט והמדיה, וארגון טקסים, כנסים ואירועים יחידתיים.  💼 דרישות התפקיד: ✔️ תואר אקדמי ✔️ ניסיון של שנה בתחומים רלוונטיים ✔️ ניסיון במתן שירות ועבודה עם קהל ✔️ שליטה בשפה האנגלית ברמה טובה מאוד ✔️ רצוי – ניסיון עבודה בתחומי מגדר או מניעת הטרדות מיניות   📍 המשרה ממוקמת באוניברסיטת בן-גוריון 🕐 משרה מלאה 📧 הגשת מועמדות תיעשה דרך אתר האוניברסיטה. יש להיכנס לקישור הבא (מכרז 122-2026): https://bguhr.my.salesforce-sites.com/Gius?mode=jobs","📢 למשרד להוגנות מגדרית והנציבות לענייני הטרדות מיניות דרוש/ה רכז/ת!  🔍 מה כולל התפקיד? עבודה מגוונת הכוללת ריכוז פעילות המשרד והנציבות, ניהול מנהלתי שוטף (יומן, פגישות וסיכום ישיבות), ומעקב תקציבי ובקרה על רכש ותשלומים. התפקיד כולל איסוף וניתוח נתונים, ניהול מערך המלגות (מהפצת קולות קוראים ועד יישום"
03b4d23a9c53,מנהל/ת חטיבה טכנולוגית וחטיבת הסברה,עמותת פורום מיכל סלה,מבשרת ציון,https://t.me/biltiformali/33562,2026-05-18,Biltiformali-Telegram,משרה מלאה,עמותות,ניהולי,Nonprofit/NGO,"עמותת פורום מיכל סלה פועלת להצלת חיים ומניעת אלימות כלפי נשים באמצעות חדשנות וטכנולוגיה.  לעמותה דרוש/ה מנהל/ת חטיבה טכנולוגית וחטיבת הסברה. תפקיד מפתח אסטרטגי בארגון, הכולל ניהול והובלת התוכניות הטכנולוגיות, פיתוח שיתופי פעולה בינלאומיים ותמיכה בסטרטאפים בשלבי צמיחה שונים.  העבודה במשרה מלאה ממשרדי העמותה במבשרת ציון.  למה להצטרף אלינו?  עבודה משמעותית בעלת אימפקט בינלאומי בתחום חדשנות ובטחון נשים.   סביבת עבודה מקצועית, תומכת ודינאמית.   עבודה מרתקת ופוריה מול בכירים בתעשיית ההיי טק, התקשורת והממשל.  הזדמנויות למידה, צמיחה והתפתחות אישית ומקצועית.    תיאור התפקיד  • ניהול והוצאה לפועל של התוכניות והאירועים הטכנולוגיים של העמותה.  • כתיבה ובניית תוכניות וכלים לתמיכה בפיתוח סטרטאפים, כולל מיפוי וסקירה שוטפת של סטטוס הסטרטאפים, קידום שת""פ של פיילוטים, ייצור חומרים שיווקיים, איתור חברות ולקוחות פוטנציאליים וכד'. עבודה מול יועצים משפטיים, מפתחים, קרנות וחוקרים.  • מתן ייעוץ, איתור וסיוע מקצועי לסטארט-אפים בשלבי צמיחה שונים.  • יצירה והובלה של שיתופי פעולה עם חברות טכנולוגיה בישראל ובעולם.  • בנייה ופיתוח מודל עבודה עסקי בינלאומי וכן תחזוקת תשתית קשרים בינלאומית אל מול שותפים בחו""ל.  • ניהול צוות ועבודה ישירה מול בכירים.  כישורים נדרשים  • ניסיון בעבודה בסביבה  יזמית וחדשנית. עבודה ישירה עם סטארטאפים משלב הרעיון ועד שלב המכירות - דרישת סף.  • ניסיון בהובלת שיתופי פעולה ובניית תהליכים אסטרטגיים.  • ניסיון בפיתוח, בנייה והוצאה לפועל של תכניות עבודה.  • היכרות עם תחום חממות, מנטורינג ומומחיות טכנולוגית.  • השכלה אקדמית.  • יכולת התבטאות מעולה בעל פה ובכתב - בעברית ובאנגלית.  להגשת מ","עמותת פורום מיכל סלה פועלת להצלת חיים ומניעת אלימות כלפי נשים באמצעות חדשנות וטכנולוגיה.  לעמותה דרוש/ה מנהל/ת חטיבה טכנולוגית וחטיבת הסברה. תפקיד מפתח אסטרטגי בארגון, הכולל ניהול והובלת התוכניות הטכנולוגיות, פיתוח שיתופי פעולה בינלאומיים ותמיכה בסטרטאפים בשלבי צמיחה שונים.  העבודה במשרה מלאה ממשרדי"
3efaafb6ebde,מנהל/ת מרכז חוסן עציון,מרכז חוסן עציון,עציון,https://drive.google.com/file/d/1f6ts5EY9-dpg0qYWn2yp2atl8w2Hr1WG/view?usp=sharing,2026-05-18,Biltiformali-Telegram,,עמותות,ניהולי,Nonprofit/NGO,דרוש/ה מנהל/ת מרכז חוסן עציון  לפירוט התפקיד: https://drive.google.com/file/d/1f6ts5EY9-dpg0qYWn2yp2atl8w2Hr1WG/view?usp=sharing,דרוש/ה מנהל/ת מרכז חוסן עציון  לפירוט התפקיד: https://drive.google.com/file/d/1f6ts5EY9-dpg0qYWn2yp2atl8w2Hr1WG/view?usp=sharing
3dc9b6652f09,רכז/ת בכיר/ה לצוות הקליני,בית ספר לרפואה,,https://ttps://campaign.adamtotal.co.il?d=2upJQGHeCT3V1IYUafx8ew%3d%3d,2026-05-18,Biltiformali-Telegram,משרה מלאה,חינוך,בכיר,Nonprofit/NGO,"בית ספר לרפואה מחפש *רכז/ת בכיר/ה* לצוות הקליני. 🩺 התפקיד כולל ניהול ותיאום מערך ההוראה הקלינית במחלקות בתי החולים ובמרפאות הקהילה, תוך עבודה בכפיפות לראש צוות לימודים קליניים. # תואר ראשון/הנדסאי – חובה רוצה לקחת חלק בהכשרת דור הרופאים הבא? שלחו קו""ח או העבירו לחברים שיכול להתאים להם ✨ https://campaign.adamtotal.co.il?d=2upJQGHeCT3V1IYUafx8ew%3d%3d","בית ספר לרפואה מחפש *רכז/ת בכיר/ה* לצוות הקליני. 🩺 התפקיד כולל ניהול ותיאום מערך ההוראה הקלינית במחלקות בתי החולים ובמרפאות הקהילה, תוך עבודה בכפיפות לראש צוות לימודים קליניים. # תואר ראשון/הנדסאי – חובה רוצה לקחת חלק בהכשרת דור הרופאים הבא? שלחו קו""ח או העבירו לחברים שיכול להתאים להם ✨ https://camp"
4c888a28f509,מנהל.ת לבית הספר לנוער בסיכון ברנקו וייס,"מח""ט ברנקו וייס",קריית שמונה,https://minisite.niloos.ai/vacancy/6a0ac6af666c8388bd9ce6d6,2026-05-18,Biltiformali-Telegram,משרה מלאה,חינוך,ניהולי,Nonprofit/NGO,הזדמנות להצטרף לנבחרת המנהלים והמנהלות המובילה את החינוך בישראל! דרוש.ה מנהל.ת לבית הספר לנוער בסיכון ברנקו וייס מח“ט ברנקו וייס קריית שמונה. לפרטים נוספים והגשת מועמדות עד לתאריך 01.06.2026 בקישור הבא: [https://minisite.niloos.ai/vacancy/6a0ac6af666c8388bd9ce6d6](https://minisite.niloos.ai/vacancy/6a0ac6af666c8388bd9ce6d6),הזדמנות להצטרף לנבחרת המנהלים והמנהלות המובילה את החינוך בישראל! דרוש.ה מנהל.ת לבית הספר לנוער בסיכון ברנקו וייס מח“ט ברנקו וייס קריית שמונה. לפרטים נוספים והגשת מועמדות עד לתאריך 01.06.2026 בקישור הבא: [https://minisite.niloos.ai/vacancy/6a0ac6af666c8388bd9ce6d6](https://minisite.niloos.ai/vacancy/
6c669a344da3,עובד/ת סוציאלי/ת - מיצוי זכויות וסיוע לחיילי מילואים,,,https://open.spotify.com/episode/69B3pXovtur4hq64A2yLbf?si=92f9d987aeb047b5,2026-05-18,Biltiformali-Telegram,משרה מלאה,רווחה,ביניים,Nonprofit/NGO,"דרוש/ה עו""ס לעבודה היברידית, מאתגרת ומשמעותית! עבודה של מיצוי זכויות וסיוע לחיילי מילואים, משרה מלאה בלבד. תחילת עבודה ביולי.   לפודקאסט על הפעילות שלנו - https://open.spotify.com/episode/69B3pXovtur4hq64A2yLbf?si=92f9d987aeb047b5","דרוש/ה עו""ס לעבודה היברידית, מאתגרת ומשמעותית! עבודה של מיצוי זכויות וסיוע לחיילי מילואים, משרה מלאה בלבד. תחילת עבודה ביולי.   לפודקאסט על הפעילות שלנו - https://open.spotify.com/episode/69B3pXovtur4hq64A2yLbf?si=92f9d987aeb047b5"
a0f576ee8ccc,"עו""ס ומלווה לתכנית ניצוץ",המחלקה לטיפול בנוער וצעירים באשדוד,אשדוד,https://t.me/biltiformali/33547,2026-05-18,Biltiformali-Telegram,משרה מלאה,ממשלתי,ביניים,Nonprofit/NGO,"מחפשים תפקיד עם משמעות אמיתית?  *המחלקה לטיפול בנוער וצעירים באשדוד מגייסת עו""ס ומלווה לתכנית ניצוץ*🔥⭐ לעבודה עם חיילים ומועמדים לשירות ביטחון.  ✨ 100% משרה ✨ עבודה ערכית עם בני נוער וחיילים ✨ ליווי פרטני, רגשי ומיצוי זכויות ✨ שיתוף פעולה עם גורמי מקצוע בצה""ל וברשות.  אם זה מדבר אליכם - *נשמח שתצטרפו אלינו**  📞 08-9238734 📧 smadarc@ashdod.muni.il  מוזמנים להעביר למי שזה יכול להתאים 🙏","מחפשים תפקיד עם משמעות אמיתית?  *המחלקה לטיפול בנוער וצעירים באשדוד מגייסת עו""ס ומלווה לתכנית ניצוץ*🔥⭐ לעבודה עם חיילים ומועמדים לשירות ביטחון.  ✨ 100% משרה ✨ עבודה ערכית עם בני נוער וחיילים ✨ ליווי פרטני, רגשי ומיצוי זכויות ✨ שיתוף פעולה עם גורמי מקצוע בצה""ל וברשות.  אם זה מדבר אליכם - *נשמח שתצטרפ"
78fa444b6d53,Budget Manager,,ירושלים,info@mikumconsulting.com,2026-05-18,Biltiformali-Telegram,משרה מלאה,עמותות,ביניים,Nonprofit/NGO,"NGO empowering new immigrants and at-risk youth seeks F/T Budget Manager Location: Jerusalem; initially, one day of remote work and four days in-office are required; after a number of months, this may change to two days of remote work and three in-office. Reports to: CFO Description: this role will lead the organization’s budgeting, forecasting and budget performance management. Responsibilities include budgeting and financial planning, forecasting and scenario analysis, stakeholder reporting, development and use of BI dashboards and management tools, and oversight and supervision of revenue and reporting. Requirements: 3+ years of experience in FP&A and financial management (experience in NGOs or donor funded entities is preferred); experience managing budgets across multiple programs and working with cross-functional stakeholders; highly analytical and detail-oriented; able to write and present clear reports, narratives and forecasts to organizational leadership and stakeholders; advanced Excel skills (models, pivots, lookups, structured budgeting files); experience with BI/reporting tools (Power BI preferred); experience with Priority – a strong advantage; comfortable in a religious Zionist professional environment; good English and Hebrew for professional purposes (either language can be the stronger one, although outstanding English skills are preferred). To Apply: submit CV in English to info@mikumconsulting.com Please note the job title in the subject line; relevant ca","NGO empowering new immigrants and at-risk youth seeks F/T Budget Manager Location: Jerusalem; initially, one day of remote work and four days in-office are required; after a number of months, this may change to two days of remote work and three in-office. Reports to: CFO Description: this role will "
1db2e5e5f3fb,חוקר.ת מדעי ההתנהגות,,נתניה,https://forms.gle/ZAd2A5ZEt2Fi6LzJ7,2026-05-17,Biltiformali-Telegram,משרה חלקית,אחר,ביניים,Nonprofit/NGO,"דרוש.ה חוקר.ת מדעי ההתנהגות אנחנו מחפשים שותף.ה לחשיבה והובלת מחקרים, עם סקרנות ויכולת ""לרוץ"" על מחקרים עצמאית (תחת הנחיה).  מתאים לבעלי ניסיון בשיטות מחקר איכותניות, כולל ביצוע ראיונות עומק, ניתוחי טקסט וכתיבה ברמה גבוהה.  התפקיד כולל: פיתוח וביצוע מחקרים מקצה לקצה, ביצוע ראיונות עומק, ניתוח תוכן ונתונים, וכתיבת מסמכים ומצגות ברמה גבוהה. דרישות התפקיד: 🔹 תואר שני מחקרי במדעי ההתנהגות/מדעי המדינה/תחומי מדעי החברה והרוח הרלוונטיים. 🔹 ניסיון מוכח בשיטות מחקר איכותניות וכמותיות – חובה! 🔹 יכולת כתיבה אקדמית וניסוח מעולים. 🔹 חשיבה אנליטית, תשומת לב לפרטים ויכולת עבודה עצמאית. תנאים ומיקום: 🔹 חצי משרה, עובד.ת צה""ל. 🔹 מודל היברידי (נתניה) + נדרשת ניידות במידת הצורך.  שלחו קורות חיים בלינק: https://forms.gle/ZAd2A5ZEt2Fi6LzJ7","דרוש.ה חוקר.ת מדעי ההתנהגות אנחנו מחפשים שותף.ה לחשיבה והובלת מחקרים, עם סקרנות ויכולת ""לרוץ"" על מחקרים עצמאית (תחת הנחיה).  מתאים לבעלי ניסיון בשיטות מחקר איכותניות, כולל ביצוע ראיונות עומק, ניתוחי טקסט וכתיבה ברמה גבוהה.  התפקיד כולל: פיתוח וביצוע מחקרים מקצה לקצה, ביצוע ראיונות עומק, ניתוח תוכן ו"
116cf4d43a57,רכז/ת הדרכה,תנועת עזרא,,"https://tps://ezra.org.il/דרושים/

",2026-05-17,Biltiformali-Telegram,משרה מלאה,עמותות,ביניים,Nonprofit/NGO,"תנועת עזרא מגייסת *רכז/ת הדרכה* להשפיע במקום עבודה משמעותית, מספקת, ומעניינת!  100% משרה   לפרטים נוספים והגשת קורות חיים👇🏻 https://ezra.org.il/דרושים/  למתלבטים יותר-צ'אט עם דבורה👇🏻 https://did.li/CBamC","תנועת עזרא מגייסת *רכז/ת הדרכה* להשפיע במקום עבודה משמעותית, מספקת, ומעניינת!  100% משרה   לפרטים נוספים והגשת קורות חיים👇🏻 https://ezra.org.il/דרושים/  למתלבטים יותר-צ'אט עם דבורה👇🏻 https://did.li/CBamC"
399b9e03dfc6,עובד/ת סוציאלי/ת,תנועת עזרא,,"https://tps://ezra.org.il/דרושים/

",2026-05-17,Biltiformali-Telegram,משרה חלקית,עמותות,,Nonprofit/NGO,"תנועת עזרא מגייסת *עובד/ת סוציאלי/ת* להשפיע במקום עבודה משמעותית, מספקת, ומעניינת!  50% משרה   לפרטים נוספים והגשת קורות חיים👇🏻 https://ezra.org.il/דרושים/  למתלבטים יותר-צ'אט עם דבורה👇🏻 https://did.li/CBamC","תנועת עזרא מגייסת *עובד/ת סוציאלי/ת* להשפיע במקום עבודה משמעותית, מספקת, ומעניינת!  50% משרה   לפרטים נוספים והגשת קורות חיים👇🏻 https://ezra.org.il/דרושים/  למתלבטים יותר-צ'אט עם דבורה👇🏻 https://did.li/CBamC"
