id,title,company,city,url,date_posted,source,work_type,sector,level,raw_text
4b96c5a234f0,מנהל.ת לבית הספר העל יסודי השש שנתי במעגן מיכאל,מועצה אזורית חוף הכרמל,מעגן מיכאל,tps://www.hof-hacarmel.co.il/bids/685/,2026-05-13,Telegram: מציאת עבודה,משרה מלאה,חינוך,ניהולי,"דרוש.ה מנהל.ת לבית הספר העל יסודי השש שנתי במעגן מיכאל מועצה אזורית חוף הכרמל מגייסת מנהל.ת לבית הספר העל יסודי השש שנתי במעגן מיכאל.  אם אתם.ן אנשי ונשות חינוך עם ניסיון ניהולי, ראייה מערכתית ותשוקה להובלת עשייה חינוכית משמעותית, נשמח להכיר 🙌  מה כולל התפקיד? * הובלה וניהול של בית ספר שש שנתי * פית"
9939e6360496,רכז/ת בכיר/ה קשרי תעשייה,,,https://campaign.adamtotal.co.il?d=ibmsuyNk0Yklr4gfBixRmg%3d%3d,2026-05-13,Telegram: מציאת עבודה,משרה מלאה,אחר,בכיר,"*רכז/ת בכיר/ה קשרי תעשייה - הזדמנות לרכוש ניסיון רב בתחומים מגוונים:* * תכנון ופעילויות אקדמיות כולל - סיורים, הרצאות, פעילויות וכנסים. * הפקה וניהול כנסים ואירועים. * תחזוקה שוטפת של מדיות - אתר ודף לינקדאין. * פיתוח והטמעת נהלים ותהליכי עבודה פנימיים.  משרה מלאה | 40 שעות שבועיות  לפרטים נוספים וה"
8236fa34d884,בוא.י לעבוד איתי,,,ttps://campaign.adamtotal.co.il?d=uE%2fV73HVd%2bsoXCmNXXsSGA%3d%3d,2026-05-13,Telegram: מציאת עבודה,,,,"בוא.י לעבוד איתי 💃 תנאים מעולים למתאימים.ות! קו""ח ניתן לשלוח ל chenzar@s-tov.org.il   ,או בקישור הבא:  https://campaign.adamtotal.co.il?d=uE%2fV73HVd%2bsoXCmNXXsSGA%3d%3d"
2474c3c51573,מנהל/ת יחידת נוער,מרכז שכונתי גוננים,ירושלים,://chat.whatsapp.com/IBbysjGWBoCFvpyOHYkxER,2026-05-13,Telegram: מציאת עבודה,משרה מלאה,עמותות,ניהולי,"למרכז שכונתי גוננים **דרוש/ה מנהל/ת יחידת נוער**  להובלת תחום הנוער בשכונות גוננים, קטמונים, פת ורסקו. תפקיד משמעותי עם השפעה ישירה על בני ובנות הנוער  **התפקיד כולל:** 🔹 בניית תכנית עבודה והובלתה 🔹 עבודה עם מתנדבים מדריכים 🔹 ניהול תקציב וגיוס משאבים 🔹 עבודה מול העירייה, בתי ספר, גופים ותנועות נוער "
cb7d61866d11,אחראי/ת גיוס משאבים לארגון חינוכי גדול,ארגון חינוכי גדול ומוביל,תל אביב,tps://tinyurl.com/3eckkm9a,2026-05-13,Telegram: מציאת עבודה,משרה מלאה,חינוך,ביניים,"*אחראי/ת גיוס משאבים לארגון חינוכי גדול | תל אביב | משרה מלאה*  ארגון חינוכי גדול ומוביל מגייס/ת אחראי/ת גיוס משאבים לתפקיד בעל השפעה של ממש — גיוס תרומות ושותפויות לפרויקטים חינוכיים ברחבי הארץ, עם דגש על הפריפריה.  💼 *עיקרי התפקיד:* • כתיבת בקשות תמיכה, הצעות פרויקטים ודוחות תקופתיים • ניהול תכתוב"
5582018f0b37,"מנהל/ת הדרכה, תוכן ולמידה לתחום הנגשת השכלה גבוהה",עמותת אלומה,לוד,https://shlomital.formtitan.com/origin/application/origin/?fld82=a27QA000000ieGH#/,2026-05-13,Telegram: מציאת עבודה,משרה מלאה,עמותות,ניהולי,"*מנהל/ת הדרכה, תוכן ולמידה לתחום הנגשת השכלה גבוהה באלומה*  התפקיד כולל הובלה, פיתוח והטמעה של מערך ההדרכה והלמידה המקצועי בתחום הנגשת ההשכלה הגבוהה בעמותת אלומה, יצירת סטנדרטים משותפים, תכלול ואיגום משאבים. התפקיד מתבצע בתיאום צמוד עם מנהלת הלמידה הארגונית ליישום מדיניות ארגונית ושיתוף ידע רוחבי. *"
2dc6224854d2,משרות מנהלים בקדמה התיישבות צעירים,קדמה התיישבות צעירים,,chat.whatsapp.com/Fd3aJSbxy4sLLaZWIBvrud?mode=gi_t,2026-05-12,Telegram: מציאת עבודה,משרה מלאה,עמותות,ניהולי,"אנחנו מחפשים אתכם!  משרות פתוחות בקדמה התיישבות צעירים.   רוצים לקחת חלק בעשייה משמעותית ולהוביל שינוי בשטח?   אנחנו מתרחבים ומחפשים אנשים מצוינים להצטרף לנבחרת שלנו!  להלן המשרות הפתוחות כרגע:  📍 ניהול כפר סטודנים כפר יובל   להגשת קורות חיים, שלחו קו""ח  ללב  : lev@kedma-hityashvut.org  📦 רכז/ת לוגי"
072eb3b238d1,"מנהל/מנהלת תכניות בתחום תכניות לרווחת הקשישים, במדינות ברית המועצות לשעבר",ארגון הג'וינט,ירושלים,https://www.mitam-hr.org/jobs/116,2026-05-12,Telegram: מציאת עבודה,משרה מלאה,עמותות,ניהולי,"מנהל/מנהלת תכניות בתחום תכניות לרווחת הקשישים, במדינות ברית המועצות לשעבר   ארגון הג'וינט מחפש איש/אשת מקצוע בעל/בעלת חזון חברתי, גישה מערכתית, יכולת הובלה ויוזמה, ורואה בקידום רווחת האוכלוסייה המבוגרת שליחות!   על התפקיד: ·        ניהול והובלה של תוכניות רווחה לקשישים בקהילות יהודיות במדינות חבר הע"
a41ce1732678,ראש צוות טיפול לתכנית הלב תל אביב,עמותת עלם,תל אביב,https://t.me/biltiformali/33390,2026-05-12,Telegram: מציאת עבודה,משרה מלאה,עמותות,ניהולי,"לעמותת עלם דרוש.ה ראש צוות טיפול לתכנית ""הלב תל אביב"" - תכנית סיוע לנערים.ות וצעירים.ות על רצף הזנות. 100% משרה התפקיד כולל: -ניהול ישיר והדרכה פרטנית של צוות -פיתוח התוכנית בשותפות עם מנהלת התוכנית -סמכות טיפולית-מקצועית , התערבויות בחירום ובשגרה דרישות: רישות התפקיד: -תואר ראשון בעבודה סוציאלית – "
cfcff0f3de7c,איש/אשת טיפול פרילנסר.ית להנחיית קבוצת נוער,עמותת גדולים מהחיים,חיפה/באר שבע,https://t.me/biltiformali/33388,2026-05-12,Telegram: מציאת עבודה,פרילנס,עמותות,ביניים,"לתוכנית ""סברס"" של עמותת גדולים מהחיים 🌵 דרוש.ה *איש/אשת טיפול פרילנסר.ית*, להנחיית קבוצה ולליווי תהליך קבוצתי משמעותי בקרב בני נוער בגילאי חטיבת הביניים המתמודדים עם מחלת הסרטן.  ✨ מה כולל התפקיד? 🔹 הנחיית קבוצת נוער, תיתכן אפשרות גם להנחיית קבוצת הורים 🔹 ביצוע שיחות אינטייק לילדים ולהורים, בניית הק"
b85764267fe1,"עו""ס משפחה",מחלקה לשירותים חברתיים הר נוף - עיריית ירושלים,ירושלים,klhila@jerusalem.muni.il,2026-05-12,Telegram: מציאת עבודה,משרה מלאה,ממשלתי,ביניים,"*עו""ס משפחה* *במחלקה לשירותים חברתיים הר נוף בירושלים*  בואו לעבוד בליבת העשייה המקצועית של העבודה הסוציאלית ולהשפיע על פרטים ומשפחות.  *העבודה במחלקה משפחתית ומקצועית.* 75-100% משרה.  העסקה על ידי עיריית ירושלים בהתאם להסכם העו""סים.  *קורות חיים ל: klhila@jerusalem.muni.il*"
bfa2825862e0,"עו""ס לצוות חוק הנוער לעבודה עם ילדים ונוער בסיכון",המחלקה לשירותים חברתיים הר נוף בירושלים,ירושלים,klhila@jerusalem.muni.il,2026-05-12,Telegram: מציאת עבודה,משרה מלאה,ממשלתי,ביניים,"המחלקה לשירותים חברתיים הר נוף בירושלים מחפשת *עו""ס לצוות חוק הנוער לעבודה עם ילדים ונוער בסיכון* 💫  ⭐ ניתנת הדרכה קבועה ומקצועית. ⭐ יציאה לקורס עו""ס לחוק הנוער של משרד הרווחה. ⭐ עבודה בצוות משפחתי ואיכותי.  100% משרה. העסקה על ידי עיריית ירושלים בהתאם להסכם העובדים הסוציאליים.  *קורות חיים: klhila@"
01212c5d2382,מנהל/ת למרכז חוסן שדרות,מרכז חוסן שדרות,שדרות,https://did.li/B4csl*,2026-05-12,Telegram: מציאת עבודה,משרה מלאה,עמותות,ניהולי,"*דרוש/ה מנהל/ת למרכז חוסן שדרות* ניהול עם שליחות | משרה מלאה (100%)  מיקום: שדרות מרכז חוסן שדרות הוא הגוף המרכזי הפועל לספק רצף שירותים ומענים פסיכו-סוציאליים ליחידים, משפחות וקהילות בעיר שדרות, בתחומים קליניים, קהילתיים בשת""פ עם הרשות בתחום ההערכות לחרום על רקע בטחוני. ✅אנו מחפשים מנהיג/ה בעל/ת חז"
45a66f4e18ef,רכז.ת לתכנית תמיכה וליווי לסטודנטים מהפריפריה,,,kidumst@gmail.com,2026-05-12,Telegram: מציאת עבודה,,חינוך,ביניים,דרוש.ה רכז.ת לתכנית תמיכה וליווי לסטודנטים מהפריפריה. תפקיד מאתגר ומספק! התפקיד מתאים לבעלי/ות תואר בעבודה סוציאלית או ייעוץ חינוכי. קורות חיים למייל: kidumst@gmail.com
610d688a6090,מלווה תעסוקתית לפרויקט קליק איט,קבוצת שכולו טוב,אור יהודה,https://t.me/biltiformali/33375,2026-05-12,Telegram: מציאת עבודה,,עמותות,ביניים,"דרושה מלווה תעסוקתית לפרויקט ""קליק איט"" באור יהודה קבוצת ""שכולו טוב"" מגייסת מלווה תעסוקתית למיזם ""קליק איט"" – מרכז מומחיות בתחומי השילוח וההפצה המעסיק עובדים על הרצף האוטיסטי.  תיאור התפקיד: ריכוז וליווי קבוצת עובדים על הרצף האוטיסטי בסביבת עבודה טכנולוגית. מתן מענה שיקומי וקידום תהליכי אינטגרציה בש"
2dee87d6fc1e,מנהל/ת אשכול יישובים – חינוך בלתי פורמלי,המרכז הקהילתי משגב,משגב,://www.misgavcenter.org.il/wanted/,2026-05-12,Telegram: מציאת עבודה,,עמותות,ניהולי,"🚀 מחפשים את האתגר הבא שלכם? המרכז הקהילתי משגב פותח דלת לאנשים שרוצים להשפיע באמת 💛  אם אתם אנשי חינוך, עם תשוקה לעשייה קהילתית – זה בדיוק בשבילכם:  ✨ מנהל/ת אשכול יישובים – חינוך בלתי פורמלי  זו הזדמנות לקחת חלק בעשייה משמעותית, להוביל תהליכים, לבנות תוכניות, לעבוד עם קהילה חמה וליצור שינוי אמיתי ב"
c3c2c3f33c48,דובר/ת,עמותת עתים,,https://wkf.ms/4wpTFkI,2026-05-12,Telegram: מציאת עבודה,,עמותות,,"לעמותת עתים דרוש/ה דובר/ת אם דוברות/תקשורת מגזרית פוליטית זו הזירה שלכם וגם אתם הייתם רוצים לראות ממסד דתי קשוב, מכבד, מכיל ושוויוני- אנחנו מחפשים אתכם!  מוזמנים להגיש קו""ח בטופס הבא https://wkf.ms/4wpTFkI"
6120ab47a401,רכז/ת שירות לאומי לאזור המרכז (מערך דתי),האגודה להתנדבות,המרכז,https://t.me/biltiformali/33367,2026-05-12,Telegram: מציאת עבודה,משרה חלקית,עמותות,ניהולי,"מחפשת עבודה עם נשמה? ✨  האגודה להתנדבות מגייסת רכז/ת שירות לאומי לאזור המרכז (מערך דתי). הזדמנות להוביל, ללוות ולהשפיע על בנות השירות בצעדיהן הראשונים.  ✅ דרישות: תואר ראשון, רכב חובה, יכולת הובלה וגישה חינוכית.  ⏰ היקף משרה: 75% עם פוטנציאל להגיע למשרה מלאה בספטמבר.   מעוניינת? שלחי קורות חיים ל: 📧"
1cb68a74dbb5,"סגן מנהל עירוני י""ד תל אביב","תיכון עירוני י""ד",תל אביב,https://t.me/biltiformali/33364,2026-05-12,Telegram: מציאת עבודה,משרה מלאה,חינוך,ניהולי,"סגן מנהל עירוני י""ד תל אביב מוזמנות ומוזמנים להגיש מועמדות לתפקיד סגן מנהל שש שנתי בתיכון עירוני י""ד   התפקיד כולל: 1.    סיוע למנהל בית הספר בניהול בית הספר בכלל התחומים. 2.    סיוע בתכנון ובהוצאה לפועל של תוכנית העבודה הבית ספרית. 3.    ניהול המענה והתוכניות לתלמידים ייחודיים בבית הספר על הרצף השש"
6710c0839e4e,מנהל/ת אסטרטגיית גיוס ומיתוג,,,s://go.gov.il/mw2nc,2026-05-12,Telegram: מציאת עבודה,משרה מלאה,ממשלתי,ניהולי,🚀משרה אסטרטגית בשכר מיטיב🚀 💫מחפשים טאלנט/ית להובלת אסטרטגיית הגיוס והמיתוג שלנו!  מה התפקיד כולל? ✅​בניית אסטרטגיות גיוס פרואקטיביות ✅​יצירת תוכן שיווקי ומיתוג ברשתות החברתיות ✅​ניתוח נתונים וגיבוש תובנות מבוססות דאטה לשיפור תהליכים  אז אם יש לך: ✅​תואר ראשון ו-4 שנות ניסיון בהון אנושי/שיווק/תקשורת 
9f72eddafe8c,"מנהלת מחלקת גיוס, קליטה ושימור",,תל אביב,tps://tinyurl.com/prndyvce,2026-05-12,Telegram: מציאת עבודה,משרה מלאה,עמותות,ניהולי,"*מנהלת מחלקת גיוס, קליטה ושימור | תל אביב ⏰ משרה מלאה | איוש מיידי*   *על התפקיד:* הובלת תחום הגיוס, הקליטה והשימור בארגון חברתי מוביל — שילוב של חשיבה אסטרטגית עם ניהול תפעולי שוטף, תוך השפעה ממשית על חוויית העובד לאורך כל מחזור חייו בארגון. התפקיד בכפיפות למנהלת אגף משאבי אנוש.  📋 *תחומי אחריות:* "
046071f47947,"מנהל/ת מחלקת פרט, נהלים ורווחה",,תל אביב,s://tinyurl.com/5fxxn35w,2026-05-12,Telegram: מציאת עבודה,משרה מלאה,עמותות,ניהולי,"*מנהל/ת מחלקת פרט, נהלים ורווחה בארגון חברתי גדול* משרה מלאה בתל אביב  *על התפקיד*: תפקיד ניהולי במחלקת משאבי אנוש עם אחריות רחבה על תחומי פרט, נהלים ורווחת עובדים בארגון גדול ומשמעותי.  📋 *תחומי אחריות עיקריים:* • פיתוח תשתיות משאבי אנוש – עדכון והטמעת נהלים ארגוניים בהתאם לחוקי העבודה • ליווי ובקר"
bfcbd1f7ea8b,מנהל/ת שותפויות ופיתוח משאבים,לב בטוח,,https://wkf.ms/4pBPUVp,2026-05-12,Telegram: מציאת עבודה,משרה מלאה,עמותות,ניהולי,"*לב בטוח מגייסת: מנהל/ת שותפויות ופיתוח משאבים*  עמותת לב בטוח (SafeHeart), המעניקה סיוע נפשי לשורדי ושורדות המסיבות ומשפחותיהם, מגייסת מנהל/ת להובלת מערך פיתוח וגיוס המשאבים של הארגון.   *מהות התפקיד:* הובלת אסטרטגיית הגיוס, יצירת שותפויות בארץ ובעולם, ניהול קשרי תורמים, והבטחת המשך צמיחת העשייה.  "
ad832c551ebe,Director of Finance,Nefesh B'Nefesh,ירושלים,https://www.nbn.org.il/jobboard/job/director-of-finance-8/?fbclid=IwdGRjcARvNA9leHRuA2FlbQEwAGFkaWQAAC_L8AQ_DnNydGMGYXBwX2lkDDM1MDY4NTUzMTcyOAABHruC4ufRjiXnI2Bkx3l9KVw2aXdD-WGPPz1NJdnZwV3P1vuKzZPpw3BX7dSL_aem_yuupM0broTnuSZGJ_5ERmg&utm_medium=paid&utm_source=fb&utm_id=6967694529482&utm_content=52552950743886&utm_term=52528882692286&utm_campaign=6967694529482,2026-05-12,Telegram: מציאת עבודה,משרה מלאה,עמותות,בכיר,"Nefesh B'Nefesh Israel Job  Director of Finance Full Time Jerusalem  Nefesh B’Nefesh  The Director of Finance will lead all financial strategy and operations, forecasting, and compliance. This senior leadership role partners closely with executive leadership and plays a key part in shaping the organ"
a040cb3265ad,"מטפל.ת למרכז טיפול עירוני לילדים, מתבגרים והורים","מרכז טיפול עירוני לילדים, מתבגרים והורים בת""א",תל אביב,https://t.me/biltiformali/33353,2026-05-11,Telegram: מציאת עבודה,משרה חלקית,רווחה,ביניים,"למרכז טיפול עירוני לילדים, מתבגרים והורים בת""א דרוש.ה מטפל.ת 🌱  למשרה שעתית בהיקף של 12 ש""ש, יומיים בשבוע. העסקה תחת מוסדות חינוך ותרבות ת""א.   פרטים נוספים במודעה.   קו""ח ניתן להעביר למייל המצורף: Hbhatikva1@gmail.com"
b1e414f3cdfa,Manager of International Development,Latet,תל אביב,s://tinyurl.com/4rrb3wdc,2026-05-11,Telegram: מציאת עבודה,משרה מלאה,עמותות,ניהולי,"*🔹 Latet is Hiring: Manager of International Development* (Full-time | Tel Aviv)  Latet, Israel's largest NGO fighting poverty and food insecurity, is looking for a talented and driven professional to lead the International Development department.  *🎯 Key Responsibilities* The role focuses on fundra"
0d71b2c3bc23,מנהל/ת דיגיטל,אחים ואחיות לישראל – החמ״ל האזרחי,,ttps://www.hamal.org.il/job/digital-manager,2026-05-11,Telegram: מציאת עבודה,,עמותות,ניהולי,"מחפשים/ות את האתגר הבא בעולם הדיגיטל? אחים ואחיות לישראל – החמ״ל האזרחי מגייסים מנהל/ת דיגיטל 💙  תפקיד עצמאי, יצירתי ומשמעותי עם עשייה ערכית וקמפיינים דיגיטליים רחבי היקף.  לשליחת קו״ח: https://www.hamal.org.il/job/digital-manager"
f53c08c005bc,מנהל/ת תחום ריפוי בעיסוק למערך שיקום יום,עמותת עזרה למרפא,המרכז,ilanA@ezra-lemarpe.org,2026-05-11,Telegram: מציאת עבודה,משרה מלאה,עמותות,בכיר,"📢 הזדמנות ניהולית בכירה ב""עזרה למרפא""! מרפאים/ות בעיסוק עם ניסיון בניהול ובגריאטריה? אנחנו מחפשים אתכם/ן. עמותת ""עזרה למרפא"" באזור המרכז מגייסת מנהל/ת תחום ריפוי בעיסוק למערך שיקום יום (אורטופדי ונוירולוגי). זהו תפקיד מפתח הכולל ניהול צוות רחב, הובלת התחום ופיתוח שירותים מקצועיים בסביבה רב-תחומית מת"
09e3ace923c2,מקדם.ת מדיניות וקשרי ממשל,עמותת 121,תל אביב,"://www.120plus1.org.il/career/
להגש",2026-05-11,Telegram: מציאת עבודה,משרה מלאה,עמותות,ביניים,*עמותת 121 מגייסת מקדם.ת מדיניות וקשרי ממשל* 🏛️  אם יש לך ניסיון בעבודה בכנסת או בממשלה ותשוקה לשינוי חברתי אמיתי – זה בדיוק בשבילך 👇  *מה כולל התפקיד?* - גיוס מקבלי החלטות בדרג המקצועי בממשלה לקידום מדיניות וחקיקה - ⁠כתיבת פניות והשתתפות בישיבות ודיונים - ⁠ליווי שותפים במהלכי שינוי  מדיניות  *מה אנ
25303cdd54f5,מידען/ית ייעץ והדרכה,ספריית אוניברסיטת אריאל,אריאל,ttps://campaign.adamtotal.co.il?d=558Cnn7kBWlOnSG%2bYqaZTg%3d%3d,2026-05-11,Telegram: מציאת עבודה,,חינוך,ביניים,"לספריית אוניברסיטת אריאל דרוש/ה *מידען/ית ייעץ והדרכה*! 📚  התפקיד כולל מתן ייעוץ, הכוונה והדרכה לסטודנטים ולסגל האקדמי, עבודה עם מאגרי מידע ומערכות ספרייתיות, תפעול דלפק הייעץ וההדרכה והשתתפות בפרויקטים מקצועיים בספרייה. דרישות: • תואר אקדמי – חובה לשליחת קו""ח ופרטים נוספים >> https://campaign.adamt"
e38388ad1c55,רכז/ת למכון האבחון באוניברסיטת אריאל,אוניברסיטת אריאל,אריאל,https://campaign.adamtotal.co.il?d=wfr%2bnFydBu76ngEx65xbhA%3d%3d,2026-05-11,Telegram: מציאת עבודה,,חינוך,ביניים,"*דרוש/ה רכז/ת למכון האבחון באוניברסיטת אריאל*  *תיאור המשרה:* • תיאום אבחונים ותכלול השרות לפונים לאבחון.  • הסדרת פעילות האבחון של המאבחנות בצוות המכון.  • הכנה ודיווח של דו""חות שכר, חיובים לפונים והתחשבנות מול גורמים מממנים. • תפקידים שונים כפי שיוגדרו מעת לעת.   *דרישות:* • תואר ראשון/הנדסאי מדופ"
66d01a061550,"מנהל/ת מיתוג, שיווק ופיתוח עסקי",בינה בלב,"חל""צ",https://t.me/biltiformali/33329,2026-05-10,Telegram: מציאת עבודה,משרה חלקית,עמותות,ניהולי,"מנהל/ת מיתוג, שיווק ופיתוח עסקי – בינה בלב (חל""צ) 🚀 יש לך הזדמנות לעצב את הפנים והקול של מהפכת ה-AI בפריפריה. ""בינה בלב"", הפועלת לשיקום ופיתוח הנגב המערבי והגליל, מחפש דמות אסטרטגית שתוביל את מיתוג והשיווק שלה ותהפוך את החזון שלנו לצמיחה ואימפקט בשטח.  📍 מיקום: מודל היברידי (בית + שטח). ⏰ היקף משרה:"
5fab6de28a96,מנהל/ת גיוס משאבים,רשת מיתרים,ירושלים,https://www.mitam-hr.org/jobs/101,2026-05-10,Telegram: מציאת עבודה,משרה מלאה,עמותות,ניהולי,"דרוש/ה מנהל/ת גיוס משאבים לרשת 'מיתרים' מיתרים תומכת ברשת של למעלה מ־170 בתי ספר וקהילות המחברות בין ציבור דתי, חילוני ומסורתי. באמצעות ליווי חינוכי וקהילתי, תוכניות הכשרה, פיתוח תכנים מותאמים ועוד, מיתרים מובילה שינוי משמעותי במערכת החינוך ופועלת לחיזוק חברה משותפת בישראל.  תיאור התפקיד:  • ניהול כ"
441fa94bac7c,מנהל/ת ליחידת ניהול במעון דיור לאנשים עם מוגבלויות,עמותת עלה מוריה,גדרה,ttps://wa.me/972523159832*,2026-05-10,Telegram: מציאת עבודה,משרה מלאה,עמותות,ניהולי,"*לעמותת ""עלה מוריה"" - גדרה*  *דרוש/ה מנהל/ת ליחידת ניהול במעון דיור לאנשים עם מוגבלויות*   ניהול והובלת  דיור לאנשים עם מוגבלויות, כולל אחריות מלאה על תפעול היחידה, רווחת הדיירים וניהול צוות עובדים.  *תחומי אחריות:* -ניהול והובלת צוות עובדים -אחריות כוללת על רווחת הדיירים ואיכות חייהם -ניהול שוטף של"
5c1a34803a9d,רכז/ת בכיר/ה למנהל האירועים של הסטודנטים,,,https://campaign.adamtotal.co.il?d=KW9zR3tF5xGBEIq1Dv1zAA%3d%3d,2026-05-10,Telegram: מציאת עבודה,,חינוך,בכיר,"למנהל האירועים של הסטודנטים דרוש/ה *רכז/ת בכיר/ה* - תפקיד שמתאים לאנשים שמחפשים כיף בעבודה, סביבה דינמית, צעירה, הפקת אירועים, יצירתיות, ראש גדול ועוד!  כולל בתוכו עבודה משרדית סביב אירועי היחידה, הקמה והפקת אירועי הסטודנטים בעיקר בשעות הערב, עבודה מול גורמים שונים באוניברסיטה.  לפרטים נוספים והגשת "
