title,company,location,url,date
"Principal/ Senior Backend & Cloud Engineer Agentless (Cortex Cloud)
Principal/ Senior Backend & Cloud Engineer Agentless (Cortex Cloud) with verification",Palo Alto Networks,"Tel Aviv-Yafo, Tel Aviv District, Israel (On-site)",https://www.linkedin.com/jobs/view/4412803565/,07/01/2026
"Energy Trading & Sales Manager
Energy Trading & Sales Manager",Enlight Renewable Energy Ltd (ENLT),"Rosh HaAyin, Center District, Israel (Hybrid)",https://www.linkedin.com/jobs/view/4435177718/,07/01/2026
"מהנדס.ת אלגוריתמים ועיבוד אותות
מהנדס.ת אלגוריתמים ועיבוד אותות with verification",Rafael Advanced Defense Systems,"North District, Israel (On-site)",https://www.linkedin.com/jobs/view/4434979790/,07/01/2026
"Python Game Developer (Panda3D)
Python Game Developer (Panda3D)",micro1,EMEA (Remote),https://www.linkedin.com/jobs/view/4434979496/,07/01/2026
"Physics Researcher | Remote
Physics Researcher | Remote","Crossing Hurdles
$80/hr - $160/hr",EMEA (Remote),https://www.linkedin.com/jobs/view/4434310179/,07/01/2026
"Red Team Specialist | Cybersecurity | Leading Company (5469)
Red Team Specialist | Cybersecurity | Leading Company (5469)",INGIMA,"Center District, Israel (On-site)",https://www.linkedin.com/jobs/view/4435511361/,07/01/2026
"Fitness Instructor (M/W) Club Med Resorts
Fitness Instructor (M/W) Club Med Resorts with verification",Club Med,"West Jerusalem, Jerusalem District, Israel (On-site)",https://www.linkedin.com/jobs/view/4167484774/,07/01/2026
"Motion Graphics Specialist (Remote)
Motion Graphics Specialist (Remote)",Quik Hire Staffing,EMEA (Remote),https://www.linkedin.com/jobs/view/4435393904/,07/01/2026
"Customer Service Representative
Customer Service Representative",ICP FINANCE LTD,"Bnei Brak, Tel Aviv District, Israel (On-site)",https://www.linkedin.com/jobs/view/4431576634/,07/01/2026
"System Engineer (Remote)
System Engineer (Remote)",Hire Feed,EMEA (Remote),https://www.linkedin.com/jobs/view/4435106551/,07/01/2026
"מהנדס/ת פיתוח FPGA
מהנדס/ת פיתוח FPGA with verification",IAI - Israel Aerospace Industries,"Yehud Monosson, Center District, Israel (On-site)",https://www.linkedin.com/jobs/view/4405929182/,07/01/2026
"CTC/Sr CTC - FSP - EMEA
CTC/Sr CTC - FSP - EMEA with verification",Thermo Fisher Scientific,Israel (On-site),https://www.linkedin.com/jobs/view/4434975550/,07/01/2026
"Sports Data Collector (Basketball) - Nahariya, Israel
Sports Data Collector (Basketball) - Nahariya, Israel with verification",Genius Sports,"Nahariya, North District, Israel (On-site)",https://www.linkedin.com/jobs/view/4431950819/,07/01/2026
"Software Engineer (AI Training)
Software Engineer (AI Training)","Alignerr
$20/hr - $100/hr","Tel Aviv-Yafo, Tel Aviv District, Israel (Remote)",https://www.linkedin.com/jobs/view/4435361548/,07/01/2026
"Frontend Software Engineer
Frontend Software Engineer with verification",Upwind Security,"Ramat Gan, Tel Aviv District, Israel (Hybrid)",https://www.linkedin.com/jobs/view/4377864561/,07/01/2026
"Senior Fullstack Engineer
Senior Fullstack Engineer with verification",Zscaler,"Tel Aviv-Yafo, Tel Aviv District, Israel (Hybrid)",https://www.linkedin.com/jobs/view/4435129261/,07/01/2026
"Senior Hardware Engineer
Senior Hardware Engineer",Get SAT,"Rehovot, Center District, Israel (On-site)",https://www.linkedin.com/jobs/view/4434968154/,07/01/2026
"CPA – Financial Systems Analyst
CPA – Financial Systems Analyst",HUNTHEAD,"Tel Aviv-Yafo, Tel Aviv District, Israel (Hybrid)",https://www.linkedin.com/jobs/view/4435518200/,07/01/2026
"Mechanical Engineer Specialist | $50/Task Remote
Mechanical Engineer Specialist | $50/Task Remote","Crossing Hurdles
$20/hr - $50/hr",EMEA (Remote),https://www.linkedin.com/jobs/view/4425817249/,07/01/2026
"Cyber Security Analyst (Remote)
Cyber Security Analyst (Remote)",Hire Feed,EMEA (Remote),https://www.linkedin.com/jobs/view/4435178314/,07/01/2026
"מהנדס/ת תוכנה עיבוד אות
מהנדס/ת תוכנה עיבוד אות with verification",IAI - Israel Aerospace Industries,"Ashdod, South District, Israel (On-site)",https://www.linkedin.com/jobs/view/4405795281/,07/01/2026
"Fitness Instructor (M/W) Club Med Resorts
Fitness Instructor (M/W) Club Med Resorts with verification",Club Med,"Netanya, Center District, Israel (On-site)",https://www.linkedin.com/jobs/view/4167488368/,07/01/2026
"Director, Product Design
Director, Product Design with verification",NiCE,"Raanana, Center District, Israel (Hybrid)",https://www.linkedin.com/jobs/view/4357710354/,07/01/2026
"Software Engineer, Micro Platforms (Remote)
Software Engineer, Micro Platforms (Remote)",Hired,EMEA (Remote),https://www.linkedin.com/jobs/view/4434966868/,07/01/2026
"Junior Financial Controller
Junior Financial Controller with verification",Ness Technologies | נס טכנולוגיות,"Raanana, Center District, Israel (Hybrid)",https://www.linkedin.com/jobs/view/4434993676/,07/01/2026
"Import & Strategic Procurement Specialist
Import & Strategic Procurement Specialist with verification",Brenntag,"Ness Ziona, Center District, Israel (On-site)",https://www.linkedin.com/jobs/view/4425810029/,07/01/2026
"Full Stack Engineer - EMEA
Full Stack Engineer - EMEA with verification",Deel,EMEA (Remote),https://www.linkedin.com/jobs/view/4422202772/,07/01/2026
"Executive Assistant, Child Sponsorship Operations
Executive Assistant, Child Sponsorship Operations with verification",World Vision,EMEA (Remote),https://www.linkedin.com/jobs/view/4403571609/,07/01/2026
"Engineering Manager
Engineering Manager with verification",Canonical,EMEA (Remote),https://www.linkedin.com/jobs/view/4358303311/,07/01/2026
"SW Engineer
SW Engineer with verification",ZEISS Group,Israel (On-site),https://www.linkedin.com/jobs/view/4431595409/,07/01/2026
"אינטגרטור/ית מנוסה
אינטגרטור/ית מנוסה",Commit,"Karmiel, North District, Israel (On-site)",https://www.linkedin.com/jobs/view/4435183655/,07/01/2026
"SaaS Security Solutions Engineer
SaaS Security Solutions Engineer",peax unicloud,"Petah Tikva, Center District, Israel (Hybrid)",https://www.linkedin.com/jobs/view/4431966334/,07/01/2026
"Rust Developer (Remote)
Rust Developer (Remote)",Quik Hire Staffing,EMEA (Remote),https://www.linkedin.com/jobs/view/4434963429/,07/01/2026
"Entry-Level SDR (Sales Development Representative)
Entry-Level SDR (Sales Development Representative)",Materialspace,Israel (Hybrid),https://www.linkedin.com/jobs/view/4434950454/,07/01/2026
"מפתח/ת אלגוריתמים לעיבוד תמונה וראיה ממוחשבת
מפתח/ת אלגוריתמים לעיבוד תמונה וראיה ממוחשבת with verification",IAI - Israel Aerospace Industries,"Yehud Monosson, Center District, Israel (On-site)",https://www.linkedin.com/jobs/view/4367721588/,07/01/2026
"Data Protection Officer (Remote)
Data Protection Officer (Remote)",Hire Feed,EMEA (Remote),https://www.linkedin.com/jobs/view/4435500931/,07/01/2026
"Front Desk Agent  (M/W) Club Med Resorts
Front Desk Agent  (M/W) Club Med Resorts with verification",Club Med,"Ashdod, South District, Israel (On-site)",https://www.linkedin.com/jobs/view/4167488334/,07/01/2026
"Software Engineer - Human Data Platforms (Remote)
Software Engineer - Human Data Platforms (Remote)",Hired,EMEA (Remote),https://www.linkedin.com/jobs/view/4435518054/,07/01/2026
"Software Engineering Manager
Software Engineering Manager",Medulla,"Tel Aviv District, Israel (Hybrid)",https://www.linkedin.com/jobs/view/4434953368/,07/01/2026
"SAP Consultant - JB-681
SAP Consultant - JB-681 with verification",PwC Israel,"Tel Aviv District, Israel (Hybrid)",https://www.linkedin.com/jobs/view/4434964481/,07/01/2026
"Senior Backend Engineer
Senior Backend Engineer",Clover Security,"Tel Aviv-Yafo, Tel Aviv District, Israel (On-site)",https://www.linkedin.com/jobs/view/4431594124/,07/01/2026
"Cyber Security Implementation Specialist
Cyber Security Implementation Specialist with verification",Confidential Careers,"Center District, Israel (Hybrid)",https://www.linkedin.com/jobs/view/4431916861/,07/01/2026
"Head of Internal Audit - HSBC Israel
Head of Internal Audit - HSBC Israel",HSBC,"Ramat Gan, Tel Aviv District, Israel (Hybrid)",https://www.linkedin.com/jobs/view/4434472548/,07/01/2026
"Cybersecurity Specialist (Remote)
Cybersecurity Specialist (Remote)",Hire Feed,EMEA (Remote),https://www.linkedin.com/jobs/view/4435178757/,07/01/2026
"Radio Communication System Engineer
Radio Communication System Engineer with verification",IAI - Israel Aerospace Industries,"Be'er Sheva, South District, Israel (On-site)",https://www.linkedin.com/jobs/view/4431925272/,07/01/2026
"Choreographer / Dancer (M/W) Club Med Resorts
Choreographer / Dancer (M/W) Club Med Resorts with verification",Club Med,"Tel Aviv-Yafo, Tel Aviv District, Israel (On-site)",https://www.linkedin.com/jobs/view/4167490075/,07/01/2026
"Network Operations & Control Technician
Network Operations & Control Technician",TMG Solutions Ltd.,"Petah Tikva, Center District, Israel (Hybrid)",https://www.linkedin.com/jobs/view/4431921797/,07/01/2026
"Technical Artist
Technical Artist",SuperPlay,"Tel Aviv-Yafo, Tel Aviv District, Israel (On-site)",https://www.linkedin.com/jobs/view/4435114182/,07/01/2026
"Entrepreneur & Business Consultant (Remote)
Entrepreneur & Business Consultant (Remote)",Quik Hire Staffing,EMEA (Remote),https://www.linkedin.com/jobs/view/4435125047/,07/01/2026
"Controller
Controller",Confidential,"Tel Aviv District, Israel (Hybrid)",https://www.linkedin.com/jobs/view/4431912746/,07/01/2026
"UX/UI Designer
UX/UI Designer with verification",Rapaport,"Ramat Gan, Tel Aviv District, Israel (Hybrid)",https://www.linkedin.com/jobs/view/4431595682/,07/01/2026
"2561 - Cloud Full Stack Team Lead
2561 - Cloud Full Stack Team Lead with verification",Shabak - Israeli Security Agency - Career,"Center District, Israel (On-site)",https://www.linkedin.com/jobs/view/4431911688/,07/01/2026
"German → French Patent Translator (Chemistry) – Freelance
German → French Patent Translator (Chemistry) – Freelance with verification",RWS Group,EMEA (Remote),https://www.linkedin.com/jobs/view/4434978557/,07/01/2026
"Freelance Software tester (Magenta TV, Poland)
Freelance Software tester (Magenta TV, Poland) with verification",Testlio,EMEA (Remote),https://www.linkedin.com/jobs/view/4425994993/,07/01/2026
"20613 - Field Communications Engineer - RF
20613 - Field Communications Engineer - RF with verification",Qualitest,"Haifa, Haifa District, Israel (On-site)",https://www.linkedin.com/jobs/view/4431035541/,07/01/2026
"Paid Online Retail & Marketplace Ops Specialist
Paid Online Retail & Marketplace Ops Specialist",Jobgether,Israel (Remote),https://www.linkedin.com/jobs/view/4431942120/,07/01/2026
"Real Estate Broker
Real Estate Broker",LiKe Tel Aviv ltd,"Tel Aviv District, Israel (Hybrid)",https://www.linkedin.com/jobs/view/4431918085/,07/01/2026
"Financial Revenue Specialist, Israel
Financial Revenue Specialist, Israel",AlgoSec,"Petah Tikva, Center District, Israel (Hybrid)",https://www.linkedin.com/jobs/view/4435370879/,07/01/2026
"דרוש/ה איש/ת מכירות לחברת נדל""ן
דרוש/ה איש/ת מכירות לחברת נדל""ן",AGILINA,"Tel Aviv-Yafo, Tel Aviv District, Israel (On-site)",https://www.linkedin.com/jobs/view/4434360044/,07/01/2026
"ML Researcher (Remote)
ML Researcher (Remote)",Hire Feed,EMEA (Remote),https://www.linkedin.com/jobs/view/4435387945/,07/01/2026
"Reliability and System Safety Engineer
Reliability and System Safety Engineer with verification",IAI - Israel Aerospace Industries,"Beer Yaakov, Center District, Israel (On-site)",https://www.linkedin.com/jobs/view/4431590908/,07/01/2026
"Lead Flight Control Engineer - Tactical Munitions
Lead Flight Control Engineer - Tactical Munitions",Kela Technologies,"Tel Aviv-Yafo, Tel Aviv District, Israel (Hybrid)",https://www.linkedin.com/jobs/view/4434966591/,07/01/2026
"Legal Analyst and Partnership
Legal Analyst and Partnership",Koladin,"Tel Aviv District, Israel (On-site)",https://www.linkedin.com/jobs/view/4431962200/,07/01/2026
"Process Engineer
Process Engineer with verification",Maytronics,"Yizra'el, North District, Israel (On-site)",https://www.linkedin.com/jobs/view/4429036303/,07/01/2026
"Content Writer (Remote)
Content Writer (Remote)",Quik Hire Staffing,EMEA (Remote),https://www.linkedin.com/jobs/view/4435503756/,07/01/2026
"Junior Software Engineer
Junior Software Engineer",Commit,"Kiryat Bialik, Haifa District, Israel (On-site)",https://www.linkedin.com/jobs/view/4435110216/,07/01/2026
"Medical Science Liaison – Neuroscience
Medical Science Liaison – Neuroscience with verification",Eli Lilly and Company,"Raanana, Center District, Israel (On-site)",https://www.linkedin.com/jobs/view/4435133390/,07/01/2026
"Alliances & Channels Leader
Alliances & Channels Leader",Jobgether,Israel (Remote),https://www.linkedin.com/jobs/view/4434193980/,07/01/2026
"Software Engineer - Linux Sensor
Software Engineer - Linux Sensor with verification",CrowdStrike,"Tel Aviv-Yafo, Tel Aviv District, Israel (Hybrid)",https://www.linkedin.com/jobs/view/4421990045/,07/01/2026
"רפרנט/ית כספים ושכר
רפרנט/ית כספים ושכר with verification",Plus מלם שכר - Malam PayRoll Plus,"Lod, Center District, Israel (On-site)",https://www.linkedin.com/jobs/view/4431967882/,07/01/2026
"Full Stack Engineer
Full Stack Engineer with verification",Tailor Brands,"Tel Aviv-Yafo, Tel Aviv District, Israel (Hybrid)",https://www.linkedin.com/jobs/view/4435103345/,07/01/2026
"C# Developer (Remote)
C# Developer (Remote)",Hire Feed,EMEA (Remote),https://www.linkedin.com/jobs/view/4434969583/,07/01/2026
"FPGA Engineer
FPGA Engineer with verification",IAI - Israel Aerospace Industries,"Beer Yaakov, Center District, Israel (On-site)",https://www.linkedin.com/jobs/view/4431920789/,07/01/2026
"Staff Product Development Engineer
Staff Product Development Engineer with verification",TE Connectivity,Israel (Hybrid),https://www.linkedin.com/jobs/view/4435153753/,07/01/2026
"Sr. Director, Direct to Consumer, SodaStream
Sr. Director, Direct to Consumer, SodaStream with verification",PepsiCo,"Kfar Saba, Center District, Israel (On-site)",https://www.linkedin.com/jobs/view/4421996763/,07/01/2026
"Senior Data Center Ethernet Network Engineer
Senior Data Center Ethernet Network Engineer with verification",NVIDIA,"Yokneam Ilit, North District, Israel (On-site)",https://www.linkedin.com/jobs/view/4425532749/,07/01/2026
"Senior Rust Developer
Senior Rust Developer",orient path_,EMEA (Remote),https://www.linkedin.com/jobs/view/4434333334/,07/01/2026
"PPC
PPC with verification",The5ers.com,"Raanana, Center District, Israel (On-site)",https://www.linkedin.com/jobs/view/4434336213/,07/01/2026
"Cloud Operations Engineer
Cloud Operations Engineer with verification",Cato Networks,"Tel Aviv District, Israel (Hybrid)",https://www.linkedin.com/jobs/view/4421931930/,07/01/2026
"Global Support Services IT Engineer
Global Support Services IT Engineer",TRT,EMEA (Remote),https://www.linkedin.com/jobs/view/4434346379/,07/01/2026
"CEO Office Manager
CEO Office Manager",HAAT Delivery,"North District, Israel (On-site)",https://www.linkedin.com/jobs/view/4431598212/,07/01/2026
"Client Partner - AI Solutions (Remote)
Client Partner - AI Solutions (Remote)",Quik Hire Staffing,EMEA (Remote),https://www.linkedin.com/jobs/view/4435395973/,07/01/2026
"AI Software Engineer (Remote)
AI Software Engineer (Remote)",Hire Feed,EMEA (Remote),https://www.linkedin.com/jobs/view/4435502846/,07/01/2026
"Data Group Tech Lead, Staff Engineer
Data Group Tech Lead, Staff Engineer with verification",Lemonade,"Tel Aviv-Yafo, Tel Aviv District, Israel (Hybrid)",https://www.linkedin.com/jobs/view/4435324987/,07/01/2026
"Network and System Verification Engineer, E2E
Network and System Verification Engineer, E2E with verification",NVIDIA,"Yokneam Ilit, North District, Israel (On-site)",https://www.linkedin.com/jobs/view/4415735574/,07/01/2026
"Application Security Specialist
Application Security Specialist",Cye,"Herzliya, Tel Aviv District, Israel (Hybrid)",https://www.linkedin.com/jobs/view/4435337759/,07/01/2026
"מנהל/ת פרויקט בכיר בתחום הבינוי הציבורי
מנהל/ת פרויקט בכיר בתחום הבינוי הציבורי with verification",Maof - מעוף,"Center District, Israel (On-site)",https://www.linkedin.com/jobs/view/4435196302/,07/01/2026
"PHD Peer Review Need– Composite Materials
PHD Peer Review Need– Composite Materials","Fengkai Group Co., Limited",Middle East (Remote),https://www.linkedin.com/jobs/view/4431588219/,07/01/2026
"Senior Python Developer (Remote)
Senior Python Developer (Remote)",Quik Hire Staffing,EMEA (Remote),https://www.linkedin.com/jobs/view/4434949554/,07/01/2026
"Embedded SW Engineer
Embedded SW Engineer with verification",Gentex Corporation,"Tel Aviv District, Israel (Hybrid)",https://www.linkedin.com/jobs/view/4429027462/,07/01/2026
"Director of HW Design
Director of HW Design with verification",Alma Lasers,"Caesarea, Haifa District, Israel (Hybrid)",https://www.linkedin.com/jobs/view/4422425458/,07/01/2026
"Control Engineer
Control Engineer",ACS Motion Control,"Yoqneam Illit, North District, Israel (On-site)",https://www.linkedin.com/jobs/view/4435100352/,07/01/2026
"HW Manager-1235
HW Manager-1235",Telefire,"Center District, Israel (On-site)",https://www.linkedin.com/jobs/view/4434987365/,07/01/2026
"Senior Software Development Engineer in Test- Hybrid
Senior Software Development Engineer in Test- Hybrid with verification",Akamai Technologies,"Tel Aviv-Yafo, Tel Aviv District, Israel (Remote)",https://www.linkedin.com/jobs/view/4435308143/,07/01/2026
"יועץ/ת מלווה מאזן לקוחות חברה ערבית - מחוז מרכז (49844)
יועץ/ת מלווה מאזן לקוחות חברה ערבית - מחוז מרכז (49844) with verification",Clalit Health Services,"Lod, Center District, Israel (On-site)",https://www.linkedin.com/jobs/view/4431905327/,07/01/2026
"AWS Engineer - Cloud (Remote)
AWS Engineer - Cloud (Remote)",Hire Feed,EMEA (Remote),https://www.linkedin.com/jobs/view/4435192062/,07/01/2026
"23013 - Cloud Cyber Security Expert
23013 - Cloud Cyber Security Expert with verification",Qualitest,"Tel Aviv-Yafo, Tel Aviv District, Israel (On-site)",https://www.linkedin.com/jobs/view/4431941953/,07/01/2026
"Senior AI Platform Engineer
Senior AI Platform Engineer with verification",NVIDIA,"Yokneam Ilit, North District, Israel (On-site)",https://www.linkedin.com/jobs/view/4434371817/,07/01/2026
"Telecommunications Specialist (Remote)
Telecommunications Specialist (Remote)",Quik Hire Staffing,EMEA (Remote),https://www.linkedin.com/jobs/view/4435504790/,07/01/2026
"Devops Tech Lead
Devops Tech Lead with verification",Skai,"Tel Aviv-Yafo, Tel Aviv District, Israel (Hybrid)",https://www.linkedin.com/jobs/view/4427485314/,07/01/2026
"Senior Full Stack Engineer (Frontend-Oriented, AI-First Product Team)
Senior Full Stack Engineer (Frontend-Oriented, AI-First Product Team) with verification",Similarweb,"Tel Aviv-Yafo, Tel Aviv District, Israel (Hybrid)",https://www.linkedin.com/jobs/view/4425996392/,07/01/2026
"Head of Global Quality
Head of Global Quality with verification","Vishay Precision Group, Inc. (VPG)","Center District, Israel (On-site)",https://www.linkedin.com/jobs/view/4421626564/,07/01/2026
"HRBP (GTM)
HRBP (GTM) with verification",Coralogix,"Ramat Gan, Tel Aviv District, Israel (On-site)",https://www.linkedin.com/jobs/view/4435172179/,07/01/2026
"Senior Copywriter
Senior Copywriter with verification",Icon,EMEA (Remote),https://www.linkedin.com/jobs/view/4435395944/,07/01/2026
"Senior Software Engineer (Cloud)
Senior Software Engineer (Cloud) with verification",D-Fend Solutions,"Raanana, Center District, Israel (On-site)",https://www.linkedin.com/jobs/view/4408497980/,07/01/2026
"SAP MM Senior Expert and Team Manager
SAP MM Senior Expert and Team Manager with verification",Telit Cinterion,"Kfar Saba, Center District, Israel (On-site)",https://www.linkedin.com/jobs/view/4431901203/,07/01/2026
"R&D Buyer
R&D Buyer",Applied Materials - Israel,"Rehovot, Center District, Israel (On-site)",https://www.linkedin.com/jobs/view/4431968310/,07/01/2026
"System Team Lead
System Team Lead with verification",Confidential Careers,"Center District, Israel (Hybrid)",https://www.linkedin.com/jobs/view/4431942683/,07/01/2026
"Head of Sales, Check Point Services
Head of Sales, Check Point Services with verification",Check Point Software,"Tel Aviv-Yafo, Tel Aviv District, Israel (On-site)",https://www.linkedin.com/jobs/view/4435189482/,07/01/2026
"PHD Peer Review Need– Urban Planning
PHD Peer Review Need– Urban Planning","Fengkai Group Co., Limited",Middle East (Remote),https://www.linkedin.com/jobs/view/4431987774/,07/01/2026
"Accountant - US Experience (Remote)
Accountant - US Experience (Remote)",Hire Feed,EMEA (Remote),https://www.linkedin.com/jobs/view/4435503922/,07/01/2026
"Senior Data Center Ethernet Network Engineer
Senior Data Center Ethernet Network Engineer with verification",NVIDIA,"Tel Aviv District, Israel (On-site)",https://www.linkedin.com/jobs/view/4425536733/,07/01/2026
"Penetration Tester
Penetration Tester",Accenture Israel,"Kfar Saba, Center District, Israel (Hybrid)",https://www.linkedin.com/jobs/view/4415483792/,07/01/2026
"מהנדס.ת Sys DevOps
מהנדס.ת Sys DevOps with verification",Elbit Systems Israel,"Haifa District, Israel (On-site)",https://www.linkedin.com/jobs/view/4412813583/,07/01/2026
"JavaScript Frontend Developer (Remote)
JavaScript Frontend Developer (Remote)",Quik Hire Staffing,EMEA (Remote),https://www.linkedin.com/jobs/view/4435122127/,07/01/2026
"Senior salary payroll
Senior salary payroll",Pacaya HR Experts,"Tel Aviv District, Israel (On-site)",https://www.linkedin.com/jobs/view/4434350301/,07/01/2026
"Paid Social Account Manager
Paid Social Account Manager with verification",YunoJuno,EMEA (Remote),https://www.linkedin.com/jobs/view/4434306680/,07/01/2026
"DevOps Engineer
DevOps Engineer",Skill Mind Tech Bridge,"Lod, Center District, Israel (Hybrid)",https://www.linkedin.com/jobs/view/4435107299/,07/01/2026
"Complaints Counsel
Complaints Counsel with verification",Revolut,Israel (Remote),https://www.linkedin.com/jobs/view/4434313224/,07/01/2026
"מוביל.ת צוות עיצוב ופיתוח מוצרים (2488)
מוביל.ת צוות עיצוב ופיתוח מוצרים (2488) with verification",Keter,"North District, Israel (On-site)",https://www.linkedin.com/jobs/view/4431588938/,07/01/2026
"Software Engineer - 240337
Software Engineer - 240337 with verification",Experis Israel,"Tel Aviv-Yafo, Tel Aviv District, Israel (On-site)",https://www.linkedin.com/jobs/view/4246062125/,07/01/2026
"DevOps Team Leader, Israel
DevOps Team Leader, Israel",AlgoSec,"Petah Tikva, Center District, Israel (Hybrid)",https://www.linkedin.com/jobs/view/4435389030/,07/01/2026
"Frontend Web Developer - HTML,CSS (Remote)
Frontend Web Developer - HTML,CSS (Remote)",Hire Feed,EMEA (Remote),https://www.linkedin.com/jobs/view/4435174541/,07/01/2026
"Senior Research Scientist
Senior Research Scientist with verification",NVIDIA,"Tel Aviv District, Israel (On-site)",https://www.linkedin.com/jobs/view/4434363983/,07/01/2026
"Finance Expert (Remote)
Finance Expert (Remote)",Quik Hire Staffing,EMEA (Remote),https://www.linkedin.com/jobs/view/4435510145/,07/01/2026
"Senior Frontend Engineer (Tailwind)
Senior Frontend Engineer (Tailwind)",micro1,EMEA (Remote),https://www.linkedin.com/jobs/view/4434970197/,07/01/2026
"Mechanical Engineering Student
Mechanical Engineering Student with verification",Elbit Systems Israel,"Modiin-Maccabim-Reut, Center District, Israel (On-site)",https://www.linkedin.com/jobs/view/4431913168/,07/01/2026
"Junior Silicon DFT Engineer, Google Cloud
Junior Silicon DFT Engineer, Google Cloud with verification",Google,"Tel Aviv-Yafo, Tel Aviv District, Israel (On-site)",https://www.linkedin.com/jobs/view/4425226868/,07/01/2026
"Staff DevOps Engineer
Staff DevOps Engineer with verification",Descope,"Tel Aviv District, Israel (Hybrid)",https://www.linkedin.com/jobs/view/4431665949/,07/01/2026
"Communication PHY Research Engineer
Communication PHY Research Engineer with verification",D-Fend Solutions,"Raanana, Center District, Israel (On-site)",https://www.linkedin.com/jobs/view/4421571673/,07/01/2026
"PHY Algo Technical Leader
PHY Algo Technical Leader with verification",Cisco,"Tel Aviv-Yafo, Tel Aviv District, Israel (On-site)",https://www.linkedin.com/jobs/view/4435155939/,07/01/2026
"Israel Salesperson
Israel Salesperson with verification",Deutsche Bank,"Tel Aviv-Yafo, Tel Aviv District, Israel (Hybrid)",https://www.linkedin.com/jobs/view/4435172807/,07/01/2026
"production staff
production staff with verification","Stanley Black & Decker, Inc.","Migdal HaEmek, North District, Israel (On-site)",https://www.linkedin.com/jobs/view/4425638838/,07/01/2026
"HR Business Partner
HR Business Partner with verification",Alice (Formerly ActiveFence),"Ramat Gan, Tel Aviv District, Israel (Hybrid)",https://www.linkedin.com/jobs/view/4434971374/,07/01/2026
"21303 - Manual System Tester
21303 - Manual System Tester with verification",Qualitest,"Haifa, Haifa District, Israel (On-site)",https://www.linkedin.com/jobs/view/4431948426/,07/01/2026
"Senior Full-Stack Software Engineer
Senior Full-Stack Software Engineer",micro1,EMEA (Remote),https://www.linkedin.com/jobs/view/4434956796/,07/01/2026
"Enterprise Account Manager - Frontier AI (Remote)
Enterprise Account Manager - Frontier AI (Remote)",Hire Feed,EMEA (Remote),https://www.linkedin.com/jobs/view/4435398999/,07/01/2026
