title,company,location,url,date
"Business Strategy Analyst
Business Strategy Analyst with verification",Unity,"Tel Aviv-Yafo, Tel Aviv District, Israel (On-site)",https://www.linkedin.com/jobs/view/4417402869/,07/01/2026
"AI Process & Project Analyst
AI Process & Project Analyst",Sharpies PRO,"Tel Aviv District, Israel (On-site)",https://www.linkedin.com/jobs/view/4434306727/,07/01/2026
"Sales Operation Team Leader
Sales Operation Team Leader with verification",Elmo Motion Control,"Petah Tikva, Center District, Israel (Hybrid)",https://www.linkedin.com/jobs/view/4431594969/,07/01/2026
"מנהל/ת מלאי לחברת סקצ'רס
מנהל/ת מלאי לחברת סקצ'רס",Skechers Israel,"Holon, Tel Aviv District, Israel (On-site)",https://www.linkedin.com/jobs/view/4431907569/,07/01/2026
"Partenaire commercial informatique
Partenaire commercial informatique",Mobislide,"Tel Aviv District, Israel (Remote)",https://www.linkedin.com/jobs/view/4431934359/,07/01/2026
"Solution Delivery Manager
Solution Delivery Manager with verification",Applause,"Herzliya, Tel Aviv District, Israel (Hybrid)",https://www.linkedin.com/jobs/view/4434311853/,07/01/2026
"Office Manager
Office Manager",Master Clean 2019 Ltd - מאסטר קלין 2019 בע״מ,"Rishon LeZion, Center District, Israel (On-site)",https://www.linkedin.com/jobs/view/4431585968/,07/01/2026
"Project Manager
Project Manager",Axon Pulse,"Tel Aviv District, Israel (On-site)",https://www.linkedin.com/jobs/view/4434347022/,07/01/2026
"Business Process Analyst - Google Workspace | Remote
Business Process Analyst - Google Workspace | Remote","Crossing Hurdles
$119/hr - $168/hr",EMEA (Remote),https://www.linkedin.com/jobs/view/4425239766/,07/01/2026
"Excel Analyst (Remote)
Excel Analyst (Remote)",Quik Hire Staffing,EMEA (Remote),https://www.linkedin.com/jobs/view/4435393905/,07/01/2026
"Senior Operations and Quality Manager
Senior Operations and Quality Manager",Tehiru Aerial Systems,"Hod HaSharon, Center District, Israel (On-site)",https://www.linkedin.com/jobs/view/4435305945/,07/01/2026
"Management Consultant (Remote)
Management Consultant (Remote)",Hire Feed,EMEA (Remote),https://www.linkedin.com/jobs/view/4435105602/,07/01/2026
"Head of Operations
Head of Operations",Tensorleap,"Tel Aviv-Yafo, Tel Aviv District, Israel (On-site)",https://www.linkedin.com/jobs/view/4434382009/,07/01/2026
"Senior Product Analyst
Senior Product Analyst with verification",Aidoc,"Tel Aviv-Yafo, Tel Aviv District, Israel (Hybrid)",https://www.linkedin.com/jobs/view/4426318007/,07/01/2026
"CTO / IT Director - Relocation to Ghana
CTO / IT Director - Relocation to Ghana",Confidential Careers,"Tel Aviv District, Israel (On-site)",https://www.linkedin.com/jobs/view/4425845081/,07/01/2026
"Product Manager - DLP
Product Manager - DLP with verification",Varonis,"Herzliya, Tel Aviv District, Israel (Hybrid)",https://www.linkedin.com/jobs/view/4416675310/,07/01/2026
"Project Manager
Project Manager with verification",Extreme,"Center District, Israel (Hybrid)",https://www.linkedin.com/jobs/view/4435105714/,07/01/2026
"Data Analyst- 50060601
Data Analyst- 50060601 with verification",Phoenix Financial,"Rishon LeZion, Center District, Israel (On-site)",https://www.linkedin.com/jobs/view/4434302850/,07/01/2026
"Lead Budget & Financial Planning Economist
Lead Budget & Financial Planning Economist",Kroll Consulting,"Herzliya, Tel Aviv District, Israel (Hybrid)",https://www.linkedin.com/jobs/view/4435392489/,07/01/2026
"Data Scientist Tech Lead
Data Scientist Tech Lead",CaliAlfa (Previously Alfabet),"Herzliya, Tel Aviv District, Israel (Hybrid)",https://www.linkedin.com/jobs/view/4431967059/,07/01/2026
"Strategy Consultant (Remote)
Strategy Consultant (Remote)",Hired,EMEA (Remote),https://www.linkedin.com/jobs/view/4435183580/,07/01/2026
"Project Management Team Lead (25194)
Project Management Team Lead (25194) with verification",Yael Group,"Bnei Brak, Tel Aviv District, Israel (On-site)",https://www.linkedin.com/jobs/view/4431929851/,07/01/2026
"Applied Data Scientist, Fintech Initiatives
Applied Data Scientist, Fintech Initiatives",Triple Whale,"Jerusalem District, Israel (Hybrid)",https://www.linkedin.com/jobs/view/4435121255/,07/01/2026
"Senior Project Manager
Senior Project Manager with verification",COMDA,"Tel Aviv District, Israel (Hybrid)",https://www.linkedin.com/jobs/view/4432336007/,07/01/2026
"Senior C++ Developer
Senior C++ Developer",Group19 Tech,"South District, Israel (On-site)",https://www.linkedin.com/jobs/view/4431940429/,07/01/2026
"Language Researcher (Remote)
Language Researcher (Remote)",Hire Feed,Israel (Remote),https://www.linkedin.com/jobs/view/4435501187/,07/01/2026
"Product Analyst Team Lead
Product Analyst Team Lead with verification",Aidoc,"Tel Aviv-Yafo, Tel Aviv District, Israel (Hybrid)",https://www.linkedin.com/jobs/view/4425993954/,07/01/2026
"Strategic Project Lead (Remote)
Strategic Project Lead (Remote)",Quik Hire Staffing,EMEA (Remote),https://www.linkedin.com/jobs/view/4435508300/,07/01/2026
"ראש צוות פיתוח קובול (COBOL Team Lead)
ראש צוות פיתוח קובול (COBOL Team Lead)","F.M.R. COMPUTERS AND SOFTWARE LIMITED
F.M.R. COMPUTERS AND SOFTWARE LIMITED logo","Tel Aviv District, Israel (Hybrid)",https://www.linkedin.com/jobs/view/4431927829/,07/01/2026
"Threat Intelligence Analyst
Threat Intelligence Analyst with verification",Logica-IT,"Center District, Israel (Hybrid)",https://www.linkedin.com/jobs/view/4431946248/,07/01/2026
"Data Partnerships Lead (Remote)
Data Partnerships Lead (Remote)",Hired,EMEA (Remote),https://www.linkedin.com/jobs/view/4435166899/,07/01/2026
"Senior Business Analyst
Senior Business Analyst with verification",Kendago,"Ramat Gan, Tel Aviv District, Israel (Hybrid)",https://www.linkedin.com/jobs/view/4425092267/,07/01/2026
"Document Reviewer - Remote
Document Reviewer - Remote",YO IT Consulting,"Tel Aviv-Yafo, Tel Aviv District, Israel (Remote)",https://www.linkedin.com/jobs/view/4434604056/,07/01/2026
"Vice President Research And Development
Vice President Research And Development with verification",Classiq,"Tel Aviv District, Israel (Hybrid)",https://www.linkedin.com/jobs/view/4422419344/,07/01/2026
"Head of Data & IT Strategy - Graphics Solutions Business
Head of Data & IT Strategy - Graphics Solutions Business with verification",HP,"Ness Ziona, Center District, Israel (On-site)",https://www.linkedin.com/jobs/view/4428644329/,07/01/2026
"Project Manager
Project Manager",Moveo Source,"Rishon LeZion, Center District, Israel (On-site)",https://www.linkedin.com/jobs/view/4434302888/,07/01/2026
"Technical / IT Project Manager
Technical / IT Project Manager",Real Time LTD.  זמן אמת,"Petah Tikva, Center District, Israel (On-site)",https://www.linkedin.com/jobs/view/4431069484/,07/01/2026
"Business Information Systems Leader
Business Information Systems Leader",BlueGen Ltd.,"Tirat HaCarmel, Haifa District, Israel (On-site)",https://www.linkedin.com/jobs/view/4431934025/,07/01/2026
"חקר ביצועים
חקר ביצועים with verification",Elbit Systems Israel,"Netanya, Center District, Israel (On-site)",https://www.linkedin.com/jobs/view/4412219919/,07/01/2026
"מזכיר/ה ללשכת ראש מנהל גילוי ויירוט
מזכיר/ה ללשכת ראש מנהל גילוי ויירוט with verification",IAI - Israel Aerospace Industries,"Ashdod, South District, Israel (On-site)",https://www.linkedin.com/jobs/view/4415606781/,07/01/2026
"CRM Dynamics Systems Analyst (5468)
CRM Dynamics Systems Analyst (5468)",INGIMA,"Center District, Israel (On-site)",https://www.linkedin.com/jobs/view/4435506803/,07/01/2026
"Business Consultant (Remote)
Business Consultant (Remote)",Hire Feed,EMEA (Remote),https://www.linkedin.com/jobs/view/4434970744/,07/01/2026
"Staff Product Manager - Supersonic
Staff Product Manager - Supersonic with verification",Unity,"Tel Aviv-Yafo, Tel Aviv District, Israel (On-site)",https://www.linkedin.com/jobs/view/4409148751/,07/01/2026
"Data Team Lead
Data Team Lead with verification",G-STAT,"Tel Aviv District, Israel (Hybrid)",https://www.linkedin.com/jobs/view/4435511337/,07/01/2026
"Customer Experience Manager
Customer Experience Manager",SKIDEAL,"Netanya, Center District, Israel (On-site)",https://www.linkedin.com/jobs/view/4431912635/,07/01/2026
"User Acquisition Manager
User Acquisition Manager with verification",WeSki,"Herzliya, Tel Aviv District, Israel (Hybrid)",https://www.linkedin.com/jobs/view/4412666738/,07/01/2026
"Strategy Manager (Remote)
Strategy Manager (Remote)",Quik Hire Staffing,EMEA (Remote),https://www.linkedin.com/jobs/view/4435122020/,07/01/2026
"Product Data Analyst
Product Data Analyst with verification",Lemonade,"Tel Aviv-Yafo, Tel Aviv District, Israel (Hybrid)",https://www.linkedin.com/jobs/view/4435344114/,07/01/2026
"Data & Analytics Team Lead
Data & Analytics Team Lead with verification",SeeTrue AI,"Tel Aviv District, Israel (Hybrid)",https://www.linkedin.com/jobs/view/4431915893/,07/01/2026
"Product Manager (Platform)
Product Manager (Platform) with verification",TryHackMe,EMEA (Remote),https://www.linkedin.com/jobs/view/4431936409/,07/01/2026
"מטמיע מבצעי למערכות מכ""מ
מטמיע מבצעי למערכות מכ""מ",DV-plan,"Petah Tikva, Center District, Israel (On-site)",https://www.linkedin.com/jobs/view/4431900745/,07/01/2026
"Risk Intelligence Analyst (Remote)
Risk Intelligence Analyst (Remote)",Hire Feed,EMEA (Remote),https://www.linkedin.com/jobs/view/4435104633/,07/01/2026
"מנהל/ת לשכה
מנהל/ת לשכה with verification",IAI - Israel Aerospace Industries,"Lod, Center District, Israel (On-site)",https://www.linkedin.com/jobs/view/4332557406/,07/01/2026
"Office Manager - Part Time
Office Manager - Part Time","AppCard, Inc.","Hod HaSharon, Center District, Israel (On-site)",https://www.linkedin.com/jobs/view/4431525603/,07/01/2026
"רכז/ת בכיר/ה מחקרי שיווק להנהלה הראשית (49785)
רכז/ת בכיר/ה מחקרי שיווק להנהלה הראשית (49785) with verification",Clalit Health Services,"Tel Aviv District, Israel (On-site)",https://www.linkedin.com/jobs/view/4432322344/,07/01/2026
"Business Operations Analyst (Remote)
Business Operations Analyst (Remote)",Quik Hire Staffing,EMEA (Remote),https://www.linkedin.com/jobs/view/4435117244/,07/01/2026
"Product Line Procurement Manager
Product Line Procurement Manager",Tama Group,"Mishmar HaEmek, North District, Israel (On-site)",https://www.linkedin.com/jobs/view/4435520090/,07/01/2026
"Executive Assistant
Executive Assistant with verification",Fireblocks,"Tel Aviv District, Israel (Hybrid)",https://www.linkedin.com/jobs/view/4435172830/,07/01/2026
"Core Systems Analyst
Core Systems Analyst with verification",SQLink Group,"Lod, Center District, Israel (Hybrid)",https://www.linkedin.com/jobs/view/4431908897/,07/01/2026
"AI Senior Software Engineer
AI Senior Software Engineer with verification",Aidoc,"Tel Aviv-Yafo, Tel Aviv District, Israel (Hybrid)",https://www.linkedin.com/jobs/view/4431918799/,07/01/2026
"Technical Product Manager, Observability Domain
Technical Product Manager, Observability Domain with verification",Agoda,"West Jerusalem, Jerusalem District, Israel (Hybrid)",https://www.linkedin.com/jobs/view/4404869053/,07/01/2026
"Economist
Economist with verification",Bezeq International,"Petah Tikva, Center District, Israel (Hybrid)",https://www.linkedin.com/jobs/view/4431916010/,07/01/2026
"Field Application Specialist
Field Application Specialist with verification",Orcanos,"Givatayim, Tel Aviv District, Israel (Hybrid)",https://www.linkedin.com/jobs/view/4352221906/,07/01/2026
"PMO
PMO",YouCC Technologies Ltd.,"Netanya, Center District, Israel (On-site)",https://www.linkedin.com/jobs/view/4431583880/,07/01/2026
"Proofreader (Remote)
Proofreader (Remote)",Hire Feed,Israel (Remote),https://www.linkedin.com/jobs/view/4435501191/,07/01/2026
"מנהל פרוייקטים בשירות לקוח
מנהל פרוייקטים בשירות לקוח with verification",IAI - Israel Aerospace Industries,"Yehud Monosson, Center District, Israel (On-site)",https://www.linkedin.com/jobs/view/4415772793/,07/01/2026
"Solution Engineer
Solution Engineer with verification",OPSWAT,"Petah Tikva, Center District, Israel (On-site)",https://www.linkedin.com/jobs/view/4435193504/,07/01/2026
"Customer Success Manager
Customer Success Manager with verification",Workato,"Tel Aviv-Yafo, Tel Aviv District, Israel (On-site)",https://www.linkedin.com/jobs/view/4425992409/,07/01/2026
"Global Travel & Events Operations Lead
Global Travel & Events Operations Lead with verification",Overwolf,"Ramat Gan, Tel Aviv District, Israel (Hybrid)",https://www.linkedin.com/jobs/view/4435110500/,07/01/2026
"Business Development Team Lead
Business Development Team Lead with verification",Automat-it,"Tel Aviv-Yafo, Tel Aviv District, Israel (On-site)",https://www.linkedin.com/jobs/view/4411459068/,07/01/2026
"Research Specialist (Remote)
Research Specialist (Remote)",Quik Hire Staffing,EMEA (Remote),https://www.linkedin.com/jobs/view/4435388773/,07/01/2026
"Product Manager
Product Manager with verification",Israel Hayom ישראל היום,"Tel Aviv-Yafo, Tel Aviv District, Israel (On-site)",https://www.linkedin.com/jobs/view/4434974287/,07/01/2026
"Senior Product Manager (Bangkok-based)
Senior Product Manager (Bangkok-based) with verification",Agoda,"Tel Aviv-Yafo, Tel Aviv District, Israel (Hybrid)",https://www.linkedin.com/jobs/view/4299772303/,07/01/2026
"Bilingual Community Manager - AI Trainer
Bilingual Community Manager - AI Trainer",DataAnnotation,Israel (Remote),https://www.linkedin.com/jobs/view/4304443238/,07/01/2026
"Marketing Operations Team Lead
Marketing Operations Team Lead",Papaya Global,"Herzliya, Tel Aviv District, Israel (Hybrid)",https://www.linkedin.com/jobs/view/4434998412/,07/01/2026
"Machine Learning Engineer
Machine Learning Engineer with verification",Sunbit,"Tel Aviv District, Israel (Hybrid)",https://www.linkedin.com/jobs/view/4435108292/,07/01/2026
"Support Engineer
Support Engineer",Bulwarx,"Raanana, Center District, Israel (On-site)",https://www.linkedin.com/jobs/view/4435101187/,07/01/2026
"סטודנט/ית לקניינות רכש
סטודנט/ית לקניינות רכש with verification",IAI - Israel Aerospace Industries,"Ashdod, South District, Israel (On-site)",https://www.linkedin.com/jobs/view/4415618170/,07/01/2026
"Office Administrator - Maternity leave replacement
Office Administrator - Maternity leave replacement with verification",Playtika,"Herzliya, Tel Aviv District, Israel (Hybrid)",https://www.linkedin.com/jobs/view/4431591868/,07/01/2026
"Native Language Trainer (Remote)
Native Language Trainer (Remote)",Hire Feed,Israel (Remote),https://www.linkedin.com/jobs/view/4435390525/,07/01/2026
"Operations Associate (Remote)
Operations Associate (Remote)",Quik Hire Staffing,EMEA (Remote),https://www.linkedin.com/jobs/view/4435516054/,07/01/2026
"Information Security Team Lead
Information Security Team Lead",HUNTHEAD,"Tel Aviv-Yafo, Tel Aviv District, Israel (Hybrid)",https://www.linkedin.com/jobs/view/4434966264/,07/01/2026
"Senior Analyst (Supply Analytics, Bangkok-based, Relocation provided)
Senior Analyst (Supply Analytics, Bangkok-based, Relocation provided) with verification",Agoda,"West Jerusalem, Jerusalem District, Israel (On-site)",https://www.linkedin.com/jobs/view/4299775149/,07/01/2026
"Retail Sales Associate  (M/W) Club Med Resorts
Retail Sales Associate  (M/W) Club Med Resorts with verification",Club Med,"Petah Tikva, Center District, Israel (On-site)",https://www.linkedin.com/jobs/view/4167483942/,07/01/2026
"Client Service Account Manager
Client Service Account Manager with verification",JPMorganChase,"Tel Aviv-Yafo, Tel Aviv District, Israel (On-site)",https://www.linkedin.com/jobs/view/4418996424/,07/01/2026
"Business Development Manager (Tel Aviv)
Business Development Manager (Tel Aviv) with verification",Fresha,"Tel Aviv-Yafo, Tel Aviv District, Israel (Remote)",https://www.linkedin.com/jobs/view/4425913724/,07/01/2026
"Staff Product Manager - AI - 100% Remote - EMEA
Staff Product Manager - AI - 100% Remote - EMEA with verification",Hostaway,EMEA (Remote),https://www.linkedin.com/jobs/view/4434968352/,07/01/2026
"System team lead
System team lead with verification",Confidential Careers,"Center District, Israel (Hybrid)",https://www.linkedin.com/jobs/view/4431935854/,07/01/2026
"Head of Events & Brand Partnerships
Head of Events & Brand Partnerships",SKIDEAL,"Netanya, Center District, Israel (On-site)",https://www.linkedin.com/jobs/view/4431922544/,07/01/2026
"Your dream job is not listed?
Your dream job is not listed? with verification",Kendago,"Kiryat Ono, Tel Aviv District, Israel (On-site)",https://www.linkedin.com/jobs/view/4327794928/,07/01/2026
"Social Media Manager
Social Media Manager",Port.io,"Tel Aviv-Yafo, Tel Aviv District, Israel (On-site)",https://www.linkedin.com/jobs/view/4434328397/,07/01/2026
"פרוייקטור/ית תפעול קמעונאי
פרוייקטור/ית תפעול קמעונאי",Klir Chemicals Ltd 🇮🇱,"Rishon LeZion, Center District, Israel (On-site)",https://www.linkedin.com/jobs/view/4431595975/,07/01/2026
"Production Planner
Production Planner",Allpha Innovation,"Center District, Israel (On-site)",https://www.linkedin.com/jobs/view/4434988228/,07/01/2026
"Product Marketing Manager
Product Marketing Manager with verification",Similarweb,"Tel Aviv-Yafo, Tel Aviv District, Israel (Hybrid)",https://www.linkedin.com/jobs/view/4416210214/,07/01/2026
"Retail Operations Coordinator
Retail Operations Coordinator with verification",Wolt,"Ramat Gan, Tel Aviv District, Israel (On-site)",https://www.linkedin.com/jobs/view/4434330388/,07/01/2026
"Business Development Representative
Business Development Representative with verification",Jumpstart,"Tel Aviv-Yafo, Tel Aviv District, Israel (Hybrid)",https://www.linkedin.com/jobs/view/4435102259/,07/01/2026
"Sales Account Manager
Sales Account Manager",Confidential,"Center District, Israel (Hybrid)",https://www.linkedin.com/jobs/view/4434350279/,07/01/2026
"Game Owner
Game Owner with verification",PAPAYA,"Tel Aviv-Yafo, Tel Aviv District, Israel (Hybrid)",https://www.linkedin.com/jobs/view/4431922673/,07/01/2026
"Business Intelligence Consultant (Remote)
Business Intelligence Consultant (Remote)",Quik Hire Staffing,EMEA (Remote),https://www.linkedin.com/jobs/view/4435506630/,07/01/2026
"Product Manager II, AI Crisis Resilience
Product Manager II, AI Crisis Resilience with verification",Google,"Tel Aviv-Yafo, Tel Aviv District, Israel (On-site)",https://www.linkedin.com/jobs/view/4434314383/,07/01/2026
"PPC Campaign Manager JB-3635
PPC Campaign Manager JB-3635 with verification",Recruitx,"Tel Aviv-Yafo, Tel Aviv District, Israel (On-site)",https://www.linkedin.com/jobs/view/4435192137/,07/01/2026
"Customer Success Manager
Customer Success Manager",Jurni,"Tel Aviv-Yafo, Tel Aviv District, Israel (On-site)",https://www.linkedin.com/jobs/view/4434373336/,07/01/2026
"IT Infrastructure & Support Specialist (Tier 2)
IT Infrastructure & Support Specialist (Tier 2)",Moveo Source,"Rishon LeZion, Center District, Israel (On-site)",https://www.linkedin.com/jobs/view/4434338174/,07/01/2026
"Quality Engineer
Quality Engineer",BENTAL Motion Systems,Israel (On-site),https://www.linkedin.com/jobs/view/4423101853/,07/01/2026
"Ski Kids Accompagnist (M/W) Club Med Resorts
Ski Kids Accompagnist (M/W) Club Med Resorts with verification",Club Med,"Ashdod, South District, Israel (On-site)",https://www.linkedin.com/jobs/view/4167488338/,07/01/2026
"Physics Specialist | $50/per task
Physics Specialist | $50/per task","Crossing Hurdles
$20/hr - $50/hr",EMEA (Remote),https://www.linkedin.com/jobs/view/4422256814/,07/01/2026
"מבקר/ת חלקים
מבקר/ת חלקים with verification",IAI - Israel Aerospace Industries,"Lod, Center District, Israel (On-site)",https://www.linkedin.com/jobs/view/4314787410/,07/01/2026
"Sales Development Representative, Mid-Market | Israel
Sales Development Representative, Mid-Market | Israel with verification",Deel,Israel (Remote),https://www.linkedin.com/jobs/view/4422277529/,07/01/2026
"Data Annotation Specialist (Remote)
Data Annotation Specialist (Remote)",Quik Hire Staffing,EMEA (Remote),https://www.linkedin.com/jobs/view/4434992457/,07/01/2026
"Translator (Remote)
Translator (Remote)",Hire Feed,Israel (Remote),https://www.linkedin.com/jobs/view/4435502175/,07/01/2026
"Senior IT & Security Manager
Senior IT & Security Manager","Confidential
Confidential logo","Center District, Israel (Hybrid)",https://www.linkedin.com/jobs/view/4434989253/,07/01/2026
"Expert IC Package Design Lead
Expert IC Package Design Lead with verification",Astera Labs,Israel (On-site),https://www.linkedin.com/jobs/view/4374977912/,07/01/2026
"System Engineer – Digital & Applications
System Engineer – Digital & Applications with verification",Maytronics,"Yizra'el, North District, Israel (On-site)",https://www.linkedin.com/jobs/view/4425076264/,07/01/2026
"Senior AI Integrations & Automation Engineer
Senior AI Integrations & Automation Engineer with verification",Cloudinary,"Ramat Yishai, North District, Israel (Hybrid)",https://www.linkedin.com/jobs/view/4425599398/,07/01/2026
"Junior Automation Engineer - North
Junior Automation Engineer - North with verification",Parallel Wireless,"Kinneret Kvutza, North District, Israel (Hybrid)",https://www.linkedin.com/jobs/view/4434996815/,07/01/2026
"Datacenter Technician
Datacenter Technician with verification",Oscar,"Haifa, Haifa District, Israel (On-site)",https://www.linkedin.com/jobs/view/4428846269/,07/01/2026
"Tennis Instructor (M/W) Club Med Resorts
Tennis Instructor (M/W) Club Med Resorts with verification",Club Med,"Ashdod, South District, Israel (On-site)",https://www.linkedin.com/jobs/view/4167487503/,07/01/2026
"Senior Software Engineer - Data Infrastructure
Senior Software Engineer - Data Infrastructure with verification",Mobileye,"Ramat Gan, Tel Aviv District, Israel (Hybrid)",https://www.linkedin.com/jobs/view/4415603368/,07/01/2026
"Remote Experienced Recruiter  - international recruitment agency
Remote Experienced Recruiter  - international recruitment agency",Confidential,Israel (Remote),https://www.linkedin.com/jobs/view/4432650111/,07/01/2026
"אחראי/ת חשבונות יבוא ויצוא בשינוע בינלאומי
אחראי/ת חשבונות יבוא ויצוא בשינוע בינלאומי with verification",IAI - Israel Aerospace Industries,"Lod, Center District, Israel (On-site)",https://www.linkedin.com/jobs/view/4324801445/,07/01/2026
"Member of Technical Staff - Research Engineering (Remote)
Member of Technical Staff - Research Engineering (Remote)",Quik Hire Staffing,EMEA (Remote),https://www.linkedin.com/jobs/view/4435516035/,07/01/2026
"Corporate Controller
Corporate Controller",BTC  searching,"Tel Aviv District, Israel (Hybrid)",https://www.linkedin.com/jobs/view/4435116464/,07/01/2026
"SQL Developer (Remote)
SQL Developer (Remote)",Hire Feed,EMEA (Remote),https://www.linkedin.com/jobs/view/4434979353/,07/01/2026
"AI Algorithms Manager
AI Algorithms Manager with verification",TytoCare,"Netanya, Center District, Israel (Hybrid)",https://www.linkedin.com/jobs/view/4435136348/,07/01/2026
"Office Manager (WM)
Office Manager (WM)",Jobera.com,Israel (On-site),https://www.linkedin.com/jobs/view/4434326654/,07/01/2026
"Research Analyst
Research Analyst with verification",Modellama,"Center District, Israel (On-site)",https://www.linkedin.com/jobs/view/4346873234/,07/01/2026
"CRM Application Specialist
CRM Application Specialist with verification",Check Point Software,"Tel Aviv-Yafo, Tel Aviv District, Israel (On-site)",https://www.linkedin.com/jobs/view/4435195235/,07/01/2026
"Staff Product Data Scientist -  Developer Productivity (Global, Americas)
Staff Product Data Scientist -  Developer Productivity (Global, Americas) with verification",Shopify,EMEA (Remote),https://www.linkedin.com/jobs/view/4434370699/,07/01/2026
"עו""ד שוק הון מנוסה? מחפש/ת את המעבר מסטטוס של שכיר לשותף מייסד (Co-Founder) בפעילות הנפקות פרטיות וציבוריות בארץ ובחו""ל?
עו""ד שוק הון מנוסה? מחפש/ת את המעבר מסטטוס של שכיר לשותף מייסד (Co-Founder) בפעילות הנפקות פרטיות וציבוריות בארץ ובחו""ל?",Shoukhon ltd,"Tel Aviv-Yafo, Tel Aviv District, Israel (Hybrid)",https://www.linkedin.com/jobs/view/4431963267/,07/01/2026
"Skapion’s Missile & Aerospace Talent Pipeline
Skapion’s Missile & Aerospace Talent Pipeline",Skapion,"Ramat Gan, Tel Aviv District, Israel (On-site)",https://www.linkedin.com/jobs/view/4434989989/,07/01/2026
"Windsurfing Instructor (M/W) Club Med Resorts
Windsurfing Instructor (M/W) Club Med Resorts with verification",Club Med,"Tel Aviv-Yafo, Tel Aviv District, Israel (On-site)",https://www.linkedin.com/jobs/view/4167488244/,07/01/2026
"טכנאי/ת אנטגרציה
טכנאי/ת אנטגרציה with verification",IAI - Israel Aerospace Industries,"Lod, Center District, Israel (On-site)",https://www.linkedin.com/jobs/view/4405920690/,07/01/2026
"Senior Front End Engineer
Senior Front End Engineer with verification",Navan,"Tel Aviv-Yafo, Tel Aviv District, Israel (Hybrid)",https://www.linkedin.com/jobs/view/4434988131/,07/01/2026
"Clinical Operations Manager / Lead
Clinical Operations Manager / Lead with verification",PSI CRO,"Raanana, Center District, Israel (On-site)",https://www.linkedin.com/jobs/view/4423656247/,07/01/2026
"Senior Data Architect
Senior Data Architect with verification",Automat-it,"Tel Aviv-Yafo, Tel Aviv District, Israel (Hybrid)",https://www.linkedin.com/jobs/view/4335254080/,07/01/2026
