title,company,location,url,date
"Senior QA Software Engineer, Networking
Senior QA Software Engineer, Networking with verification",NVIDIA,"Yokneam Ilit, North District, Israel (On-site)",https://www.linkedin.com/jobs/view/4406240406/,07/01/2026
"Brand & Visual Designer
Brand & Visual Designer with verification",The5ers.com,"Raanana, Center District, Israel (On-site)",https://www.linkedin.com/jobs/view/4434330595/,07/01/2026
"Senior Corporate Accountant (Remote)
Senior Corporate Accountant (Remote)",Quik Hire Staffing,EMEA (Remote),https://www.linkedin.com/jobs/view/4435503962/,07/01/2026
"Senior Physicist
Senior Physicist with verification",Elbit Systems Israel,"Rehovot, Center District, Israel (On-site)",https://www.linkedin.com/jobs/view/4431948543/,07/01/2026
"IT Manager
IT Manager",Confidential Global,"Center District, Israel (Hybrid)",https://www.linkedin.com/jobs/view/4427820745/,07/01/2026
"Design Vision Lead, Google Cloud
Design Vision Lead, Google Cloud with verification",Google,"Haifa District, Israel (On-site)",https://www.linkedin.com/jobs/view/4425291707/,07/01/2026
"Financial Controller Associate
Financial Controller Associate with verification",JPMorganChase,"Herzliya, Tel Aviv District, Israel (On-site)",https://www.linkedin.com/jobs/view/4417378926/,07/01/2026
"מבקר/ת פנימי/ת בכיר/ה – תפקיד אסטרטגי עם השפעה אמיתית- יזמקו חברה בעמ
מבקר/ת פנימי/ת בכיר/ה – תפקיד אסטרטגי עם השפעה אמיתית- יזמקו חברה בעמ",IIA Israel - Institute of Internal Auditors in Israel,"Tel Aviv-Yafo, Tel Aviv District, Israel (On-site)",https://www.linkedin.com/jobs/view/4431977454/,07/01/2026
"Senior UI/UX Designer
Senior UI/UX Designer",Jobgether,Israel (Remote),https://www.linkedin.com/jobs/view/4434310093/,07/01/2026
"Senior Inside Sales - SaaS Specialist
Senior Inside Sales - SaaS Specialist with verification",Hygiena,EMEA (Remote),https://www.linkedin.com/jobs/view/4431913433/,07/01/2026
"Founding Account Executive - Web Scraping
Founding Account Executive - Web Scraping",Bringits,"Tel Aviv District, Israel (Hybrid)",https://www.linkedin.com/jobs/view/4405618039/,07/01/2026
"Customer Success Specialist
Customer Success Specialist with verification",SiiRA,EMEA (Remote),https://www.linkedin.com/jobs/view/4435107060/,07/01/2026
"סוכן.ת מכירות אזורי.ת - תל אביב
סוכן.ת מכירות אזורי.ת - תל אביב",L'Oréal,"Tel Aviv-Yafo, Tel Aviv District, Israel (On-site)",https://www.linkedin.com/jobs/view/4425822356/,07/01/2026
"Senior MXS Verification Engineer
Senior MXS Verification Engineer","Retym, Inc","Ramat Gan, Tel Aviv District, Israel (Hybrid)",https://www.linkedin.com/jobs/view/4435171734/,07/01/2026
"PHD Peer Review Need– Spectroscopy
PHD Peer Review Need– Spectroscopy","Fengkai Group Co., Limited",Middle East (Remote),https://www.linkedin.com/jobs/view/4431575741/,07/01/2026
"Senior Embedded Software Engineer
Senior Embedded Software Engineer with verification",Yael Korentec Technologies,"Yehud Monosson, Center District, Israel (On-site)",https://www.linkedin.com/jobs/view/4433054249/,07/01/2026
"Search Engine Optimization Analyst
Search Engine Optimization Analyst",SeatPick,EMEA (Remote),https://www.linkedin.com/jobs/view/4434944979/,07/01/2026
"Service Coordinator
Service Coordinator",Bulwarx,"Raanana, Center District, Israel (On-site)",https://www.linkedin.com/jobs/view/4435113070/,07/01/2026
"Director of Engineering (Operations)
Director of Engineering (Operations) with verification",D-Fend Solutions,"Raanana, Center District, Israel (On-site)",https://www.linkedin.com/jobs/view/4431948349/,07/01/2026
"Social Media & Email Marketing Coordinator (Wix & Meta Ads)
Social Media & Email Marketing Coordinator (Wix & Meta Ads) with verification",BruntWork,EMEA (Remote),https://www.linkedin.com/jobs/view/4431979711/,07/01/2026
"Professional Services Engineer
Professional Services Engineer",Bulwarx,"Raanana, Center District, Israel (On-site)",https://www.linkedin.com/jobs/view/4435103148/,07/01/2026
"Financial Accountant (Bank Reconciliations & Month-End Close)
Financial Accountant (Bank Reconciliations & Month-End Close) with verification",BruntWork,EMEA (Remote),https://www.linkedin.com/jobs/view/4431994394/,07/01/2026
"מיישם/ת הגנת סייבר
מיישם/ת הגנת סייבר",MADSEC,"Holon, Tel Aviv District, Israel (On-site)",https://www.linkedin.com/jobs/view/4431589690/,07/01/2026
"Language Researcher (Remote)
Language Researcher (Remote)",Hire Feed,Israel (Remote),https://www.linkedin.com/jobs/view/4435501187/,07/01/2026
"Product Analyst Team Lead
Product Analyst Team Lead with verification",Aidoc,"Tel Aviv-Yafo, Tel Aviv District, Israel (Hybrid)",https://www.linkedin.com/jobs/view/4425993954/,07/01/2026
"Staff Product Manager - Supersonic
Staff Product Manager - Supersonic with verification",Unity,"Tel Aviv-Yafo, Tel Aviv District, Israel (On-site)",https://www.linkedin.com/jobs/view/4409148751/,07/01/2026
"Head of Events & Brand Partnerships
Head of Events & Brand Partnerships",SKIDEAL,"Netanya, Center District, Israel (On-site)",https://www.linkedin.com/jobs/view/4431922544/,07/01/2026
"Red Team Specialist | Cybersecurity | Leading Company (5469)
Red Team Specialist | Cybersecurity | Leading Company (5469)",INGIMA,"Center District, Israel (On-site)",https://www.linkedin.com/jobs/view/4435511361/,07/01/2026
"Telesales Representative- מכירות טלפוניות
Telesales Representative- מכירות טלפוניות with verification",COMDA,"Tel Aviv District, Israel (On-site)",https://www.linkedin.com/jobs/view/4432314974/,07/01/2026
"Senior Software Engineer
Senior Software Engineer with verification",Classiq,"Tel Aviv District, Israel (Hybrid)",https://www.linkedin.com/jobs/view/4409847748/,07/01/2026
"Core Systems Analyst
Core Systems Analyst with verification",SQLink Group,"Lod, Center District, Israel (Hybrid)",https://www.linkedin.com/jobs/view/4431908897/,07/01/2026
"Senior Data Infrastructure Engineer
Senior Data Infrastructure Engineer with verification",Lemonade,"Tel Aviv-Yafo, Tel Aviv District, Israel (Hybrid)",https://www.linkedin.com/jobs/view/4434704854/,07/01/2026
"Business Consultant (Remote)
Business Consultant (Remote)",Hire Feed,EMEA (Remote),https://www.linkedin.com/jobs/view/4435529098/,07/01/2026
"Snow Expert | Sales & Travel Specialist
Snow Expert | Sales & Travel Specialist",SKIDEAL,"Netanya, Center District, Israel (On-site)",https://www.linkedin.com/jobs/view/4428570936/,07/01/2026
"מזכיר/ה ללשכת ראש מנהל גילוי ויירוט
מזכיר/ה ללשכת ראש מנהל גילוי ויירוט with verification",IAI - Israel Aerospace Industries,"Ashdod, South District, Israel (On-site)",https://www.linkedin.com/jobs/view/4415606781/,07/01/2026
"Defense Analyst | $90/hr Remote
Defense Analyst | $90/hr Remote","Crossing Hurdles
$50/hr - $90/hr",EMEA (Remote),https://www.linkedin.com/jobs/view/4431936302/,07/01/2026
"AI Senior Software Engineer
AI Senior Software Engineer with verification",Aidoc,"Tel Aviv-Yafo, Tel Aviv District, Israel (Hybrid)",https://www.linkedin.com/jobs/view/4431918799/,07/01/2026
"Choreographer / Dancer (M/W) Club Med Resorts
Choreographer / Dancer (M/W) Club Med Resorts with verification",Club Med,"Ashdod, South District, Israel (On-site)",https://www.linkedin.com/jobs/view/4167487481/,07/01/2026
"System Engineer – Digital & Applications
System Engineer – Digital & Applications with verification",Maytronics,"Yizra'el, North District, Israel (On-site)",https://www.linkedin.com/jobs/view/4425076264/,07/01/2026
"Data Scientist
Data Scientist with verification",Logica-IT,"Herzliya, Tel Aviv District, Israel (Hybrid)",https://www.linkedin.com/jobs/view/4431903982/,07/01/2026
"רכז/ת שיווק ודיגיטל - מחלקת שיווק חברה ערבית בהנהלה הראשית (49762)
רכז/ת שיווק ודיגיטל - מחלקת שיווק חברה ערבית בהנהלה הראשית (49762) with verification",Clalit Health Services,"Tel Aviv District, Israel (On-site)",https://www.linkedin.com/jobs/view/4431926305/,07/01/2026
"Senior Marketing Operations Manager
Senior Marketing Operations Manager with verification",Similarweb,"Tel Aviv-Yafo, Tel Aviv District, Israel (On-site)",https://www.linkedin.com/jobs/view/4407137214/,07/01/2026
"Sales Account Manager
Sales Account Manager",Confidential,"Center District, Israel (Hybrid)",https://www.linkedin.com/jobs/view/4434350279/,07/01/2026
"Risk Intelligence Analyst (Remote)
Risk Intelligence Analyst (Remote)",Hire Feed,EMEA (Remote),https://www.linkedin.com/jobs/view/4435512370/,07/01/2026
"טכנאי/ת אנטגרציה
טכנאי/ת אנטגרציה with verification",IAI - Israel Aerospace Industries,"Lod, Center District, Israel (On-site)",https://www.linkedin.com/jobs/view/4405920690/,07/01/2026
"Tennis Instructor (M/W) Club Med Resorts
Tennis Instructor (M/W) Club Med Resorts with verification",Club Med,"Ashdod, South District, Israel (On-site)",https://www.linkedin.com/jobs/view/4167487503/,07/01/2026
"Analyst/Senior Analyst, Customer Marketing (Bangkok Based, Relocation provided)
Analyst/Senior Analyst, Customer Marketing (Bangkok Based, Relocation provided) with verification",Agoda,"Tel Aviv-Yafo, Tel Aviv District, Israel (On-site)",https://www.linkedin.com/jobs/view/4365101051/,07/01/2026
"Silicon Engineering Manager
Silicon Engineering Manager",Credo,"Modiin-Maccabim-Reut, Center District, Israel (On-site)",https://www.linkedin.com/jobs/view/4434366810/,07/01/2026
"ERP Project Manager / Implementation manager
ERP Project Manager / Implementation manager",Confidential,"Shoham, Center District, Israel (On-site)",https://www.linkedin.com/jobs/view/4429651025/,07/01/2026
"Sr. Product Manager- Prisma Browser
Sr. Product Manager- Prisma Browser with verification",Palo Alto Networks,"Tel Aviv-Yafo, Tel Aviv District, Israel (On-site)",https://www.linkedin.com/jobs/view/4422267686/,07/01/2026
"(Inventory, Rishon LeZion, Harova) מחסנאים - ראשל״צ מזרח- הרובע
(Inventory, Rishon LeZion, Harova) מחסנאים - ראשל״צ מזרח- הרובע with verification",Wolt,"Rishon LeZion, Center District, Israel (On-site)",https://www.linkedin.com/jobs/view/4266444379/,07/01/2026
"Mechanical Team Manager
Mechanical Team Manager",Dialog,"North District, Israel (Hybrid)",https://www.linkedin.com/jobs/view/4432334405/,07/01/2026
"Social Media Manager
Social Media Manager","BTB - Be The Bank,","Tel Aviv-Yafo, Tel Aviv District, Israel (On-site)",https://www.linkedin.com/jobs/view/4435184586/,07/01/2026
"Proofreader (Remote)
Proofreader (Remote)",Hire Feed,Israel (Remote),https://www.linkedin.com/jobs/view/4435501191/,07/01/2026
"מנהל פרוייקטים בשירות לקוח
מנהל פרוייקטים בשירות לקוח with verification",IAI - Israel Aerospace Industries,"Yehud Monosson, Center District, Israel (On-site)",https://www.linkedin.com/jobs/view/4415772793/,07/01/2026
"Choreographer / Dancer (M/W) Club Med Resorts
Choreographer / Dancer (M/W) Club Med Resorts with verification",Club Med,"West Jerusalem, Jerusalem District, Israel (On-site)",https://www.linkedin.com/jobs/view/4167489119/,07/01/2026
"Solution Architect
Solution Architect with verification",NiCE,"Raanana, Center District, Israel (Hybrid)",https://www.linkedin.com/jobs/view/4421966471/,07/01/2026
"Technical Architect
Technical Architect with verification",Workato,"Tel Aviv-Yafo, Tel Aviv District, Israel (On-site)",https://www.linkedin.com/jobs/view/4425993233/,07/01/2026
"Strategic Procurement Account Lead
Strategic Procurement Account Lead with verification",HP,"Ness Ziona, Center District, Israel (On-site)",https://www.linkedin.com/jobs/view/4435331661/,07/01/2026
"Marketing Data Analyst (Bangkok Based, Relocation provided)
Marketing Data Analyst (Bangkok Based, Relocation provided) with verification",Agoda,"Tel Aviv-Yafo, Tel Aviv District, Israel (On-site)",https://www.linkedin.com/jobs/view/4299765676/,07/01/2026
"PPC Manager - Paid Search & Social Advertising
PPC Manager - Paid Search & Social Advertising",Movinglife,"Tel Aviv District, Israel (On-site)",https://www.linkedin.com/jobs/view/4431942202/,07/01/2026
"Senior AI Integrations & Automation Engineer
Senior AI Integrations & Automation Engineer with verification",Cloudinary,"Petah Tikva, Center District, Israel (Hybrid)",https://www.linkedin.com/jobs/view/4425583489/,07/01/2026
"Cloud Operations Engineer
Cloud Operations Engineer with verification",Confidential Careers,"Center District, Israel (Hybrid)",https://www.linkedin.com/jobs/view/4431908946/,07/01/2026
"VP HR for a High-Growth Startup
VP HR for a High-Growth Startup",Kroll Consulting,"Ramat Gan, Tel Aviv District, Israel (Hybrid)",https://www.linkedin.com/jobs/view/4435500766/,07/01/2026
"Windsurfing Instructor (M/W) Club Med Resorts
Windsurfing Instructor (M/W) Club Med Resorts with verification",Club Med,"Tel Aviv-Yafo, Tel Aviv District, Israel (On-site)",https://www.linkedin.com/jobs/view/4167488244/,07/01/2026
"Native Language Trainer (Remote)
Native Language Trainer (Remote)",Hire Feed,Israel (Remote),https://www.linkedin.com/jobs/view/4435390525/,07/01/2026
"מבקר/ת חלקים
מבקר/ת חלקים with verification",IAI - Israel Aerospace Industries,"Lod, Center District, Israel (On-site)",https://www.linkedin.com/jobs/view/4314787410/,07/01/2026
"Senior FP&A Analyst
Senior FP&A Analyst",Credo,"Modiin-Maccabim-Reut, Center District, Israel (On-site)",https://www.linkedin.com/jobs/view/4434360984/,07/01/2026
"Software Engineer
Software Engineer with verification",Check Point Software,"Tel Aviv District, Israel (Hybrid)",https://www.linkedin.com/jobs/view/4418763213/,07/01/2026
"Financial Analysis Specialist - Google Workspace | Remote
Financial Analysis Specialist - Google Workspace | Remote","Crossing Hurdles
$63/hr - $119/hr",EMEA (Remote),https://www.linkedin.com/jobs/view/4425234597/,07/01/2026
"C++ Developer - 240168
C++ Developer - 240168 with verification",Experis Israel,"Ashdod, South District, Israel (On-site)",https://www.linkedin.com/jobs/view/4432325664/,07/01/2026
"מזכיר.ה
מזכיר.ה with verification",Elbit Systems Israel,"Holon, Tel Aviv District, Israel (On-site)",https://www.linkedin.com/jobs/view/4431910224/,07/01/2026
"Deputy Chief Financial Officer
Deputy Chief Financial Officer",Expert Executive Recruiters (EER Global),"Tel Aviv-Yafo, Tel Aviv District, Israel (On-site)",https://www.linkedin.com/jobs/view/4424678461/,07/01/2026
"Head of Brand & Creative
Head of Brand & Creative with verification",WeSki,"Herzliya, Tel Aviv District, Israel (Hybrid)",https://www.linkedin.com/jobs/view/4417594876/,07/01/2026
"Business Intelligence Consultant (Remote)
Business Intelligence Consultant (Remote)",Quik Hire Staffing,EMEA (Remote),https://www.linkedin.com/jobs/view/4435506630/,07/01/2026
"Customer Success (Language Specialist) (Remote)
Customer Success (Language Specialist) (Remote)",Hire Feed,Israel (Remote),https://www.linkedin.com/jobs/view/4435392388/,07/01/2026
"מראיינ/ת ביטחונ/ית
מראיינ/ת ביטחונ/ית with verification",IAI - Israel Aerospace Industries,"Yehud Monosson, Center District, Israel (On-site)",https://www.linkedin.com/jobs/view/4415789040/,07/01/2026
"Retail Sales Associate  (M/W) Club Med Resorts
Retail Sales Associate  (M/W) Club Med Resorts with verification",Club Med,"Petah Tikva, Center District, Israel (On-site)",https://www.linkedin.com/jobs/view/4167483942/,07/01/2026
"Electrical Engineer  | Tel Aviv University
Electrical Engineer  | Tel Aviv University with verification",Tel Aviv University,"Tel Aviv District, Israel (On-site)",https://www.linkedin.com/jobs/view/4435121449/,07/01/2026
"Machine Learning Engineer | Remote
Machine Learning Engineer | Remote","Crossing Hurdles
$30/hr - $130/hr",EMEA (Remote),https://www.linkedin.com/jobs/view/4422269313/,07/01/2026
"Senior Product Manager - Workspace Security Platform
Senior Product Manager - Workspace Security Platform with verification",Check Point Software,"Tel Aviv District, Israel (Hybrid)",https://www.linkedin.com/jobs/view/4431964899/,07/01/2026
"Senior Apple Platforms Developer – SwiftUI & tvOS
Senior Apple Platforms Developer – SwiftUI & tvOS",Connect Vision International,EMEA (Remote),https://www.linkedin.com/jobs/view/4435357002/,07/01/2026
"Cloud Architect
Cloud Architect with verification",NiCE,"Raanana, Center District, Israel (Hybrid)",https://www.linkedin.com/jobs/view/4421960629/,07/01/2026
"Test Development Engineer (ATE)
Test Development Engineer (ATE)",abra,"Center District, Israel (On-site)",https://www.linkedin.com/jobs/view/4434313111/,07/01/2026
"Lead Teacher
Lead Teacher","ביה""ס ביכורים המכיל ת""א","Tel Aviv District, Israel (On-site)",https://www.linkedin.com/jobs/view/4431986019/,07/01/2026
"Senior DevOps Engineer
Senior DevOps Engineer",4M Analytics,"Tel Aviv-Yafo, Tel Aviv District, Israel (Hybrid)",https://www.linkedin.com/jobs/view/4434993631/,07/01/2026
"Technical Sales Specialist – Bakery & Confectionery
Technical Sales Specialist – Bakery & Confectionery",Meala Foodtech,"Haifa, Haifa District, Israel (On-site)",https://www.linkedin.com/jobs/view/4431907201/,07/01/2026
"Data Annotation Specialist (Remote)
Data Annotation Specialist (Remote)",Quik Hire Staffing,EMEA (Remote),https://www.linkedin.com/jobs/view/4434992457/,07/01/2026
"אחראי/ת חשבונות יבוא ויצוא בשינוע בינלאומי
אחראי/ת חשבונות יבוא ויצוא בשינוע בינלאומי with verification",IAI - Israel Aerospace Industries,"Lod, Center District, Israel (On-site)",https://www.linkedin.com/jobs/view/4324801445/,07/01/2026
"Translator (Remote)
Translator (Remote)",Hire Feed,Israel (Remote),https://www.linkedin.com/jobs/view/4435502175/,07/01/2026
"Choreographer / Dancer (M/W) Club Med Resorts
Choreographer / Dancer (M/W) Club Med Resorts with verification",Club Med,"Petah Tikva, Center District, Israel (On-site)",https://www.linkedin.com/jobs/view/4167484742/,07/01/2026
"דרוש/ה יועץ/ת מכירות לחברת נדל״ן
דרוש/ה יועץ/ת מכירות לחברת נדל״ן",SDB,"Bnei Brak, Tel Aviv District, Israel (On-site)",https://www.linkedin.com/jobs/view/4432341246/,07/01/2026
"Head of Accounting (Chief Bookkeeper)
Head of Accounting (Chief Bookkeeper)",Pama Finance - פמה מימון,"Tel Aviv District, Israel (Hybrid)",https://www.linkedin.com/jobs/view/4431915522/,07/01/2026
"PHD Peer Review Need– Hematology
PHD Peer Review Need– Hematology","Fengkai Group Co., Limited",Middle East (Remote),https://www.linkedin.com/jobs/view/4431992716/,07/01/2026
"PHD Peer Review Need– Pulmonology
PHD Peer Review Need– Pulmonology","Fengkai Group Co., Limited",Middle East (Remote),https://www.linkedin.com/jobs/view/4431597488/,07/01/2026
"Legal Intake Specialist
Legal Intake Specialist with verification",BruntWork,EMEA (Remote),https://www.linkedin.com/jobs/view/4432332225/,07/01/2026
"SAP ABAP Developer (m/f/d) | מפתח/ת ABAP
SAP ABAP Developer (m/f/d) | מפתח/ת ABAP with verification",Harel Insurance & Finance,"Ramat Gan, Tel Aviv District, Israel (On-site)",https://www.linkedin.com/jobs/view/4431986281/,07/01/2026
"HR & Talent Acquisition Lead
HR & Talent Acquisition Lead",Yuval HR,"Tel Aviv-Yafo, Tel Aviv District, Israel (On-site)",https://www.linkedin.com/jobs/view/4431921920/,07/01/2026
"מהנדס/ת מערכת ראשי/ת במינהלת עסקית לחימוש אווירי
מהנדס/ת מערכת ראשי/ת במינהלת עסקית לחימוש אווירי with verification",IAI - Israel Aerospace Industries,"Beer Yaakov, Center District, Israel (On-site)",https://www.linkedin.com/jobs/view/4415498800/,07/01/2026
"Machine Learning Engineer - AI (Remote)
Machine Learning Engineer - AI (Remote)",Hire Feed,EMEA (Remote),https://www.linkedin.com/jobs/view/4435515241/,07/01/2026
"Front Desk Agent  (M/W) Club Med Resorts
Front Desk Agent  (M/W) Club Med Resorts with verification",Club Med,"West Jerusalem, Jerusalem District, Israel (On-site)",https://www.linkedin.com/jobs/view/4167484716/,07/01/2026
"Lawyer and social media
Lawyer and social media",Roee Gold Law Office,"Tel Aviv-Yafo, Tel Aviv District, Israel (Hybrid)",https://www.linkedin.com/jobs/view/4431964109/,07/01/2026
"Nuclear Engineer | $90/hr Remote
Nuclear Engineer | $90/hr Remote","Crossing Hurdles
$50/hr - $90/hr",EMEA (Remote),https://www.linkedin.com/jobs/view/4431904953/,07/01/2026
"Head of Sales, Check Point Services
Head of Sales, Check Point Services with verification",Check Point Software,"Tel Aviv-Yafo, Tel Aviv District, Israel (On-site)",https://www.linkedin.com/jobs/view/4435189482/,07/01/2026
"PHD Peer Review Need– Nephrology
PHD Peer Review Need– Nephrology","Fengkai Group Co., Limited",Middle East (Remote),https://www.linkedin.com/jobs/view/4432302592/,07/01/2026
"Sports Data Collector (Basketball) - Kiryat Gat, Israel
Sports Data Collector (Basketball) - Kiryat Gat, Israel with verification",Genius Sports,"Kiryat Gat, South District, Israel (On-site)",https://www.linkedin.com/jobs/view/4431962643/,07/01/2026
"Senior Full-Stack Engineer - Frontend Focussed (Remote)
Senior Full-Stack Engineer - Frontend Focussed (Remote)",Hire Feed,EMEA (Remote),https://www.linkedin.com/jobs/view/4435509752/,07/01/2026
"Senior Verification Engineer
Senior Verification Engineer","Retym, Inc","Ramat Gan, Tel Aviv District, Israel (Hybrid)",https://www.linkedin.com/jobs/view/4435173705/,07/01/2026
"PHD Peer Review Need– Geriatrics
PHD Peer Review Need– Geriatrics","Fengkai Group Co., Limited",Middle East (Remote),https://www.linkedin.com/jobs/view/4432320088/,07/01/2026
"PHD Peer Review Need– Vascular Surgery
PHD Peer Review Need– Vascular Surgery","Fengkai Group Co., Limited",Middle East (Remote),https://www.linkedin.com/jobs/view/4432316481/,07/01/2026
"Senior MXS Verification Engineer
Senior MXS Verification Engineer","Retym, Inc","Ramat Gan, Tel Aviv District, Israel (Hybrid)",https://www.linkedin.com/jobs/view/4435171734/,07/01/2026
"Tech Lead
Tech Lead",InspHire,"Ramat Gan, Tel Aviv District, Israel (On-site)",https://www.linkedin.com/jobs/view/4434316186/,07/01/2026
"Subsidiaries Controller
Subsidiaries Controller with verification",Alma Lasers,"Caesarea, Haifa District, Israel (Hybrid)",https://www.linkedin.com/jobs/view/4433346899/,07/01/2026
"B2B Marketing Manager
B2B Marketing Manager",SmartUp Academy,"Raanana, Center District, Israel (Hybrid)",https://www.linkedin.com/jobs/view/4431915110/,07/01/2026
"Social Media & Content Specialist
Social Media & Content Specialist with verification",Alma Lasers,"Shoham, Center District, Israel (On-site)",https://www.linkedin.com/jobs/view/4422988082/,07/01/2026
"Mechanical Design Engineer
Mechanical Design Engineer with verification",Yael Korentec Technologies,"Beer Yaakov, Center District, Israel (On-site)",https://www.linkedin.com/jobs/view/4434488249/,07/01/2026
"Service Coordinator
Service Coordinator",Bulwarx,"Raanana, Center District, Israel (On-site)",https://www.linkedin.com/jobs/view/4435113070/,07/01/2026
"Senior Digital Hardware Design Engineer
Senior Digital Hardware Design Engineer",D-Fend Solutions,"Raanana, Center District, Israel (On-site)",https://www.linkedin.com/jobs/view/4435340692/,07/01/2026
"Professional Services Engineer
Professional Services Engineer",Bulwarx,"Raanana, Center District, Israel (On-site)",https://www.linkedin.com/jobs/view/4435103148/,07/01/2026
