title,company,location,url,date,deadline,department,description,requirements,position_type
מזכיר בית הספר,צפת,צפת,https://namerz.moin.gov.il/showexternal/55614/2,2026-06-26,2026-07-12,חינוך,רשות: צפת · מחוז: צפון · יחידה: חינוך · תחום: חינוך · דירוג: מינהלי · רמת השכלה: 12 שנות לימוד · תאריך פרסום: 2026-06-26 · מועד הגשה: 2026-07-12 · מספר מכרז: 58/2026,12 שנות לימוד,
בודק תכניות,צפת,צפת,https://namerz.moin.gov.il/showexternal/55616/2,2026-06-26,2026-07-12,הנדסה,"רשות: צפת · מחוז: צפון · יחידה: הנדסה · תחום: הנדסה · דירוג: הנדסאים/מהנדסים · רמת השכלה: אדריכל / מהנדס, אקדמאית / חילופית בהתאם לחוק, הנדסאי / טכנאי · תאריך פרסום: 2026-06-26 · מועד הגשה: 2026-07-12 · מספר מכרז: 61/2026",אדריכל / מהנדס; אקדמאית / חילופית בהתאם לחוק; הנדסאי / טכנאי,
אב בית במרכז קהילתי,רעננה,רעננה,https://namerz.moin.gov.il/showexternal/55825/1,2026-06-28,2026-07-12,בריאות,רשות: רעננה · מחוז: מרכז · יחידה: הגנת הסביבה · תחום: בריאות · רמת השכלה: 12 שנות לימוד · תאריך פרסום: 2026-06-28 · מועד הגשה: 2026-07-12 · מספר מכרז: 104/2026,12 שנות לימוד,
קצין ביקור סדיר,צפת,צפת,https://namerz.moin.gov.il/showexternal/55615/3,2026-06-26,2026-07-12,חינוך,"רשות: צפת · מחוז: צפון · יחידה: חינוך · תחום: חינוך · דירוג: חינוך ונוער · רמת השכלה: אקדמאית / חילופית בהתאם לחוק, הנדסאי / טכנאי · תאריך פרסום: 2026-06-26 · מועד הגשה: 2026-07-12 · מספר מכרז: 60/2026",אקדמאית / חילופית בהתאם לחוק; הנדסאי / טכנאי,
מנהל יישובי למאבק באלימות סמים ואלכוהול,כסרא-סמיע,כסרא-סמיע,https://namerz.moin.gov.il/showexternal/55814/2,2026-06-28,2026-07-12,תוכניות לאומיות,רשות: כסרא-סמיע · מחוז: צפון · יחידה: תוכניות לאומיות · תחום: תוכניות לאומיות · רמת השכלה: אקדמאית / חילופית בהתאם לחוק · תאריך פרסום: 2026-06-28 · מועד הגשה: 2026-07-12 · מספר מכרז: 2/2026,אקדמאית / חילופית בהתאם לחוק,
גזבר,חריש,חריש,https://namerz.moin.gov.il/showexternal/55506/3,2026-06-21,2026-07-12,כספים,רשות: חריש · מחוז: חיפה · יחידה: כספים כללי · תחום: כספים · רמת השכלה: אקדמאית / חילופית בהתאם לחוק · תאריך פרסום: 2026-06-21 · מועד הגשה: 2026-07-12 · מספר מכרז: 52/26,אקדמאית / חילופית בהתאם לחוק,
גזבר,באר שבע,באר שבע,https://namerz.moin.gov.il/showexternal/55118/5,2026-06-11,2026-07-12,כספים,"רשות: באר שבע · מחוז: דרום · יחידה: כספים כללי · תחום: כספים · דירוג: דרגה דירוג: הסכם בכירים · רמת השכלה: אקדמאית / חילופית בהתאם לחוק, קורסים נוספים כמפורט בקובץ · תאריך פרסום: 2026-06-11 · מועד הגשה: 2026-07-12 · מספר מכרז: 28/2026",אקדמאית / חילופית בהתאם לחוק; קורסים נוספים כמפורט בקובץ,
אב בית איש תחזוקה בבית הספר,קרית גת,קרית גת,https://namerz.moin.gov.il/showexternal/55679/2,2026-06-24,2026-07-12,חינוך,רשות: קרית גת · מחוז: דרום · יחידה: חינוך · תחום: חינוך · דירוג: מינהלי · רמת השכלה: קורסים נוספים כמפורט בקובץ · תאריך פרסום: 2026-06-24 · מועד הגשה: 2026-07-12 · מספר מכרז: 30/2026,קורסים נוספים כמפורט בקובץ,
לבורנט בבית ספר,קרית גת,קרית גת,https://namerz.moin.gov.il/showexternal/55680/2,2026-06-24,2026-07-12,חינוך,רשות: קרית גת · מחוז: דרום · יחידה: חינוך · תחום: חינוך · דירוג: לבורנטים · רמת השכלה: אקדמאית / חילופית בהתאם לחוק · תאריך פרסום: 2026-06-24 · מועד הגשה: 2026-07-12 · מספר מכרז: 29/2026,אקדמאית / חילופית בהתאם לחוק,
"מנהל מרכז השכלה רשותי (היל""ה) ביחידה לקידום נוער",אור עקיבא,אור עקיבא,https://namerz.moin.gov.il/showexternal/55547/1,2026-06-22,2026-07-13,נוער תרבות וספורט,רשות: אור עקיבא · מחוז: חיפה · יחידה: נוער תרבות וספורט · תחום: נוער תרבות וספורט · דירוג: נוער וקהילה · רמת השכלה: אקדמאית / חילופית בהתאם לחוק · תאריך פרסום: 2026-06-22 · מועד הגשה: 2026-07-13 · מספר מכרז: 2026\55,אקדמאית / חילופית בהתאם לחוק,
עובד קידום נוער/עובד חינוך טיפול בקידום נוער,אור עקיבא,אור עקיבא,https://namerz.moin.gov.il/showexternal/55619/1,2026-06-22,2026-07-13,נוער תרבות וספורט,רשות: אור עקיבא · מחוז: חיפה · יחידה: נוער תרבות וספורט · תחום: נוער תרבות וספורט · דירוג: דירוג נוער וקהילה · רמת השכלה: אקדמאית / חילופית בהתאם לחוק · תאריך פרסום: 2026-06-22 · מועד הגשה: 2026-07-13 · מספר מכרז: 56/2026,אקדמאית / חילופית בהתאם לחוק,
מזכיר/ב במחלקת ההנדסה,מצפה רמון,מצפה רמון,https://namerz.moin.gov.il/showexternal/55783/1,2026-06-28,2026-07-13,הנדסה,מזכיר/ב במחלקת ההנדסה,12 שנות לימוד,
בודק תכניות,ראשון לציון,ראשון לציון,https://namerz.moin.gov.il/showexternal/55801/1,2026-06-28,2026-07-13,הנדסה,"רשות: ראשון לציון · מחוז: מרכז · יחידה: הנדסה · תחום: הנדסה · דירוג: א.	העובד יועסק במתח דרגות  38-41 בדרוג המהנדסים או במתח דרגות 37-41  בדירוג ההנדסאים או במתח דרגות 37-41 בדרוג המח""ר או לחילופין העסקה במתח דרגות 37-41  בחוזה דירוגי  הנדסאים או  במתח דרגות  38-41 בחוזה דירוגי מהנדסים/אדריכלים בכפוף לאישור משרד הפנים.                 מועמד שיבחר לתפקיד ישובץ במערך החירום העירוני. · רמת השכלה: אקדמאית / חילופית בהתאם לחוק · תאריך פרסום: 2026-06-28 · מועד הגשה: 2026-07-13 · מספר מכרז: 113.2026",אקדמאית / חילופית בהתאם לחוק,
עורך דין בלשכה המשפטית,ראשון לציון,ראשון לציון,https://namerz.moin.gov.il/showexternal/55802/1,2026-06-28,2026-07-13,משפטי,"רשות: ראשון לציון · מחוז: מרכז · יחידה: משפטי · תחום: משפטי · דירוג: העובד יועסק במתח דרגות א'2–א'4 בדירוג המשפטנים. לחילופין, העסקה בחוזה דירוגי למשפטנים בכפוף לאישור משרד הפנים. מועמד שייבחר לתפקיד ישובץ במערך החירום העירוני. · רמת השכלה: אקדמאית / חילופית בהתאם לחוק · תאריך פרסום: 2026-06-28 · מועד הגשה: 2026-07-13 · מספר מכרז: 135.2026",אקדמאית / חילופית בהתאם לחוק,
נהג משאית אשפה,ראשון לציון,ראשון לציון,https://namerz.moin.gov.il/showexternal/55803/1,2026-06-28,2026-07-13,שפע ותשתיות,"רשות: ראשון לציון · מחוז: מרכז · יחידה: שפ""ע ותשתיות · תחום: שפע ותשתיות · דירוג: א.	העובד יועסק במתח דרגות 6-8 בדירוג המנהלי.                         מועמד שיבחר ישובץ במערך החירום העירוני · רמת השכלה: 12 שנות לימוד · תאריך פרסום: 2026-06-28 · מועד הגשה: 2026-07-13 · מספר מכרז: 153.2026",12 שנות לימוד,
אב בית איש תחזוקה בבית הספר,ראשון לציון,ראשון לציון,https://namerz.moin.gov.il/showexternal/55804/1,2026-06-28,2026-07-13,חינוך,רשות: ראשון לציון · מחוז: מרכז · יחידה: חינוך · תחום: חינוך · דירוג: העובד יועסק במתח דרגות שייקבע על פי מספר כתות:               בבית ספר מ- 20 כיתות ומעלה מתח הדרגות 6-8 בדירוג המינהלי .               100% משרה.               מועמד שייבחר ישובץ במערך החירום העירוני · רמת השכלה: השכלה תיכונית · תאריך פרסום: 2026-06-28 · מועד הגשה: 2026-07-13 · מספר מכרז: 163.2026,השכלה תיכונית,
פסיכולוג חינוכי,ראשון לציון,ראשון לציון,https://namerz.moin.gov.il/showexternal/55805/1,2026-06-28,2026-07-13,חינוך,"רשות: ראשון לציון · מחוז: מרכז · יחידה: חינוך · תחום: חינוך · דירוג: המועמד יועסק עפ""י הסכם קיבוצי של הפסיכולוגים           מועמד שייבחר ישובץ במערך החירום העירוני · רמת השכלה: אקדמאית / חילופית בהתאם לחוק · תאריך פרסום: 2026-06-28 · מועד הגשה: 2026-07-13 · מספר מכרז: 55.2026",אקדמאית / חילופית בהתאם לחוק,
מנהלן בית ספר,ראשון לציון,ראשון לציון,https://namerz.moin.gov.il/showexternal/55806/1,2026-06-28,2026-07-13,חינוך,"רשות: ראשון לציון · מחוז: מרכז · יחידה: חינוך · תחום: חינוך · דירוג: בתי הספר היסודיים שבניהול עצמי, מנהלן יהיה במתח דרגות המותנה במספר הכיתות בבית הספר.       עד 19 כיתות - העובד יועסק במתח דרגות 7-10 בדירוג מינהלי או במתח דרגות 37-40 בדירוג המח""ר.      מ- 20 כיתות ומעלה  – העובד יועסק במתח דרגות 7-11 בדירוג המנהלי או במתח דרגות 37-41 בדירוג המח""ר.      תחילת שעת עבודה – 07:30       100% משרה.      מועמד שייבחר ישובץ במערך החירום העירוני · רמת השכלה: 12 שנות לימוד · תאריך פרסום: 2026-06-28 · מועד הגשה: 2026-07-13 · מספר מכרז: 81.2026",12 שנות לימוד,
מנהל מחלקת ניקיון ואחזקת מבני מוסדות חינוך של הרשות,ראשון לציון,ראשון לציון,https://namerz.moin.gov.il/showexternal/55807/1,2026-06-28,2026-07-13,חינוך,"מכרז פנימי/פומבי מס' 11/2026 לתפקיד מנהל מחלקת ניקיון ואחזקת מבני מוסדות חינוך של הרשות עיריית ראשון לציון מבקשת בזה הצעות לתפקיד מנהל מחלקת ניקיון ואחזקת מבני מוסדות חינוך של הרשות מינהל חינוך א. תאור התפקיד 1. אחריות על ניהול, ייזום וטיפול מבני מוסדות חינוך גנ""י ובתי ספר ברחבי העיר. 2. ניהול עובדים והנֻחייתם המקצועית. 3. ניהול והנחייה מיקצועית של עובדי המחלקה. 4. כינון מערך בקרה ומעקב אחר נכסי מינהל החינוך בנושא ניקיון ואחזקת מוסדות חינוך . 5. ניהול מערך לוגיסטי של נקיון במבני במוסדות החינוך, תוך הפעלת מערך הבקרה ופיקוח על קבלני הניקיון במוסדות החינוך. 6. עבודה למול מנהלי / תחזוקני בתי הספר לטובת ניהול בקרת איכות, שירות, ניקיון ואחזקת מוסדות חינוך. 7. היערכות לקראת פתיחת בתי ספר וגני ברחבי העיר בתחום הניקיון 8. ביצוע כל מטלה נוספת שתידרש ע""י הממונה. ב. דרישות סף 1. בעל תואר אקדמי שנרכש, במוסד המוכר על ידי המועצה להשכלה גבוהה, או שקיבל הכרה מהמחלקה להערכת תארים אקדמיים בחוץ לארץ, או הנדסאי או טכנאי רשום בהתאם לסעיף 39 לחוק ההנדסאים והטכנאים והמוסמכים, התשע""ג-2012. או תעודת סמיכות לרבנות (""יורה יורה"") לפי אישור הרבנות הראשית לישראל. או אישור לימודים בתכנית מלאה בישיבה גבוהה או בכולל, שש שנים לפחות אחרי גיל 18 ומעבר שלוש בחינות לפחות מתוך מכלול הבחינות שמקיימת הרבנות הראשית לישראל (שתיים משלוש הבחינות יהיו בדיני שבת ודיני איסור והיתר), 2. ניסיון מקצועי בעבודה של ארבע שנים לפחות בעבודה בתחום העיסוק של המשרה. להנדסאי חמש שנות ניסיון כנדרש. לטכנאי שש שנות ניסיון כנדרש. המועמד נדרש לצרף תיעוד מפורט להוכחת עמידתו בדרישות התפקיד. מועמד שלא יצרף תיעוד כאמור, תיפסל מועמדותו על הסף. ג. כישורים נוספים 1. בעל הבעה בכתב ובע""פ בשפה העברית ברמה גבוהה מאוד. 2. יכולת קיום יחסי אנוש טובים. 3. יכולת עבודה בתנאי לחץ ועמידה בלו""ז. 4. נכונות לעבוד מעבר לשעות העבודה המקובלות. 5. יכולת ארגון ותכנון משימות בקפדנות ודייקנות. 6. היכרות בעבודה עם יישומי ה""אופיס"" 7. תואר אקדמי המוכר ע""י המל""ג – יתרון. 8. ניסיון בעבודה בבניית תוכניות עבודה – יתרון ד. כפיפות – סגן מנהל אגף לוגיסטיקה אחזקה והצטיידות במינהל החינוך",אקדמאית / חילופית בהתאם לחוק,
"רכז תחום קולנוע בביה""ס תיכון מקיף ז'",ראשון לציון,ראשון לציון,https://namerz.moin.gov.il/showexternal/55808/1,2026-06-28,2026-07-13,חינוך,"מכרז פנימי/פומבי מס' 158/2026 לתפקיד רכז תחום קולנוע בביה""ס תיכון מקיף ז' עיריית ראשון לציון מבקשת בזה הצעות לתפקיד רכז תחום קולנוע בביה""ס תיכון מקיף ז' מינהל החינוך א. תאור התפקיד 1. אחראי על תקינות ,שלמות והסדר בציוד במחסן הקולנוע ובמתחם המגמה, וכן ספירת מלאי. 2. אחראי על הכנת רשימת ציוד לרכישה כולל קלסר הצעות מחיר מסודר כנדרש. 3. הכנת ציוד לשיעורים מעשיים בהתאם לצרכי המורים. 4. עזרה ותמיכה בתלמידים בכל הפקות המגמה , כולל תמיכה טלפונית ופיזית בימי צילומי ההפקות 5. אחראי על רישום ושליחת סרטים של המגמה לפסטיבלים. 6. אחראי על רישום משמרות העריכה. 7. אחראי אדמיניסטרטיבי של מסע יצירה ושאר הפקות ואירועי המגמה (ערב אמצע, ערבי שיווק, ערב גמר, ימי מגמה) 8. אחראי על העלאת תכנים ליו-טיוב של המגמה. 9. אחראי על ניהול ארכיון המגמה. 10. אחראי על קטלוג הסרטים של המגמה. 11. מפיק בפועל של הפרויקט החברתי של המגמה. 12. אחראי עם הזמנת אוטובוסים, מילוי אישורים ביטחוניים למשלחות וטיולים, איסוף אישורי הורים. 13. ביצוע כל משימה אחרת בהתאם לדרישת הממונים. ב. דרישות סף 1. בוגר 12 שנות לימוד לפחות. יתרון לתעודת הנדסאי/טכנאי בתחום מערכות קולנוע וטלוויזיה או בוגר/ת מסלול עריכה קולנועית מקצועית . 2. ניסיון מיקצועי של שנה לפחות בתחום הטכני בעשייה הקולנועית (צילום, עריכה, תאורה, הקלטה). 3. היעדר הרשעה בעבירות מין, בהתאם לחוק מניעת העסקה של עברייני מין במוסדות מסוימים, התשס""א-2001. המועמד נדרש לצרף תיעוד מפורט להוכחת עמידתו בדרישות התפקיד. מועמד שלא יצרף תיעוד כאמור תיפסל מועמדותו על הסף. ג. כישורים נוספים 1. תקשורת בין אישית טובה. 2. יכולת הבעה בכתב ובע""פ בשפה העברית ברמה גבוהה. 3. יכולת ארגון ותכנון משימות בקפדנות ודייקנות. 4. יכולת עמידה בלוחות זמנים. 5. נכונות לעבודה מעבר לשעות המקובלות. 6. היכרות עם יישומי ה""אופיס"" ומערכות ממוחשבות לרבות מערכת האוטומציה, יכולות גבוהות באקסל – יתרון. ד. כפיפות מקצועית – מנהל ביה""ס, כפיפות מנהלתית – מינהל החינוך",12 שנות לימוד,
רכז שיבוצי תלמידים בחינוך המיוחד,ראשון לציון,ראשון לציון,https://namerz.moin.gov.il/showexternal/55809/1,2026-06-28,2026-07-13,חינוך,"מכרז מאגר פומבי/פנימי מס' 157/2026 לתפקיד רכז שיבוצי תלמידים בחינוך המיוחד עיריית ראשון לציון מבקשת בזה הצעות לתפקיד רכז שיבוצי תלמידים בחינוך המיוחד במינהל החינוך א. תיאור התפקיד 1. עבודת מטה ותיאום מול מחלקת הסעות תלמידים. 2. תיאום ושיבץ תלמידים במסגרות מערכות החינוך בעיר ומחוץ לעיר . 3. מעקב אחר ביצוע התקציב. 4. שיבוצי עובדי הוראה בעבודה בעת חופשות. 5. טיפול אדמיניסטרטיבי בתחום עליו מופקד כולל ניסוח מכתבים עבודה עם קהל. 6. מתנה מענה שוטף להורים וצוותי החינוך. 7. הכנת דוחות וריכוז נתונים. 8. ביצוע כל מטלה נוספת שתידרש ע""י הממונה. ב. דרישות סף 1. 12 שנות לימוד לפחות . 2. ניסיון מקצועי של שנתיים לפחות בעבודה בתחום קבלת קהל וטיפול בפניות . 3. המועמד נדרש לצרף תיעוד מפורט להוכחת עמידתו בדרישות התפקיד. מועמד שלא יצרף תיעוד כאמור תיפסל מועמדותו על הסף. 1. כישורים נוספים 2. כושר ביטוי בכתב בע""פ בשפה העברית ברמה גבוהה 3. קיום יחסי עבודה תקינים, יחסי אנוש מעולים, שירותיות, אדיבות, אמינות. 4. תפקוד בתנאי לחץ ועמידה בלוחות זמנים. 5. ייצוגיות ותודעת שירות גבוהה. 6. תואר אקדמי המוכר ע""י המל""ג- יתרון 7. עבודה עם מערכות ממוחשבות לרבות תוכנת האופיס יתרון לעבודה עם תוכנת האקסל. ג. כפיפות- מנהל המחלקה לחינוך המיוחד.",12 שנות לימוד,
מנהל מחלקה (הנדסה),ראשון לציון,ראשון לציון,https://namerz.moin.gov.il/showexternal/55810/1,2026-06-28,2026-07-13,הנדסה,"רשות: ראשון לציון · מחוז: מרכז · יחידה: הנדסה · תחום: הנדסה · דירוג: העובד יועסק במתח דרגות 40-42  בדרוג מח""ר או העסקה במתח דרגות 40-42 בדרוג המהנדסים/אדריכלים או במתח דרגות 40-42 בדירוג ההנדסאים. מועמד שיבחר לתפקיד ישובץ במערך החירום העירוני. · רמת השכלה: אקדמאית / חילופית בהתאם לחוק · תאריך פרסום: 2026-06-28 · מועד הגשה: 2026-07-13 · מספר מכרז: 162.2026",אקדמאית / חילופית בהתאם לחוק,
"דרוש/ה: מדריך/ה למועדונית – גילי בי""ס יסודי",הרצליה,הרצליה,https://namerz.moin.gov.il/showexternal/55818/2,2026-06-30,2026-07-13,רווחה,"דרוש/ה: מדריך/ה למועדונית – גילי בי""ס יסודי האגף לשירותים חברתיים – מחלקת משפחות וילדים בקהילה (משי""ק) כפיפות: רכזת המועדוניות (עו""ס) היקף המשרה: 70% שעות העבודה 11:00-18:00 , 3 פעמים בשבוע (עבודה בבקרים בעת הצורך) דרוג: חינוך, נוער חברה וקהילה או בדרוג מקביל (בהתאם להשכלת המועמד/ת) המשרה מאוישת ע""י עובדת עירייה במילוי מקום תיאור התפקיד: • העשרה וטיפול מול קבוצות של ילדים - עזרה בהכנת שיעורי בית • הדרכת ילדי המועדונית • הענקת יחס חם לילדים • עבודה בשעות אחה""צ (בבקרים - עפ""י צורך)",12 שנות לימוד,
דרוש/ה: מנהל/ת מדור ביטחון אירועים,הרצליה,הרצליה,https://namerz.moin.gov.il/showexternal/55821/2,2026-06-30,2026-07-13,חירום ובטחון,"דרוש/ה: מנהל/ת מדור ביטחון אירועים מינהל התפעול, אגף ביטחון וסדר ציבורי – מחלקת ביטחון אירועים כפיפות: מנהל מחלקת ביטחון אירועים היקף משרה: 100% מתח דרגות: 8-10 בדירוג מינהלי או בדירוג מקביל תיאור התפקיד: • תפעול, פיקוח ובקרה באירועים עירוניים וקהילתיים, לרבות אירועים תחת כיפת השמיים • ביצוע משימות בהתאם להנחיות ונהלים בתחום הרישוי, הבטיחות והנגישות לאירועים ציבוריים • הכנת תוכניות אבטחה והפצתן בקהילות בהתאם להנחיות המשטרה והגורמים המוסמכים • ייצוג הרשות בנושא אבטחת אירועים בהתאם לצורך • תיאום פעילות מול גורמי חירום כגון משטרת ישראל, כבאות והצלה ומד""א • תיאום והשתתפות בסיורים מקדימים בשטח יחד עם גורמי הרשות וגורמי חוץ • השתתפות בקבוצת פקודות בהתאם לדרישות המשטרה • עבודה בתיאום עם מנהלת מחלקת בטיחות באירועים • עבודה בתיאום מלא מול אגף תנו""ק וגופי עירייה נוספים המפיקים אירועים עירוניים וקהילתיים • עבודה בימים ושעות לא שגרתיים, לרבות ימי שישי, שבת, חגים ועתות חירום בהתאם לצורך • שילוב עבודה משרדית לצד עבודת שטח • ביצוע משימות נוספות בהתאם להנחיות הממונה ומנהל האגף",12 שנות לימוד,
מתכלל/ת תחום בריאות הנפש,אפרתה,אפרתה,https://namerz.moin.gov.il/showexternal/55830/1,2026-06-29,2026-07-13,בריאות,"מתכלל/ת תחום בריאות הנפש תכלול והובלה של תחום בריאות הנפש ברשות המקומית אפרת . סיוע בניווט בין מערכות השירותים השונות הפועלים במרחב הרשות, היכרות עומק עם הפערים הקיימים בשירותי בריאות הנפש במטרה ליצור מענים טיפוליים והתערבותיים משלימים, ולהנגיש אותם באופן פרטני למתמודדים ובני משפחותיהם. התפקיד כולל עבודה תחת ניהולו של מנהל תחום בריאות ומוגנות "" מרכז מונדלאק "" באפרת, לקידום חוסן ובריאות נפשית לכלל האוכלוסייה ברשות.",אקדמאית / חילופית בהתאם לחוק,
מזכיר בית הספר,אפרתה,אפרתה,https://namerz.moin.gov.il/showexternal/55831/1,2026-06-29,2026-07-13,חינוך,"רשות: אפרתה · מחוז: יהודה ושומרון · יחידה: חינוך · תחום: חינוך · דירוג: מנהלי/מח""ר · רמת השכלה: 12 שנות לימוד · תאריך פרסום: 2026-06-29 · מועד הגשה: 2026-07-13 · מספר מכרז: 28/26",12 שנות לימוד,
רכז/ת תוכנית לפיתוח כלכלי וחברתי למגזר החרדי,נהריה,נהריה,https://namerz.moin.gov.il/showexternal/55844/1,2026-06-29,2026-07-13,דת,רכז/ת תוכנית לפיתוח כלכלי וחברתי למגזר החרדי,אקדמאית / חילופית בהתאם לחוק; הנדסאי / טכנאי,
