title,company,location,url,date,deadline,department,description,requirements,position_type
תחשיבן,מטה יהודה,מטה יהודה,https://namerz.moin.gov.il/showexternal/55744/1,2026-06-25,2026-07-09,רווחה,רשות: מטה יהודה · מחוז: ירושלים · יחידה: רווחה · תחום: רווחה · רמת השכלה: אקדמאית / חילופית בהתאם לחוק · תאריך פרסום: 2026-06-25 · מועד הגשה: 2026-07-09 · מספר מכרז: 39/2026,אקדמאית / חילופית בהתאם לחוק,
ממונה בטיחות וגהות,בענה,בענה,https://namerz.moin.gov.il/showexternal/55761/2,2026-06-25,2026-07-09,ניהול כללי,רשות: בענה · מחוז: צפון · יחידה: ניהול כללי · תחום: ניהול כללי · דירוג: הנדסאים · רמת השכלה: אקדמאית / חילופית בהתאם לחוק · תאריך פרסום: 2026-06-25 · מועד הגשה: 2026-07-09 · מספר מכרז: 09-2026,אקדמאית / חילופית בהתאם לחוק,
אשכולות,חוף הכרמל,חוף הכרמל,https://namerz.moin.gov.il/showexternal/55767/2,2026-06-25,2026-07-09,אשכולות,"תיאור התפקיד : • ניהול והפעלת מערכת למידה בלתי פורמאלית במסגרת היחידה לקידום נוער ברשות המקומית. הלמידה מכוונת להשלמת השכלה פורמאלית ולהעשרה לבני נוער הנמצאים מחוץ למסגרת חינוכית פורמאלית. • איתור וריכוז נתונים על הנערים/ות הזקוקים/ות להשלמת השכלת יסוד בתיאום עם מנהל/ת היחידה לקידום נוער ברשות המקומית. אחראיות לאבחון הנערים/ות ולמיונם/ן על פי הרמות הלימודיות. אחראיות לקליטת בני/ות הנוער ולשילובם/ן בתוכנית היל""ה. אחריות להתאמת המסגרת הלימודית ולקביעת מקום הלימוד. • איתור וגיוס מורים/ות מתאימים/ות לאוכלוסיית הנערים/ות. הנחיית מורים/ות בנושא התכנים והשיטות הלימודיות. תכנון, ארגון וביצוע השתלמויות למורים/ות. פיקוח על עבודת המורים/ות ואישור דיווחיהם/ן. • אחריות על הפעלה נכונה של המשאבים העומדים לרשותו/ה. אחריות לקשר עם המנחים/ות להשכלה במשרד החינוך והקבלן הפדגוגי. לימוד בני/ות נוער באופן ישיר 2 שעות שבועיות בפועל, בשיתוף פעולה עם הממונים ברשות ובהתאם להנחיות ולמדיניות אגף א' לחינוך ילדים ובני נוער בסיכון, במשרד החינוך.",אקדמאית / חילופית בהתאם לחוק,
עובד סוציאלי,אשדוד,אשדוד,https://namerz.moin.gov.il/showexternal/55935/1,2026-06-25,2026-07-09,רווחה,רשות: אשדוד · מחוז: דרום · יחידה: רווחה · תחום: רווחה · דירוג: עוסים · רמת השכלה: אקדמאית / חילופית בהתאם לחוק · תאריך פרסום: 2026-06-25 · מועד הגשה: 2026-07-09 · מספר מכרז: 193-26,אקדמאית / חילופית בהתאם לחוק,
כלכלן/ית לאגף וטרינריה,רמלה,רמלה,https://namerz.moin.gov.il/showexternal/55729/2,2026-06-25,2026-07-09,שפע ותשתיות,כלכלן/ית לאגף וטרינריה-הארכה,אקדמאית / חילופית בהתאם לחוק; קורסים נוספים כמפורט בקובץ,
מנהל/ת מדור תכנית ניצנים במחלקת גני ילדים,רמלה,רמלה,https://namerz.moin.gov.il/showexternal/55730/2,2026-06-25,2026-07-09,חינוך,מנהל/ת מדור תכנית ניצנים במחלקת גני ילדים-הארכה,אקדמאית / חילופית בהתאם לחוק; הנדסאי / טכנאי; קורסים נוספים כמפורט בקובץ,
מנהל/ת מחלקת תכנון ועיצוב אורבני,רמלה,רמלה,https://namerz.moin.gov.il/showexternal/55731/2,2026-06-25,2026-07-09,שפע ותשתיות,מנהל/ת מחלקת תכנון ועיצוב אורבני-הארכה,אקדמאית / חילופית בהתאם לחוק; הנדסאי / טכנאי,
סגן מנהל מחלקה (הנדסה),רמלה,רמלה,https://namerz.moin.gov.il/showexternal/55736/2,2026-06-25,2026-07-09,הנדסה,"רשות: רמלה · מחוז: מרכז · יחידה: הנדסה · תחום: הנדסה · דירוג: 8-10 מנהלי /38-40 מח""ר/38-40 טכנאים הנדסאים · רמת השכלה: אקדמאית / חילופית בהתאם לחוק, הנדסאי / טכנאי, קורסים נוספים כמפורט בקובץ · תאריך פרסום: 2026-06-25 · מועד הגשה: 2026-07-09 · מספר מכרז: 23/26",אקדמאית / חילופית בהתאם לחוק; הנדסאי / טכנאי; קורסים נוספים כמפורט בקובץ,
רכז קהילה,רמלה,רמלה,https://namerz.moin.gov.il/showexternal/55745/2,2026-06-25,2026-07-09,נוער תרבות וספורט,רכז קהילה,אקדמאית / חילופית בהתאם לחוק; קורסים נוספים כמפורט בקובץ,
מרכז נושא קליטת עליה,רמלה,רמלה,https://namerz.moin.gov.il/showexternal/55749/2,2026-06-25,2026-07-09,רווחה,"רשות: רמלה · מחוז: מרכז · יחידה: רווחה · תחום: רווחה · דירוג: דרוג חינוך חברה וקהילה/ 37-39 דרוג המח""ר. **דרוג המשרה- בהתאם לכישורי המועמד · רמת השכלה: 12 שנות לימוד, אקדמאית / חילופית בהתאם לחוק, בגרות · תאריך פרסום: 2026-06-25 · מועד הגשה: 2026-07-09 · מספר מכרז: 27/26",12 שנות לימוד; אקדמאית / חילופית בהתאם לחוק; בגרות,
מנהל אגף כבישים ותשתיות,רמלה,רמלה,https://namerz.moin.gov.il/showexternal/55751/2,2026-06-25,2026-07-09,הנדסה,מנהל אגף כבישים ותשתיות -הארכה,אקדמאית / חילופית בהתאם לחוק,
פקח/ית עירוני/ית,רמלה,רמלה,https://namerz.moin.gov.il/showexternal/55752/2,2026-06-25,2026-07-09,חירום ובטחון,פקח/ית עירוני/ית-הארכה,12 שנות לימוד; בגרות,
פקח מסייע (שיטור עירוני),רמלה,רמלה,https://namerz.moin.gov.il/showexternal/55753/2,2026-06-25,2026-07-09,חירום ובטחון,רשות: רמלה · מחוז: מרכז · יחידה: חירום וביטחון · תחום: חירום ובטחון · דירוג: מנהלי 5-8 · רמת השכלה: 12 שנות לימוד · תאריך פרסום: 2026-06-25 · מועד הגשה: 2026-07-09 · מספר מכרז: 78/25,12 שנות לימוד,
מנהל מינהלת התחדשות עירונית,רמלה,רמלה,https://namerz.moin.gov.il/showexternal/55759/2,2026-06-25,2026-07-09,תוכניות לאומיות,"רשות: רמלה · מחוז: מרכז · יחידה: תוכניות לאומיות · תחום: תוכניות לאומיות · דירוג: 40-43 בדירוג הרלוונטי/ 60%-70% משכר מנכ""ל ( בכפוף לאישור משרד הפנים) · רמת השכלה: אקדמאית / חילופית בהתאם לחוק, הנדסאי / טכנאי · תאריך פרסום: 2026-06-25 · מועד הגשה: 2026-07-09 · מספר מכרז: 16/26",אקדמאית / חילופית בהתאם לחוק; הנדסאי / טכנאי,
מכרז פנימי/ חיצוני,טירת כרמל,טירת כרמל,https://namerz.moin.gov.il/showexternal/55747/1,2026-06-25,2026-07-09,חינוך,"מכרז פנימי/ חיצוני עובד סוציאלי MA / פסיכולוג/ית התפתחותי למרכז הפעו""ט מס' מכרז 2026-843 היקף משרה: כ-18 שעות שבועיות. כפיפות: מנהלת מרכז הפעו""ט. תיאור המשרה: עו""ס/פסיכולוג/ית התפתחותי/ת ליחידה להתפתחות הילד וליחידה הטיפולית המפעילה את סל הבריאות המקדם לילדים על הרצף התקשורתי בגיל הרך. תנאי סף: השכלה: תואר שני בעבודה סוציאלית/פסיכותרפיה/פסיכולוגיה התפתחותית ותעודה הכרה ממשרד הבריאות. בעל/ת רישיון הרשומים בפנקס העובדים הסוציאלים. ניסיון קודם בטיפול בגיל הרך- יתרון. דרישות נוספות: שפות - עברית ברמה שפת אם. כישורים אישיים • יצירתיות ויוזמה. • גמישות ויכולת עבודה מקצועית. • מודעות חברתית. • מוכנות להשקעה וצמיחה אישית ומקצועית. • נכונות ויכולת לעבודה עם קהל רחב ומגוון. • יכולת עבודה עם שירותים ומערכות שונות. • יכולת עבודה צוותי. • גמישות ויכולת עבודה בסביבה משתנה. תהליך הגשת מועמדות: 1. מועמד ימלא טופס הגשת מועמדות. 2. המועמד יקבל מייל עם קישור לאימות כתובת המייל שלו. 3. לאחר לחיצה על הקישור, הפניה תופיע במערכת (מועמד שלא ילחץ על הקישור, מועמדותו לא תוגש). מועד פרסום המכרז: 25/06/2026 בקשות למכרז יש להגיש באופן מקוון בלבד, עד לתאריך 09/07/2026 בשעה 10:00, בקישור הבא בצירוף כל המסמכים והאסמכתאות הרלוונטיות אשת הקשר לעניין מכרז זה: אליה לוי מייל: Elial@tirat-carmel.muni.il • קיימת אפשרות שהמועמדים יישלחו למבחן התאמה. • בהתאם לחוק שיווין זכויות לאנשים עם מגבלות תינתן העדפה במשרות הנ""ל למועמדים העונים על הגדרת החוק ועונים על דרישות התפקיד. • עדיפות תינתן למועמד המשתייך לאוכלוסייה הזכאית לייצוג הולם כשאינה מיוצגת כנדרש בקרב עובדי הרשות המקומית, אם המועמד הוא בעל כישורים דומים לכישוריהם של מועמדים אחרים. • קיימת הזכות למועמד עם מוגבלות לקבל התאמות הנדרשות לו מחמת מוגבלותו בהליכי הקבלה לעבודה. • לפי סעיף 173ב' לפקודת העירייה תינתן עדיפות למועמדים בני העדה האתיופית העונים על דרישות התפקיד. הבהרה מגדרית: המכרז נכתב בלשון זכר, אך פונה לגברים ולנשים כאחד",אקדמאית / חילופית בהתאם לחוק,
מכרז פנימי/ חיצוני,טירת כרמל,טירת כרמל,https://namerz.moin.gov.il/showexternal/55748/1,2026-06-25,2026-07-09,חינוך,"מכרז פנימי/ חיצוני פיזיותרפיסט.ית למרכז הפעו""ט מס' מכרז- 2026-844 היקף משרה: כ- 20 שעות שבועיות (חוזה מותנה מימון). כפיפות: מנהלת מרכז הפעו""ט. תיאור המשרה: פיזיותרפיסטית ליחידה להתפתחות הילד וליחידה הטיפולית המפעילה את סל הבריאות המקדם לילדים על הרצף התקשורתי בגיל הרך. תנאי סף: השכלה: תואר ראשון במקצוע. תעודת הכרה ממשרד הבריאות. למחלקת הטב""מ אפשרות להעסקת סטודנט/ית שנה ג' או ד'. דרישות נוספות: שפות - עברית ברמה שפת אם. כישורים אישיים • יצירתיות ויוזמה. • גמישות ויכולת עבודה מקצועית. • מודעות חברתית. • מוכנות להשקעה וצמיחה אישית ומקצועית. • נכונות ויכולת לעבודה עם קהל רחב ומגוון. • יכולת עבודה עם שירותים ומערכות שונות. • יכולת עבודה צוותי. • גמישות ויכולת עבודה בסביבה משתנה. תהליך הגשת מועמדות: 1. מועמד ימלא טופס הגשת מועמדות. 2. המועמד יקבל מייל עם קישור לאימות כתובת המייל שלו. 3. לאחר לחיצה על הקישור, הפניה תופיע במערכת (מועמד שלא ילחץ על הקישור, מועמדותו לא תוגש). מועד פרסום המכרז: 25/06/2026 בקשות למכרז יש להגיש באופן מקוון בלבד, עד לתאריך 09/07/2026 בשעה 10:00, בקישור הבא בצירוף כל המסמכים והאסמכתאות הרלוונטיות אשת הקשר לעניין מכרז זה: אליה לוי מייל: Elial@tirat-carmel.muni.il • קיימת אפשרות שהמועמדים יישלחו למבחן התאמה. • בהתאם לחוק שיווין זכויות לאנשים עם מגבלות תינתן העדפה במשרות הנ""ל למועמדים העונים על הגדרת החוק ועונים על דרישות התפקיד. • עדיפות תינתן למועמד המשתייך לאוכלוסייה הזכאית לייצוג הולם כשאינה מיוצגת כנדרש בקרב עובדי הרשות המקומית, אם המועמד הוא בעל כישורים דומים לכישוריהם של מועמדים אחרים. • קיימת הזכות למועמד עם מוגבלות לקבל התאמות הנדרשות לו מחמת מוגבלותו בהליכי הקבלה לעבודה. • לפי סעיף 173ב' לפקודת העירייה תינתן עדיפות למועמדים בני העדה האתיופית העונים על דרישות התפקיד. הבהרה מגדרית: המכרז נכתב בלשון זכר, אך פונה לגברים ולנשים כאחד",אקדמאית / חילופית בהתאם לחוק,
