title,company,location,date,url,department,workplace_type,description,source
מבקר/ת איכות עסיס קבוצת אסם נסטלה,Osem-Nestlé,Kibbutz Beit HaShita,2026-06-10,https://www.osem-nestle.co.il/career/open-positions/400609,טכנולוגיה ואיכות,fulltime,"מפעל אסם בבית השיטה מגייס מבקר/ת איכות לתפקיד שכולל: הדרכת עובדי הייצור ובקרה על עבודה על פי עקרונות אבטחת איכות המוצר בקרה בתהליך על איכות ובטיחות המוצרים המיוצרים בקווי הייצור בהתאם למפרטים, תוכניות ביקורת והוראות עבודה. בקרה ואחריות על נקודות קריטיות לפי תכניות HACCP ניתוח אירועים חריגים שמקורם בכשל בבקרת איכות בתהליך וגיבוש פעולות מתקנות חסימת מוצרים שאינם עומדים במפרטים ובתוכניות הביקורת ביצוע הדרכות איכות ובטיחות מזון לעובדי ייצור בדיקות מים ואוויר, דיגום ידיים ואישור ניקיונות ודיגום שטח ביצוע בדיקות מעבדה : בדיקות חומר במגרשים, בדיקות בתהליך , בדיקות תוצ""ג עפ""י תקנים והוראות עבודה השתתפות בישיבות תפעוליות יומיות דרישות התפקיד הנדסאי/ת או תעודה בתחום– יתרון ידע וניסיון קודם בבקרת איכות במפעל תעשייתי דומה- חובה אנגלית ברמה בסיסית שליטה טובה בשפה עברית (דיבור, קריאה וכתיבה) שליטה ב excel- חובה נכונות לעבודה במשמרות (משמרת בוקר + משמרת ערב) + נכונות לשעות נוספות במידת הצורך המשרה בקיבוץ בית השיטה, נדרשת הגעה עצמאית",osem
מחסנאי/ת למערך ההפצה בבאר שבע,Osem-Nestlé,Beer Sheva,2026-06-10,https://www.osem-nestle.co.il/career/open-positions/400607,שרשרת אספקה ורכש,fulltime,"תיאור התפקיד
ביצוע עבודות מלגזה במחסן
פריקה והעמסת סחורה
סידור ומיון משטחים ריקים
סדר וניקיון
קבלת וטיפול בנהגים
עדכון ומילוי דוחות הזנת נתונים ועדכון במערכת
דרישות התפקיד
רישיון נהיגה- חובה
רישיון על מלגזה- חובה
ניסיון בתפקיד דומה- יתרון
ידע בתוכנת OFFICE - חובה
העבודה באזור תעשיה עמק שרה באר שבע- הגעה עצמאית משרה מלאה, שעות עבודה 05:30-14:30 (נכונות לעבודה במשמרת ערב במידת הצורך)",osem
מחסנאי/ת טכני בונז'ור,Osem-Nestlé,Kiryat Gat,2026-06-10,https://www.osem-nestle.co.il/career/open-positions/400438,שרשרת אספקה ורכש,fulltime,"מפעל בונז'ור מגייס מחסנאי/ת  למחסן הטכני לתפקיד שכולל
ניהול וביצוע של חלקי חילוף באחזקה
קבלה למלאי ניפוק חלקי חילוף
עבודה מול מערכת SAP
ביצוע ספירות מלאי תקופתיות (אחת לחודש)
עבודה מול ספקים לשמירת רציפות מלאי למחסן
ביצוע ביקורות תקופתיות לציוד כיבוי אש
נסיעות לספקים לפי הצורך, להבאת חלקי חילוף דחופים
דרישות התפקיד:",osem
QA Manager Sderot- Osem Sderot,Osem-Nestlé,Sderot,2026-06-10,https://www.osem-nestle.co.il/career/open-positions/399857,טכנולוגיה ואיכות,fulltime,Job Description,osem
מנהל/ת מערכות איכות זמני/ת אתר אסם נסטלה בשדרות,Osem-Nestlé,Sderot,2026-06-10,https://www.osem-nestle.co.il/career/open-positions/398773,טכנולוגיה ואיכות,fulltime,"תיאור התפקיד
ניהול מערכות איכות חוצי מפעל
ניהול וניתוח מדדי איכות
בחינת אפקטיביות התהליכים  והטמעת נהלים חדשים
ניהול פרויקטים חוצי מפעל בתחום האיכות
ייזום פעולות ותהליכים לשיפור המדדים ומעקב לאחר ביצועם.
סקרי הנהלה – איסוף נתונים, ניתוח והכנת סקר ההנהלה
הכנת המפעל למבדקים חיצוניים
בקרת נהלי נסטלה ניהול כפיפות של עובד איכות אחד
דרישות התפקיד
בוגר/ת אקדמאי/ת במדעי החיים, הנדסת מזון, טכנולוגיה של מזון, הנדסה כימית, הנדסה תעשיה וניהול- חובה ניסיון של עד שנתיים בתעשייה- חובה
אנגלית ברמה טובה מאוד
נכונות למשרה זמנית, החלפה לחופשת לידה.
המשרה באתר שדרות",osem
חשמלאי/ת עבור מחלקת תשתיות במפעל אסם נסטלה בשדרות,Osem-Nestlé,Sderot,2026-06-10,https://www.osem-nestle.co.il/career/open-positions/398772,הנדסה,fulltime,"תיאור התפקיד
טיפול בחריגות ותקלות וביצוע פעולות מתקנות ומעקב אחריהן על מנת לוודא טיפול מוצלח וארוך טווח
אחריות על מערכות חשמל ותיקון תקלות במחלקת תשתיות.
אחריות על תפעול תקין של מערכות המיזוג וקירור.
אחריות על ביצוע תוכניות עבודה ועדכונם באופן שוטף .
אחריות על קריאת מוני חשמל מפעליות .
דיווח במערכות אחזקה מפעליות 03 PM
תפעול שוטף וטיפול בתקלות בכל המערכות שצורכות חשמל במפעל (מתקן שפכים, מדחסים, מיזוג וכדומה).
דרישות התפקיד
הנדסאי/ת חשמל בעל ניסיון בתעשייה
ידע במערכות מיזוג וקירור תעשייתיים- יתרון
טכנאי/ת מיזוג וקירור - יתרון
ידע ויכולת עבודה במחשבים ותוכנות אקסל , וורד , ו – SAM .
אנגלית ברמה בסיסית
נדרשת הגעה עצמאית / קיים מערך הסעות שעות המשרה- 06:15 – 15:15 ימים א-ה יום ו' לסירוגין, נכונות לשעות נוספות , זמינות לקריאות חובה
תורנות שבועית לשעות אחה""צ במחלקה עד לשעה 18:45 .",osem
מנהל/ת trade assets נסטלה פרופשיונאל אסם נסטלה,Osem-Nestlé,Hevel Modiin,2026-06-10,https://www.osem-nestle.co.il/career/open-positions/397643,אדמיניסטרציה,fulltime,"תיאור התפקיד
ניהול מקיף על ציוד (רכש, אחזקה, ניהול שוטף)
ניהול מצאי ה- Trade Asset (מכונות למיניהן), ביצוע מעקב ובקרה כלכלית
עבודה שוטפת מול ספקים ואחריות על יבוא הציוד לארץ
ביצוע בקרת תקציב - הוצאות דוחות שוטפים ובחינת מדדים חודשיים
דיווחים ותקשורת שוטפת מול נסטלה העולמית ומטה הארצי
קשר עם ספקי שירות ושליטה באפקטיבית ציודים
ניהול עובדים
פיקוח וביצוע עבודה על פי נהלי Nestle
דרישות התפקיד
השכלה אקדמית - חובה (הנדסה/ כלכלה/ לוגיסטיקה - יתרון)
ניסיון של שנתיים בתחומי לוגיסטיקה ורכש - חובה
ניסיון קודם עבודה על מערכות ממוחשבות - חובה
אוריינטציה חזקה למספרים
תפסיה שירותית גבוהה, סדר וארגון
עבודה מרובת ממשקים (שטח, ספקי שירות, רכש, מכס ועוד...) - כולל ממשקים בינלאומיים
היכרות עם מערכות SAP - יתרון משמעותי
אנגלית ברמה גבוהה - חובה
העבודה באזור תעשיה חבל מודיעין שוהם",osem
מכונאי/ת אחזקה מפעל אסם יקנעם,Osem-Nestlé,Yokneam,2026-06-10,https://www.osem-nestle.co.il/career/open-positions/394320,טכני וייצור,fulltime,מפעל אסם יקנעם מחפש מכונאי/ת אחזקה לתפקיד שכולל: ביצוע אחזקה מונעת וחזויה למכונות אריזה והייצור ע''פ תכנון מנהל המחלקה. מתן פתרונות יעילים ומהירים לתקלות שבר ברצפת הייצור. ייזום רעיונות כל אחד בתחום המכונות עליו הוא אחראי. לימוד מתמיד של המכונה וביצועיה. תיעוד ורישום בתוכנת ERP (SAP). ביצוע והשתתפות בפרויקטים. ביצוע והשתתפות בלמידות ותחקירי תקלה. עבודה בהתאם לדרישות בטיחות ואיכות במפעל. דרישות התפקיד: טכנאי/ת הנדסאי/ת מכונות- יתרון ניסיון כעובד אחזקה במכונות אריזה וייצור- חובה עבודת צוות יישומי מחשב ברמה טובה נכונות לעבודה במשמרות אנגלית טכנית ידע במצוינות תפעולית - יתרון.,osem
"מזכיר/ה ללשכת מנכ""ל קבוצת אסם נסטלה",Osem-Nestlé,Hevel Modiin,2026-06-10,https://www.osem-nestle.co.il/career/open-positions/394386,אדמיניסטרציה,fulltime,"קבוצת אסם נסטלה מגייסת מזכיר/ת לשכת מנכ""ל תפקיד משמעותי בלב העשייה הארגונית, המשלב אחריות, יוזמה וניהול משימות מקצה לקצה . זוהי הזדמנות להצטרף לצוות הלשכה ולהיות בתפקיד תפעולי, מרכזי לצד תמיכה שוטפת במנהלת הלשכה.
תחומי אחריות
דרישות התפקיד",osem
מנהל/ת תחום תזונה קבוצת אסם-נסטלה,Osem-Nestlé,Hevel Modiin,2026-06-10,https://www.osem-nestle.co.il/career/open-positions/393319,טכנולוגיה ואיכות,fulltime,"קבוצת אסם נסטלה מגייסת מנהל/ת תחום תזונה לתפקיד שמטרתו בנייה ויישום אסטרטגיה בתחום התזונה, הבריאות ואיכות החיים בקבוצת אסם-נסטלה תוך הגדרת סדרי עדיפויות לפיתוח מוצרים וביסוס פורטפוליו תומך בהצעות מזון טעימות, בריאות ובנות-קיימא, במטרה לעורר השראה בקרב קהילות ובעלי עניין לאמץ אורח חיים מאוזן ומיטיב. במסגרת התפקיד: שותפות בבניית והטמעת אסטרטגית התזונה והבריאות במטרה להניע צמיחה עסקית ולחזק את המוניטין של המותגים. הובלת פורום תזונה לקידום יוזמות בתחום התזונה, הבריאות ואיכות החיים, תוך דגש על  פיתוח, שיווק וצריכה של מוצרים טעימים, בריאים וטובים יותר לסביבה. זיהוי הזדמנויות צמיחה בשוק והבאת ידע מהעולם להטמעה בארגון בצורה אפקטיבית הובלת מהלכי תקשורת שיביאו לידי ביטוי את המומחיות הארגונית בתחום התזונה. ניהול ההסברה התקשורתית סביב עולמות התזונה עבור מותגי הליבה של הקבוצה. גיבוש ויישום תכנית עבודה להטמעת ערכים מכווני תזונה בקרב עובדי החברה. להיות אוטוריטה בתחום התזונה, לקדם שיתופי פעולה עם מובילי דעה בתחום. שכלול תחום הדוברות מטעם הארגון, תוך שמירה על אמינות ומקצועיות. חיזוק היכולות והידע של קהילת השיווק בעולמות התזונה והבריאות בהתאמה לערכי נסטלה הבטחת מוכנות לעמידה ברגולציות המזון בישראל ובגלובל. להיות איש קשר מול חברת האם נסטלה להבטחת הטמעה של תוכניות ויוזמות גלובליות. דרישות התפקיד תואר ראשון במדעי התזונה/דיאטטיקה או תחום מדעי־חיים עם התמחות תזונתית. תואר שני- יתרון ניסיון של לפחות 10 שנים בתחום התזונה, מתוכם 5 שנים כמנהל/ת תזונה בארגון גלובלי גדול / בארגון בריאות ציבורי ידע ויכולת מוכחת בפיתוח מותגים ועסקים המעודדים התנהגות בריאה ניסיון בעבודת הסברה/אדווקציה או שיתוף פעולה עם מובילי דעה (KOLs) בתחומי תזונה, בריאות או Wellness. יכולת מוכחת להתנהלות בסביבה עסקית מורכבת וניהול ממשקים מרובים. הבנה שיווקית, היכרות עם אסטרטגיות בניית מותגים- יתרון משמעותי אנגלית ברמה מעולה מטה החברה ממוקם באזור תעשיה חבל מודיעין, שוהם.",osem
אחראי/ת אפליקציה מסחרית ושיווקית אסם סחר,Osem-Nestlé,Hevel Modiin,2026-06-10,https://www.osem-nestle.co.il/career/open-positions/393855,שיווק,fulltime,"רכז / ת אפליקציה מסחרית ושיווקית
רוצה להיכנס לחברה בינלאומית לעולם הדיגיטל , הסחר והשיווק ולהיות בלב העשייה ? מחפש / ת תפקיד עם השפעה אמיתית , למידה יומיומית ועבודה עם מותגים מובילים ? זה המקום שלך .
אנו מחפשים רכז / ת אפליקציה מסחרית ושיווקית עם ראש מסחרי וסקרנות גבוהה , שיצטרפו אלינו לתפקיד חדש , דינמי ומלא עניין – ניהול ופיתוח אפליקציית B2B מתקדמת שמניעה מכירות וחוויית לקוח .
במסגרת התפקיד : ניהול ותפעול שוטף של אפליקציית B2B, קידום מבצעים ותוכן , אחריות על הקטלוג הדיגיטלי , ניתוח נתונים , שיפור חוויית משתמש ועבודה שוטפת מול IT וממשקים נוספים .
מה חשוב לנו שתביא / י ?",osem
מכונאי/ת שדרות,Osem-Nestlé,Sderot,2026-06-10,https://www.osem-nestle.co.il/career/open-positions/368271,טכני וייצור,fulltime,"תיאור התפקיד
ביצוע אחזקה מתוכננת ושבר למכונות אריזה וייצור בדגש על מניעת תקלות.
מתן פתרונות יעילים ומהירים לתקלות ברצפת הייצור יתרון ידע בתחום הבקרה.
מתן שרות למחלקות הייצור.
העברת הדרכות בטיחות לעובדים חדשים ומתן הרשאה לעבודה במכונות.
דיווח פקודות עבודה במערכת ממוחשבת.
דרישות התפקיד
ניסיון בתעשייה יצרנית בתפקיד דומה- חובה
היכרות עם מכונות אריזה, יצור, משאבות, קיטור וכו... – יתרון
רקע במסגרות/רתכות- יתרון
ידע בשימוש במחשב, תוכנות OFFICE
נכונות לעבודה במשמרות
קיים מערך הסעות",osem
חשמלאי/ת מוסמכ/ת מפעל אסם נסטלה בשדרות,Osem-Nestlé,Sderot,2026-06-10,https://www.osem-nestle.co.il/career/open-positions/392492,טכני וייצור,fulltime,"תיאור התפקיד
ביצוע טיפול מונע במערכות החשמל
אחריות על תיעוד פעולות וממצאים במערכות
הובלת שיפורים ויישומם
קריאת שרטוטים
עבודה על פי מתודולוגית נסטלה
עבודה בהתאם לסטנדרטיזציה ונהלי המפעל
דרישות התפקיד
חשמלאי/ית מוסמך- חובה
ניסיון בתפקיד דומה בתעשייה- חובה
ידע במחשוב ובקרה- יתרון
ידע והיכרות עם חוק החשמל
בעל כישורי מחשב ידע בתוכנות בסיסיות , Excel, WORD, PP .
נכונות לעבודה במשמרות",osem
מתכנן/ת ייצור בונז'ור,Osem-Nestlé,Kiryat Gat,2026-06-10,https://www.osem-nestle.co.il/career/open-positions/389851,שרשרת אספקה ורכש,fulltime,"מפעל בונז'ור מגייס מתכנן/ת ייצור למחלקת שרשרת אספקה, במסגרת התפקיד
ניהול תכנית הייצור- בניית תוכנית עבודה יומית ושבועית המאזנת בין עמידה ביעדי מכירות לבין אילוצי ייצור (כוח אדם, זמינות קווים וחומרי גלם)
ניהול ומדיניות מלאי- אחריות על זמינות מוצרים מוגמרים, תוך הקפדה על צמצום השמדות חומרי גלם
ניהול אילוצים דינמיים- עבודה שוטפת מול סביבה משתנה, הבנה של יכולות הייצור והתנאים בשטח ותרגומם ללו""ז בר ביצוע
בקרה ושיפור תהליכים- ניתוח ביצוע מול תכנון , הובלת תהליכי התייעלות תכנוניים ושיפור קיבולות הייצור
ניתוח ביקושים- עבודה מול מטה החברה וחטיבת השיווק בנושא זה
דרישות התפקיד :
תואר בהנדסת תעשייה וניהול – חובה
מינימום 3 שנות ניסיון בתפקיד דומה או תפקיד אנליטי – חובה
שליטה ביישומי Office רמה גבוהה מאוד ב- EXCEL (יינתן מבדק בנושא) – חובה
ניסיון בעבודה עם מערכות ERP – חובה, SAP – יתרון
משרה מלאה עם נכונות לשעות נוספות במידת הצורך",osem
מפעיל/ה קו טבעול צבר,Osem-Nestlé,Kiryat Gat,2026-06-10,https://www.osem-nestle.co.il/career/open-positions/388700,,,,osem
מלגזן/ית מחסנאי/ת צבר,Osem-Nestlé,Kiryat Gat,2026-06-10,https://www.osem-nestle.co.il/career/open-positions/388703,,,,osem
מנהל/ת  משמרת צבר טבעול קרית גת,Osem-Nestlé,Kiryat Gat,2026-06-10,https://www.osem-nestle.co.il/career/open-positions/385812,,,,osem
טכנולוג/ית איכות למחלקת חטיפים אתר אסם נסטלה בשדרות,Osem-Nestlé,Sderot,2026-06-10,https://www.osem-nestle.co.il/career/open-positions/384070,,,,osem
נציג/ה למרכז המכירות של אסם סחר,Osem-Nestlé,Kiryat Gat,2026-06-10,https://www.osem-nestle.co.il/career/open-positions/382719,,,,osem
ראש צוות מרכז המכירות של אסם סחר בקרית גת,Osem-Nestlé,Kiryat Gat,2026-06-10,https://www.osem-nestle.co.il/career/open-positions/382985,,,,osem
מלגזן/ית לוגיסטיקה,Osem-Nestlé,Hevel Modiin,2026-06-10,https://www.osem-nestle.co.il/career/open-positions/382856,,,,osem
מנהל/ת צובר לוגיסטיקה,Osem-Nestlé,Hevel Modiin,2026-06-10,https://www.osem-nestle.co.il/career/open-positions/382648,,,,osem
חשמלאי/ת ראשי/ת שדרות,Osem-Nestlé,Sderot,2026-06-10,https://www.osem-nestle.co.il/career/open-positions/374986,,,,osem
מפעיל/ה קו מטרנה,Osem-Nestlé,Maabarot,2026-06-10,https://www.osem-nestle.co.il/career/open-positions/359705,,,,osem
