title,company,location,date,url,department,workplace_type,description,source
פקיד/ה למחסן החזרות למרכז הלוגיסטי,Osem-Nestlé,Hevel Modiin,2026-06-22,https://www.osem-nestle.co.il/career/open-positions/406814,אדמיניסטרציה,fulltime,"המרכז הלוגיסטי של שוהם מגייס פקיד/ה למחסן החזרות לתפקיד שכולל: עבודות משרדיות שונות
הוצאת דוחות יומיים
תיוקים וסגירת תיקים
עבודות משרדיות שונות
זיכוי לקוחות
מענה ומתן שירות ללקוחות פנים
דרישות התפקיד
ניסיון של כשנה בתפקיד אדמיניסטרטיבי דומה – חובה
שליטה ביישומי OFFICE – חובה
תודעת שירות גבוהה
נכונות לעבודה במשרה מלאה, שישי לפי צורכי עבודה (07:00-16:00)
העבודה בשוהם, אזור תעשיה חבל מודיעין- הגעה עצמאית",osem
טכנולוג/ית קו מפעל שדרות,Osem-Nestlé,Sderot,2026-06-22,https://www.osem-nestle.co.il/career/open-positions/407019,טכנולוגיה ואיכות,fulltime,"מפעל אסם נסטלה בשדרות מגייס טכנולוג/ית קו לתפקיד שכולל
דרישות התפקיד:
תואר ראשון באחד מהתחומים הבאים : טכנולוג מזון/הנדסת ביוטכנולוגיה/הנדסת כימיה.
ניסיון בתעשיית המזון/התרופות כטכנולוג קו/טכנולוג פיתוח/מהנדס תהליך – יתרון
ניסיון וידע עם מערכות מחשוביות – OFFICE
ניסיון בעבודה עם מערכות בקרה ומערכות ERP – יתרון
הבנה מעמיקה בתהליכים תרמיים וייצור רציף – יתרון
הבנה בתהליכי CIP וניקיון קווים – יתרון
נדרשת הגעה עצמאית נכונות לעבוד מעבר לשעות העבודה וזמינות מלאה במקרים של תקלות טכנולוגיות במהלך היממה.",osem
נציג/ת מכירות ONP,Osem-Nestlé,Kiryat Gat,2026-06-22,https://www.osem-nestle.co.il/career/open-positions/407056,כספים,fulltime,"חטיבת אסם נסטלה Professional מגייס/ת נציג/ת מכירות למוקד בקרית גת
חטיבת אסם נסטלה Professional מגייס/ת נציג/ת מכירות למוקד בקרית גת !
במסגרת התפקיד:
עמידה ביעדי מכירות לפי יעדי החטיבה
עמידה ביעדים מבצעים ומרתונים
עמידה ביעדי תפעוליים כגון שגרות משמרת
ניהול קשר פרואקטיבי עם ממשקים בתוך ומחוץ לארגון
עבודה על פי מלאים, הקצאות ומוצרים אל מול ממשקים בקשרי לקוחות
עבודה שוטפת מול מערכת ממוחשבת
דרישות התפקיד:
ניסיון קודם במכירות / טלמרקטינג – חובה
שליטה ביישומי OFFICE
אנגלית ברמה טובה
נכונות למשרה זמנית
המשרה בקרית גת (סמוך לתחנת הרכבת) נדרשת הגעה עצמאית",osem
Marketing Data Analyst חברת נספרסו,Osem-Nestlé,Petah Tikva,2026-06-22,https://www.osem-nestle.co.il/career/open-positions/406629,שיווק,fulltime,"נספרסו מגייסת Marketing Data Analyst החלפה לחל""ד
תפקיד מרכזי בהנעת החלטות שיווקיות מבוססות דאטה – משלב הבנת התנהגות הלקוחות ועד השפעה ישירה על ביצועים . תיאור התפקיד :
:דרישות התפקיד",osem
מנהל/ת משמרת צבר,Osem-Nestlé,Kiryat Gat,2026-06-22,https://www.osem-nestle.co.il/career/open-positions/406731,טכני וייצור,fulltime,"מנהל/ת משמרת למפעל טבעול-צבר בקרית גת אסם נסטלה
מפעל סלטי צבר בקרית גת מגייס מנהל/ת משמרת, במסגרת התפקיד:
ניהול עובדים באופן אישי ומקצועי במהלך משמרת
חניכה, הכשרה והסמכת צוות עובדים
הובלת שיפור מתמיד
אחריות על עמידה בתוכנית הייצור
טיפול בחריגים וסיוע בפתרון תקלות לעובדים
ניהול  ישיר של כ-20 עובדים
הטמעת תהליכים ברצפת הייצור ומול מחלקות תומכות
דרישות התפקיד
הנדסאי/ת תעשיה וניהול/מכונות- יתרון משמעותי
ניסיון בתפקיד דומה בסביבה תהליכית- חובה
ניסיון ניהולי – חובה!
נכונות לעבודה במשמרות (3 משמרות)
הגעה עצמאית",osem
ראש/ת צוות אחזקה יקנעם,Osem-Nestlé,Yokneam,2026-06-22,https://www.osem-nestle.co.il/career/open-positions/406567,טכני וייצור,fulltime,"מפעל אסם יקנעם מגייס ראש צוות אחזקה לתפקיד שכולל
ניהול אחזקה של מכונות ייצור, אריזה ותשתיות כולל אחריות כוללת לפתרון תקלות
ניהול צוות מכונאים ומסגרים
חונכות מכונאים חדשים, העברת ידע והדרכת עובדים במחלקות הייצור.
ייזום וביצוע שיפורים בקווי ייצור ותשתיות ע''פ הצורך
ערנות ומענה לצרכים משתנים של מנהלי המחלקות ברצפת הייצור
תכנון ואחריות לבניית מתקנים עבור מוצרים חדשים.
ידע טכני, ידע במערכות תהליך, ואקום, משאבות, פנאומטיקה, מכשור ובקרה, שרטוט טכני.
איכות, בטיחות ואיכות סביבה
הובלת MWG כחלק מתהליך מצוינות תפעולית באחזקה.
דרישות התפקיד
השכלה- טכנאי/ת או הנדסאי/ת מכונות/חשמל 3 שנות ניסיון לפחות כראש צוות אחזקה- חובה!
5 שנות ניסיון לפחות במכונות ייצור ואריזה
ניסיון בניהול פרויקטים- יתרון
הכרת מחשב בסיסית.
ידיעת אנגלית טכנית.
הכרת מערכות ERP
נכונות למשרה מלאה כולל שעות נוספות וזמינות בשעות העבודה של המפעל (24/6).",osem
מנהל/ת שרשרת אספקה בונז'ור,Osem-Nestlé,Kiryat Gat,2026-06-22,https://www.osem-nestle.co.il/career/open-positions/406068,שרשרת אספקה ורכש,fulltime,"מפעל בונז'ור מגייס מנהל/ת שרשרת אספקה
ני הול שרשרת האספקה המפעלית הכוללת - תכנון, רכש, לוגיסטיקה.
תכנון - תכנון כלל הייצור במפעל ותיאום מול כל הגורמים. יצירת אינטגרציה בין צרכי השיווק והסחר לבין מערכי הייצור במפעל.
לוגיסטיקה – אחראי על מנהל המחסנים ואחריות על המחלקה
רכש - ניהול קנייני רכש בתחום חומרי גלם, חומרי אריזה ושירותים נצרכים הניהול כולל: מעקב על יישום תוכניות היצור ועמידה בתוכנית אספקות שמירה על בטיחות ופעולה במסגרת המדיניות הפרואקטיבית למניעת תאונות. התנהלות מול ממשקים מרובים פנים וחוץ מפעליים, כולל רכש מרכזי, תכנון מטה, ספקים ועוד. ניהול ובקרה של תוכניות עבודה חבר/ת הנהלה, בכפיפות למנהל המפעל
דרישות התפקיד:
תואר ראשון רלוונטי –  חובה
ניסיון של לפחות 5 שנים בתעשייה בתפקיד בתכנון / שרשרת אספקה - חובה
ניסיון ניהולי קודם - חובה
אנגלית ברמה גבוהה
המפעל ממקום בקרית גת",osem
מנהל/ת מצוינות תפעולית בונז'ור,Osem-Nestlé,Kiryat Gat,2026-06-22,https://www.osem-nestle.co.il/career/open-positions/405829,שרשרת אספקה ורכש,fulltime,"מפעל בונז'ור מגייס מנהל/ת מצוינות תפעולית זמני/ת לתפקיד מרתק שכולל
הובלת תהליכי שיפור מתמיד בכל פעילויות המפעל תוך יישום מתודולוגיות מתקדמות לצמצום הפסדים במפעל ולפתרון בעיות .
הובלת הטמעת מערכת DMO במפעל (מערכת MES )
הבנת הצרכים העסקיים בטווח הקצר והארוך.
הובלת מהלכים אסטרטגים לתוכנית רב שנתית/שנתית, השגת יעדים ותוצאות המפעל תוך הנעת מנהלים ועובדים.
הובלת תהליכי מצוינות ופרויקטי שיפור.
הדרכה וחניכה של הקבוצות בתחומים השונים. הטמעה ויישום כלי בקרה בתהליך.
ניהול תקנים ברצפת הייצור וזיהוי צווארי בקבוק בתהליך.
התפקיד בכפיפות למנהל מפעל וחבר הנהלת מפעל
דרישות התפקיד
מהנדס/ת תעשיה וניהול – יתרון משמעותי,  או תואר רלבנטי אחר - חובה
ניסיון בתפקיד דומה – חובה.
הכרה מעמיקה של מתודולוגיות הנדסת ייצור
ניסיון בשיפור תהליכים (מתודולוגיות 6sigma, KAIZEN )
ניסיון מוכח בהובלת שינוי ובהדרכה/חניכה
ניסיון במערכות SAP ומערכות בקרת תהליך – יתרון משמעותי
שליטה מלאה ביישומי OFFICE
יכולות ניתוח נתונים ואנליטיות ברמה גבוהה. אנגלית ברמה גבוהה המשרה בקרית גת",osem
סטודנט/ית למשרה זמנית במחלקת אריזות,Osem-Nestlé,Hevel Modiin,2026-06-22,https://www.osem-nestle.co.il/career/open-positions/405602,הנדסה,fulltime,"מחלקת אריזות של קבוצת אסם נסטלה מגייסת סטודנט/ית
לתפקיד שבמסגרתו:
עדכון ובנייה של מפרטי אריזות בגלוב ( SAP )
תמיכה במהנדסי המחלקה בנושאי מפרטים
ניתוח נתוני אריזות ע""י שימוש בפונקציות אקסל איסוף נתונים מול מאגרי המידע ומול הספקים
עבודה שוטפת מול ממשקים (מהנדסים, ספקים)
דרישות התפקיד
סטודנט/ית להנדסה או תואר רלוונטי אחר בשנה ב' לפחות (יתרת לימודים של שנה- חובה)
עבודה עצמאית, דיוק, סדר, וארגון
תקשורת בינאישית טובה, תודעת שירות
ניסיון בעבודה עם אקסל ויישומי מחשב ( Teams, Outlook, SAP - יתרון)
זמינות לחצי משרה (2-3 ימים בשבוע)
אנגלית ברמה טובה מאוד
העבודה במטה אסם נסטלה בשוהם, נדרשת הגעה עצמאית",osem
סטודנט/ית לתפקיד בתחום People Analytics וDATA במשאבי אנוש,Osem-Nestlé,Hevel Modiin,2026-06-22,https://www.osem-nestle.co.il/career/open-positions/405603,משאבי אנוש,fulltime,"אנו מחפשים סטודנט/ית לתפקיד בתחום People Analytics ו DATA במשאבי אנוש . התפקיד מהווה הזדמנות להשתלב בעולם ה -HR Data ולרכוש ניסיון מעשי בניהול וניתוח נתונים ארגוניים, תוך עבודה מול ממשקים מקומיים וגלובליים .
תחומי אחריות
• סיוע בניהול ותחזוקת מבנה ארגוני ונתוני משרות במערכות HR ( כגון SuccessFactors). • תמיכה בבקרות איכות נתונים ועדכון נתונים שוטף . • סיוע בניהול קטלוג המשרות בהתאם להנחיות גלובליות . • הפקת דוחות וניתוח נתונים • תמיכה בתהליכי תגמול שנתיים (הזנות נתונים, בדיקות, בקרה) . • השתתפות בפרויקטי HR ודאטה, כולל יישום הנחיות גלובליות . • עבודה מול גורמים שונים בארגון בארץ ובחו""ל . • תמיכה ביוזמות HR נוספות ובשינויים ארגוניים .
דרישות התפקיד • סטודנט/ית לתואר ראשון (לפחות שנה ב'- יתרת לימודים של שנה!) בתחומים רלוונטיים: סטטיסטיקה, כלכלה, מנהל עסקים, מערכות מידע, הנדסה תעשייה וניהול או תחום דומה . • זיקה לעבודה עם נתונים ועניין בתחום People Analytics / HR Data. • שליטה טובה ב Excel (כולל פונקציות) • יכולת אנליטית, דיוק וירידה לפרטים . • אנגלית ברמה טובה (קריאה, כתיבה ודיבור) .",osem
מנהל/ת לקוחות לאזור דרום,Osem-Nestlé,Beer Sheva,2026-06-22,https://www.osem-nestle.co.il/career/open-positions/404797,מכירות,fulltime,"אסם נסטלה פרופשיונאל, החטיבה המקצועית של קבוצת אסם, מחפשת מנהל/ת לקוחות לאזור באר שבע והסביבה עם רעב להצלחה, מוטיבציה ויכולת לזהות ולמקסם הזדמנויות.
אם יש לך דרייב אמיתי למכירות, יכולת לבנות קשרים מעולים עם לקוחות, ותשוקה לסגירת עסקאות בשטח, אנחנו רוצים אותך איתנו!
מה התפקיד כולל?
עמידה ביעדים והובלת מכירות בהתאם לדרישות עסקיות
ניהול סחר מול הלקוחות בהתאם למדיניות
זיהוי הזדמנויות למוצרים חדשים והגדלת נפח הפעילות
איתור וגיוס לקוחות חדשים בשטח
בנייה וטיפוח קשרים ארוכי טווח עם לקוחות
ממשק עבודה צמוד עם נציגת מכירות טלפוני: להבטיח קיום ביצוע הזמנות, טיפול שוטף מול הלקוח
שיתוף פעולה עם צוות המכירות
ניהול תהליך הגבייה מלקוחות לרבות גביית כסף, אובליגו לקוח, גיול חובות, ימי אשראי וביטחונות
דרישות התפקיד:
ניסיון של 3+ שנים במכירות שטח – עדיפות מתחום המזון/קולינריה
יכולת ניהול משא ומתן ושכנוע ברמה גבוהה
רישיון נהיגה בתוקף
שליטה ביישומי מחשב לניהול ואוריינטציה דיגיטלית
תואר ראשון יתרון",osem
סטודנט/ית למעבדה הסנסורית,Osem-Nestlé,Sderot,2026-06-22,https://www.osem-nestle.co.il/career/open-positions/404783,טכנולוגיה ואיכות,fulltime,"מפעל אסם נסטלה שדרות מגייס סטודנט/ית למעבדה הסנסורית
במסגרת התפקיד:
קבלה וקליטה של חומרי גלם עבודה על מחשב- תיעוד, איסוף, דוחות
איסוף וניתוח חומרי אנליזה
עזרה בביצוע עבודות תומכות במעבדה (בדיקות שקילה, בדיקות ריח וכדומה)
התרעה על חריגות ואי התאמות למנהלת המעבדה.
תיוק וכל עבודה אדמיניסטרטיבית אחרת שתדרש במעבדה
דרישות התפקיד
סטודנט/ית להנדסה כימית/ביוטכנולוגיה/ביולוגיה/מזון- חובה.
יישומי OFFICE ברמה גבוהה
יסודיות, חריצות ודיוק
זמינות לעבודה 3 ימים בשבוע
הגעה עצמאית",osem
מהנדס/ת תהליך טבעול צבר,Osem-Nestlé,Kiryat Gat,2026-06-22,https://www.osem-nestle.co.il/career/open-positions/404037,הנדסה,fulltime,"מפעל צבר טבעול מגייס מהנדס/ת תהליך צבר טבעול לתפקיד שכולל
תכנון וביצוע פרויקטים תהליכיים לצורך שיפור וייעול טיפול ופתרון בעיות טכניות בתהליך הייצור הדרכה טכנית לעובדים ומנהלים ולידציה של ציוד ותהליכים חדשים ניהול תהליכי CIP – אופטימיזציה, ולידציה והטמעה ביצוע משימות הנדסיות שונות
דרישות התפקיד : תואר בהנדסה כימית / הנדסת מכונות - חובה ניסיון בתעשיית המזון / הפארמה / תעשייה תהליכית אחרת - חובה ידע וניסיון בעבודה עם מערכות בקרה HMI ידע וניסיון בקריאה ובהכנת שרטוטי תהליך P&ID שליטה טובה באנגלית
המפעל בקרית גת, נדרשת הגעה עצמאית",osem
סטודנט/ית לשיווק לחטיבת המאפה,Osem-Nestlé,Hevel Modiin,2026-06-22,https://www.osem-nestle.co.il/career/open-positions/403775,שיווק,fulltime,"קבוצת אסם נסטלה מגייסת סטודנט/ית לשיווק לחטיבת המאפה!תמיכה לוגיסטית ותפעולית במהלכים שיווקיים ופעילות שיווק שוטפת
תמיכה בפעילויות של השקת מוצר
ניתוחי שוק, היכרות עם המתחרים וניתוח מבצעים
מעקב אחר חומרי שיווק שונים באנגלית ותרגומים לשוק המקומי
עבודה מול יחידות שונות באסם
דרישות התפקיד
סטודנט/ית בתחומי השיווק שנה ג' ומעלה - חובה
סטודנט/ית לתואר שני- יתרון משמעותי
ניסיון קודם בעולמות השיווק - יתרון
אנגלית ברמה גבוהה (כתיבה ודיבור)
אקסל ברמה טובה מאוד, יכולות אנליטיות
זמינות לעבודה לפחות 3 פעמים בשבוע
נכונות למשרה זמנית
המשרה באזור תעשיה חבל מודיעין, שוהם. נדרשת הגעה עצמאית",osem
מאמנ.ת קפה ואפייה מקצועי משרת שטח באזור הדרום,Osem-Nestlé,Hevel Modiin,2026-06-22,https://www.osem-nestle.co.il/career/open-positions/403877,מכירות,fulltime,"קפה ומאפה מעוררים לכם.ן את החושים? אסם נסטלה פרופשיונל מגייסת מאמנ/ת קפה ואפייה מקצועי לאזור באר שבע, אילת וים המלח. התפקיד כולל ביצוע הדרכות בריסטה ואפייה מקצועיות ללקוחות. גיוס לקוחות חדשים לצד תמיכה וליווי בלקוחות קיימים. הטמעת שיטות עבודה בנק' האפייה והקפה. עמידה ביעדי-מכירות והעמקת המכירות עפ""י יעדי החברה. ניהול לו""ז ויכולת חלוקת זמן בין הלקוחות והקטגוריות השונות. דרישות התפקיד ניסיון קודם בעולמות הקפה כולל הבנה בתערובות קפה, ציוד (מכונות קפה, מטחנות וכו) ועבודת הבריסטה – חובה. ניסיון קודם באפייה/קונדיטוריה או בעולם המזון בתפקיד דומה – חובה ניסיון בעבודת מכירות שטח ושירות לקוחות – חובה רישיון נהיגה בתוקף – חובה ידע טכני בסיסי בציודים (מכונות קפה ותנורי אפיה) כגון כיוון תוכניות אפייה, טיפול ראשוני בתפריטי מכונות קפה וכיוון ומטחנות. זמינות לטיפול בבעיות דחופות בימי שישי וערבי חג בהתאם לצורך משרה באזור הדרום מגורים בבאר שבע והסביבה נכונות  לנסיעה פעם בשבוע לאילת",osem
סטודנט/ית למחלקת הבטחת איכות למפעל הבמבה,Osem-Nestlé,Kiryat Gat,2026-06-22,https://www.osem-nestle.co.il/career/open-positions/403700,טכנולוגיה ואיכות,fulltime,"מפעל אסם קרית גת מגייס סטודנט/ית למחלקת הבטחת איכות
במסגרת התפקיד:
דיגום מיקרו ברחבי המפעל כחלק מתוכנית בטיחות מזון מפעלית.
ניהול תוכניות המעקב המפעליות שמטרתן אימות ביצוע ויישום תוכניות ערכים תזונתיים ומבדקים פנימיים.
תמיכה בניהול מערכות איכות- תיקוף הוראות עבודה וסטנדרטים.
תמיכה בביצוע מבדקים בקווים בהתאם לתוכנית שנתית + תקשור פערים
ניתוח דוחות ומגמות לשיפור המוכנות היומיומית
סיוע בנושאים שוטפים רלוונטים למחלקה
דרישות התפקיד
סטודנט/ית להנדסה כימית/ביוטכנולוגיה/ביולוגיה/מזון- חובה.
זמינות לעבודה 3 ימים בשבוע
שליטה ביישומי OFFICE
אנגלית ברמה טובה
המפעל נמצא בקרית גת, נדרשת הגעה עצמאית",osem
מאמנ.ת אפייה באזור הדרום,Osem-Nestlé,Hevel Modiin,2026-06-22,https://www.osem-nestle.co.il/career/open-positions/403686,מכירות,fulltime,"קבוצת אסם סחר מגייסת מאמנ.ת אפייה לתפקיד שטח באזור הדרום
שכולל
הובלת תהליכי הדרכה, מכירה ותמיכה מקצועית באפייה, תוך שמירה על איכות המוצרים
הדרכת אופים בנקודות מכירה על אפייה, התפחה, תכנון סדרי עבודה ושיטות עבודה תקניות.
חניכה וליווי מקצועי ללקוחות קיימים וחדשים.
הבטחת איכות המאפים בתהליך ההכנה והאפייה.
ניהול תפעולי בנקודות מכירה , מענה לבעיות בשטח, כולל תקלות טכניות בסיסיות בציוד אפייה.
עמידה ביעדים והגדלת מגוון המוצרים.
דרישות התפקיד
ניסיון קודם באפייה/קונדיטוריה  – חובה
תודעת שירות גבוהה ויחסי אנוש טובים
זיקה לעבודה בסביבה טכנולוגית
ניסיון בעבודת מכירות שטח ושירות לקוחות – יתרון
כישורי הדרכה, לימוד וחניכה של לקוחות בנושא אפיה
רישיון נהיגה בתוקף – חובה
משרת שטח באזור הדרום",osem
מדריך/ה מרכז מבקרים במבה,Osem-Nestlé,Kiryat Gat,2026-06-22,https://www.osem-nestle.co.il/career/open-positions/402646,שיווק,fulltime,"מרכז המבקרים של מפעל במבה מקבוצת אסם נסטלה מחפש מדריך/ה!
הדרכת סיורי קבוצות מבקרים בשכבות גיל מגוונות
הפעלת בובה בתחפושת של תינוק הבמבה
עבודה אדמיניסטרטיבית על פי הצורך
גבייה בחנות המזכרות
פריקת סחורה וסידור החנות הכנת מארזים אחריות על נראות וניקיון האביזרים והסביבה במרכז המבקרים דרישות התפקיד
ניסיון בהדרכה (קייטנות, תנועת נוער, צבא) – יתרון!
יכולת עמידה מול קהל, אנרגטיות
הכרת תוכנות ה- OFFICE
עבודה במשמרות: 08:30-14:30 /  14:30-20:30
זמינות ל3/4 ימים בשבוע
מינימום שתי משמרות ערב בשבוע
יום שישי – לסרוגין
העבודה במפעל במבה בקרית גת (נדרשת הגעה עצמאית)",osem
יועצ/ת תזונה למרכז ליעוץ תזונתי של חברת מטרנה אסם נסטלה,Osem-Nestlé,Maabarot,2026-06-22,https://www.osem-nestle.co.il/career/open-positions/402302,טכנולוגיה ואיכות,fulltime,"המרכז לייעוץ תזונתי של חברת מטרנה מגייס יועצ/ת תזונה לתפקיד שכולל: מתן מענה מקצועי בנושאים שונים ללקוחות בנושאי תזונה, ייעוץ ומידע כללי יכולת הבנה של צורכי הלקוחות מציאת פתרונות יצירתיים תוך שמירה על ערכי החברה השתתפות בכנסים מקצועיים דרישות התפקיד דיאטנ/ית בעל/ת תואר ראשון בתזונה – חובה ניסיון בתפקיד דומה- יתרון שליטה מלאה ב- OFFICE חובה נכונות למשרה מלאה, 8:00- 17:00 העבודה בסמוך לבית הלוי, נדרשת הגעה עצמאית",osem
