title,company,location,date,deadline,url,department,workplace_type,staff_type,internal_external,description,requirements
עובד/ת תחזוקה (JB-1306),אוניברסיטת תל אביב,תל אביב,2026-05-18,2026-05-24,https://www.tau.ac.il/JB-1306/position/2026,"הספרייה למדעי החברה, לניהול ולחינוך ע""ש ברנדר-מוס",onsite,administrative,חיצוני,"ביצוע עבודות תחזוקה ותפעול שוטף בבניין הספרייה , כולל :
איתור תקלות ותיקונן.
הזמנת בעלי מקצוע ופיקוח על קבלנים.
טיפול במפגעים ובבעיות בתחום הבטיחות.
סיוע בפיקוח על ניקיון הבניין ועל עבודתם של עובדי הניקיון.
סיוע בארגון אירועים, טקסים ופעילויות מגוונות בספרייה.
מתן שירות לסגל ולסטודנטים במכלול הנושאים שבטיפול.
ארגון אולמות הספרייה חדרי הלימוד בספרייה והציוד המותקן בהם, לרבות טיפול בתחזוקתו.
פינוי, שינוע וסחיבה של משאות כבדים.
דיווח על תקלות באמצעות המערכת הממוחשבת.
השתתפות בפרויקטים שונים של הספרייה ובצוותי העבודה הפועלים בספרייה.
ביצוע מטלות נוספות בהתאם לצורך וע""פ הנחיית הממונים.","השכלה תיכונית/מקצועית מלאה- חובה.
ידע טכני וניסיון בעבודה בתחום האחזקה.
יכולת איתור תקלות וביצוע תיקונים קלים.
כושר גופני טוב.
רישיון נהיגה.
ידע בסיסי בעבודה עם מערכות ממוחשבות.
ידע ויכולת תפעול של מכשירים ומערכות מולטימדיה.
ידיעה טובה של השפה העברית ויכולת תקשורת בשפה האנגלית.
יכולת עבודה עצמאית והשתלבות בצוות.
יכולת עבודה בעומס ובלחץ.
תודעת שירות גבוהה ויחסי אנוש מעולים.
הערה: התפקיד כרוך בעבודה במשמרות.
ביצוע תורנויות בימי שישי, ערבי חג וחול המועד וביצוע שעות נוספות בהתאם לצורך."
מהנדס/ת חשמל (JB-1180),אוניברסיטת תל אביב,תל אביב,2026-05-18,2026-05-24,https://www.tau.ac.il/position/JB-1180/2025,אגף הנדסה ותחזוקה,onsite,administrative,חיצוני,"ניהול פרויקטים בתחומי החשמל.
הובלת תהליכים בתחומי התייעלות אנרגטית וצריכת חשמל.
ביצוע פרויקטים ותהליכים ברשת המתח הגבוה של האוניברסיטה.
ניהול ופיקוח על קבלני חשמל.
טיפול במערכות המונים של האוניברסיטה.
מעקב וביצוע תחזוקה למערכות בחירום הכוללות גנרטורים ו-UPS.
טיפול וביצוע פרויקטים בתחום חשמל החירום.
פיקוח וניהול תכנית טיפולי מתח גבוה.
ביצוע מטלות נוספות בהתאם לצורך.","מהנדס/ת חשמל.
ניסיון בעבודה עם מערכות משולבות גנרטורים ומערכת סנכרון.
ניסיון בעבודה עם מערכות אל פסק מרכזיות.
ניסיון של שנתיים לפחות בביצוע ובניהול פרויקטים ותהליכים בתחומי חשמל באתר דומה לקמפוס אוניברסיטאי, רצוי במגזר הציבורי.
חשמלאי מתח גבוה - יתרון .
ניסיון בהפעלת קבלנים.
ניסיון בעבודה עם מערכות ממוחשבות ושליטה בתוכנות OFFICE.
ידיעת השפה העברית על בוריה וידיעת השפה האנגלית ברמה טובה.
יכולת בנייה והובלה של תהליכי עבודה.
יכולת עבודה בסביבת מרובת ממשקים והתמודדות עם מצבים מורכבים.
יכולת התמודדות עם עומס משימות ועמידה בלוחות זמנים.
יוזמה, עצמאות, ראייה מערכתית ויכולת ניהול מו""מ.
יחסי אנוש טובים ותודעת שירות גבוהה.
הערה: נדרשת נוכנות לביצוע כונניות ושעות נוספות בהתאם לצורך."
רכז/ת תלמידים/ות- בית הספר לקולנוע וטלוויזיה- הפקולטה לאמנויות (JB-1335),אוניברסיטת תל אביב,תל אביב,2026-05-18,2026-05-20,https://www.tau.ac.il/JB-1335/2026/position,"ביה""ס לקולנוע ולטלוויזיה/ הפקולטה לאמנויות",onsite,administrative,חיצוני,"טיפול בענייני תלמידים לתואר ראשון ושני כולל:
מתן מענה שוטף לפניות מועמדים, תלמידים וסגל ביה""ס, קבלת קהל ומתן ייעוץ והכוונה.
סיוע בהכנת הידיעון, ארגון החומר הלימודי, רישום לקורסים, דיווח ציונים והזנת נתונים .
קשר עם אגף רישום ומינהל תלמידים וריכוז ועדות הקבלה.
בדיקה ומעקב אחר מילוי חובות אקדמיים וטיפול בסגירת התואר.
סיוע בקביעת מערכת השעות ותיאום לוח הבחינות מול מזכירות הפקולטה.
טיפול במקרים חריגים, ריכוז ועדות הוראה ומעקב אחר החלטותיהן.
סיוע בארגון כנסים, אירועים וטקסים.
ביצוע מטלות נוספות ככל שיידרש.","תואר אקדמי – רצוי. תעודת בגרות מלאה – חובה.
ניסיון של מספר שנים בתפקיד אדמיניסטרטיבי.
ניסיון בתחום מינהל תלמידים – יתרון.
ידיעת השפה העברית על בוריה ושליטה באנגלית ברמה טובה מאוד, לרבות יכולת הבעה ותכתובת בשפות אלה.
ניסיון בעבודה עם מערכות ממוחשבות, כולל שליטה מלאה ביישומי OFFICE.
ידע בתוכנות גלבוע וממת”א – יתרון.
הכרת הנהלים והתקנונים האוניברסיטאיים ושליטה ב-ERP – יתרון.
יכולת עבודה עצמאית והשתלבות בעבודה בצוות.
יכולת התמודדות עם עומס וריבוי משימות.
יוזמה, כושר תיאום וארגון, סדר, דייקנות ויכולת מעקב.
תודעת שירות גבוהה ויחסי אנוש מעולים.
הערה: נדרשת נכונות לעבודה בשעות נוספות בהתאם לצורך."
מנהל/ת חשבונות מדור בקרה והתאמות-יחידת החשבות (JB-1328),אוניברסיטת תל אביב,תל אביב,2026-05-18,2026-05-19,https://www.tau.ac.il/position/jb-1328/2026,אגף הכספים כלכלה ותקציבים,onsite,administrative,חיצוני,"ביצוע התאמות בנקים והתאמות כרטיסי אשראי כולל רישום פקודות יומן ידניות לסוגיהן.
ביצוע התאמות של הכנסות מתשלומים שונים.
טיפול שוטף ובירורים מול הבנקים, חברות האשראי ויחידות האוניברסיטה.
קיום ממשקים שוטפים עם גורמים באגף ובקמפוס.
ביצוע מטלות נוספות על פי הנחיית מנהלת המדור וככל שיידרש.","תואר אקדמי-רצוי. תעודת בגרות מלאה-חובה.
סוג 2 לפחות בהנהלת חשבונות או תואר אקדמי בתחומי חשבונאות/כלכלה או בתחום דומה.
ניסיון של מספר שנים בתפקיד אדמיניסטרטיבי.
ניסיון של מספר שנים בהנהלת חשבונות ממוחשבת. ידע וניסיון בתחום ההתאמות - יתרון.
ניסיון בעבודה עם מערכות ממוחשבות ושליטה בתוכנות OFFICE, לרבות EXCEL.
ידיעת השפה העברית על בוריה וידיעת השפה האנגלית ברמה טובה.
הכרת הנהלים והתקנונים האוניברסיטאיים ושליטה ב-ERP – יתרון.
יכולת עבודה עצמאית והשתלבות בעבודה בצוות.
יכולת התמודדות עם עומס וריבוי משימות.
יוזמה, כושר תיאום וארגון, סדר, דייקנות ויכולת מעקב.
תודעת שירות גבוהה ויחסי אנוש מעולים.
הערה: נדרשת נכונות לעבודה בשעות נוספות בהתאם לצורך"
"מתאם/ת מחשוב ורכז/ת מולטימדיה ואתרים- ביה""ס לעבודה סוציאלית/הפקולטה למדעי החברה (JB-1260)",אוניברסיטת תל אביב,תל אביב,2026-05-18,2026-05-19,https://www.tau.ac.il/JB-1260/2025/position,בית הספר לעבודה סוציאלית,onsite,administrative,חיצוני,"אחריות כוללת לתפעול ותחזוקה שוטפת של מערכות המולטימדיה בביה""ס (מקרנים, מערכות שמע, מיקרופונים, מגברים ומיקסרים וכו'), לרבות עבודה עם ציוד מולטימדיה ומערכות שליטה מורכבות ותכנותן.
אחריות לפיתוח, עדכון, הפעלה ותחזוקה של אתר האינטרנט של ביה""ס, לרבות בניית טפסים והטמעתם באתר. איסוף ועיבוד ראשוני של הנתונים שנאספו מהטפסים.
צילום והקלטת אירועי ביה""ס .
בניית דפי WIX לסגל ביה""ס.
סיוע בעריכה ועדכון ידיעון ביה""ס.
סיוע, הדרכה ותמיכה במשתמשים בתפעול ציוד המולטימדיה.
תמיכה בנושאי מחשוב ומולטימדיה בכנסים ושיעורים.
קשר עם מגוון גורמים באוניברסיטה ומחוצה לה.
ביצוע מטלות נוספות ככל שיידרש.","תואר אקדמי/טכנאי/הנדסאי בתחום רלוונטי- רצוי. תעודת בגרות מלאה- חובה.
הכשרה פורמלית בתחום המחשבים.
ידע וניסיון בהפעלה ובתחזוקה של ציוד מחשבים ומולטימדיה.
ידע וניסיון בהקמת אתרי אינטרנט ובניהולם.
יכולת ניהול פרסומים ברשתות חברתיות. הכרת מערכת DROUPAL.
היכרות מעמיקה בנושא  HTML ,CSS- יתרון.
ידע בעריכת תמונות וסרטי וידאו - יתרון.
ידיעת השפה העברית על בוריה וידיעת השפה האנגלית ברמה טובה מאד.
שליטה מלאה במערכת הפעלה  WINDOWSובתוכנות OFFICE ויישומיהן.
יכולת למידה והתעדכנות מקצועית ויכולת עבודה עם מגוון רחב של צרכים טכנולוגיים.
יכולת עבודה עצמאית והשתלבות בצוות.
יכולת התמודדות עם ריבוי משימות ועומס.
יוזמה, סדר ודיוק, כושר תכנון ויכולת ארגון, תיאום ומעקב.
תודעת שירות גבוהה ויחסי אנוש מעולים.
הערה: נדרשת נכונות לעבודה בשעות נוספות עפ""י הצורך."
רכז/ת תלמידים וקבלה לתואר שני (JB-1338),אוניברסיטת תל אביב,תל אביב,2026-05-18,2026-05-19,https://www.tau.ac.il/JB-1338/position/2026,הפקולטה לניהול,onsite,administrative,פנימי,"אחריות כוללת לטיפול במועמדים ותלמידי התואר השני, כולל:
מתן מענה לפניות מועמדים, תלמידים ולסגל המורים, לרבות קבלת קהל, מענה ללידים ומתן ייעוץ והכוונה למועמדים.
מעקב אחר ההתקדמות האקדמית של התלמידים.
ארגון הבידינג, רישום לקורסים, טיפול במערכת השעות וייעוץ לתלמידים.
בדיקת פטורים, דיווח והזנת ציונים.
הפקת דוחות וניתוחם.
אחריות על לוח הבחינות.
הזנת נתונים במערכת מינהל התלמידים, מעקב אחר מילוי חובות אקדמיים, ריכוז החומר והעברתו לוועדת הוראה ויישום החלטות ועדת הוראה.
טיפול בסגירת תארים וארגון טקסי מסיימים.
ביצוע מטלות נוספות ככל שיידרש.","תעודת בגרות מלאה-חובה. תואר אקדמי-רצוי.
תישקל מועמדותם של עובדים ותיקים שאינם עומדים בדרישת ההשכלה ועברו השתלמויות מקצועיות רלוונטיות לתפקיד.
ניסיון של מספר שנים בתפקיד אדמיניסטרטיבי. רצוי בתחום מינהל תלמידים.
ניסיון בעבודה עם מערכות מינהל תלמידים ו- מערכת ה- CRM - יתרון.
ניסיון בעבודה עם מערכות ממוחשבות ושליטה בתוכנות OFFICE ובאינטרנט.
ידיעת השפה העברית על בוריה, כולל יכולת ניסוח בכתב ובעל פה וידיעה טובה של השפה האנגלית.
הכרת הנהלים והתקנונים האוניברסיטאיים ושליטה ב-ERP – יתרון.
יכולת עבודה עצמאית והשתלבות בצוות.
יכולת התמודדות עם עומס וריבוי משימות.
יוזמה, כושר תיאום ויכולת ארגון ומעקב.
תודעת שירות גבוהה ויחסי אנוש מעולים.
הערה: העבודה לעיתים מתבצעת בשעות הבוקר המאוחרות עד אחה""צ ובימי שישי, עפ""י הצורך.
נדרשת גם נכונות לשעות נוספות בהתאם לצורך."
אחראי/ת טכני/ת מעבדות הוראה לביו-אלקטרוניקה (JB-1254),אוניברסיטת תל אביב,תל אביב,2026-05-18,2026-05-19,https://www.tau.ac.il/position/JB-1254/2025,הפקולטה להנדסה,onsite,administrative,חיצוני,"אחריות כוללת על תפעול ותחזוקת המעבדות, כולל הפעלת מכשירי מדידה אלקטרוניים לניטור וניתוח ממוחשב של מדדים פיזיולוגיים.
תמיכה שוטפת במכשור ובתוכנות ההפעלה במעבדות ההוראה, כולל טיפול בתקלות בזמן אמת, בדיקה והגדרה של ציוד נדרש, ורכש של ציוד חדש ומתכלה.
פיתוח והטמעת מערכי ניסוי חדשים, תכנון מערכים קיימים ושדרוגם לפי הצורך, כולל אפיון דרישות חומרה ותוכנה.
הדרכת סטודנטים בביצוע ניסויים והכשרתם לעבודה עם ציוד המעבדה, סיוע בפעילויות Hands-On במסגרת הקורסים.
הגדרת נהלי בטיחות והטמעתם בקרב מדריכים וסטודנטים.
ליווי,מעקב ותמיכה בפרויקטים בשיתוף התעשייה, חוקרים באוניברסיטה ובתי חולים.
ביצוע מטלות נוספות עפ""י הצורך.","תואר ראשון בהנדסה או במדעים מדויקים.
ניסיון בתפעול מעבדות הוראה ו/או בהדרכת פרויקטים - יתרון.
היכרות מעמיקה עם ציוד מדידה אלקטרוני, ובפרט חיישנים למדדים פיזיולוגיים.
ניסיון בעבודה עם לוחות פיתוח ובקרים (Arduino, ESP32, Raspberry Pi Pico) כולל תוכנה.
שליטה בסביבת פיתוח LabView ובממשקי תוכנה נוספים לחיבור חומרה.
ידיעת השפה העברית על בוריה וידיעת השפה האנגלית ברמה גבוהה.
יכולת עבודה עצמאית והשתלבות בצוות.
יכולת הדרכה.
חשיבה יצירתית, יוזמה, יכולת ארגון, סדר ודיוק.
יכולת התמודדות עם ריבוי משימות ועומס.
תודעת שירות גבוהה ויחסי אנוש מעולים
הערה: נדרשת נכונות לעבודה בשעות נוספות עפ""י הצורך."
"רכז/ת בכיר/ה לרכש חו""ל- מדור רכש יבוא (JB-1244)",אוניברסיטת תל אביב,תל אביב,2026-05-18,2026-05-19,https://www.tau.ac.il/JB-1244/position/2025,אגף הכספים כלכלה ותקציבים,onsite,administrative,חיצוני,"ביצוע רכש חו""ל של טובין ושירותים בהתאם לצרכי האוניברסיטה, כולל:
טיפול שוטף במשלוחי ייבוא אוויריים וימיים לישראל.
פתיחת הזמנות במערכת ERP, כולל הזמנת טובין מאתרי אינטרנט ומעקב אחר ההזמנות.
הזמנת ציוד וחומרים למעבדות.
קיום קשר עם ספקים, לרבות ניהול מו""מ בהתאם לצורך, וקשר עם משלחים ועם עמילי המכס.
טיפול בחוזי התקשרות עם ספקים.
בדיקת חיובים וביצוע תשלומי מט""ח לחו""ל.
ביצוע מטלות נוספות ככל שיידרש.","תואר אקדמי. רצוי באחד מתחומים אלה: לוגיסטיקה או מדעי החיים.
תעודת פקיד רישוי מכס - יתרון.
ניסיון של 4 שנים לפחות בתפקיד רלוונטי, הכולל עבודה מול חברות לעמילות מכס, חברות שילוח בינלאומי ובלדרות.
ידע בחוקי הייבוא והייצוא (צווים, תקנות ונהלים).
ידע מוכח במכלול נושאי מט""ח ובשיטות תשלום בסחר בינלאומי, לרבות  פתיחת מכתבי אשראי בנקאיים לייבוא סחורות.
ידע בסחר אלקטרוני.
ניסיון בעבודה עם מערכות ממוחשבות ושליטה בתוכנות OFFICE .
הכרת הנהלים והתקנונים האוניברסטאיים ושליטה ב-ERP- יתרון.
ידיעת השפה העברית על בוריה ושליטה בשפה האנגלית ברמה טובה מאד, כולל יכולת הבעה ותכתובת בשפות אלו.
יכולת עבודה עצמאית והשתלבות בעבודה בצוות.
יוזמה, סדר ודיוק, כושר תכנון ויכולת ארגון, תיאום ומעקב.
יכולת ניהול משא ומתן.
יכולת התמודדות עם עומס משימות ועמידה בלוחות זמנים.
תודעת שירות גבוהה ויחסי אנוש מעולים.
הערה: נדרשת נכונות לעבודה בשעות נוספות עפ""י הצורך."
"גיוס סגל אקדמי בכיר לשנה האקדמית תשפ""ז (2026-2027)",אוניברסיטת תל אביב,תל אביב,2026-05-18,2026-06-05,https://www.tau.ac.il/academic-Position/URL228,"החוג לניהול מצבי חירום ואסון, בית הספר לבריאות הציבור, הפקולטה לרפואה ולמדעי הבריאות ע""ש גריי",onsite,academic_staff,חיצוני,,"גיוס סגל אקדמי בכיר לשנה האקדמית תשפ""ז (2026-2027)
החוג לניהול מצבי חירום ואסון, בית הספר לבריאות הציבור, הפקולטה לרפואה ולמדעי הבריאות ע""ש גריי
,
אוניברסיטת תל אביב, מזמין חוקרות וחוקרים מצטיינים להגיש מועמדות למשרת סגל אקדמי בכיר במסלול הרגיל בדרגת מרצה בכיר או פרופסור חבר בהיקף 100% משרה."
